,Platform,Number,Store,Address,Addr,Review_score,Review_counts,ID,Date,Review_text,Time
416,Kakao,29,용토끼,서울 동대문구 휘경로10길 38 103호 (이문동),서울 동대문구,4.8,25.0,mmmj,2023.08.04.,"곰돌이 브리오슈 최고예요. 라즈베리 크림이 그럴게 산뜻할 수가 없어요. 새콤달콤 정말 맛있었어요. 
단팥을 직접 만드셔서 너무 달지 않아요. 
찾아가는 길이 약간 복잡했지만 여러 번 가보면 잘 찾아갈 수 있을 것 같아요.",2024-04-06 - 19:36:11
417,Kakao,29,용토끼,서울 동대문구 휘경로10길 38 103호 (이문동),서울 동대문구,4.8,25.0,꺄랄루,2023.06.17.,"동대문문화재단에서 지원해주신 등산 프로젝트에 점심메뉴로 제공되었어요 !
햄치즈바질토, 단팥크림빵 모두 정말 맛있었습니다 🥹",2024-04-06 - 19:36:40
419,Kakao,29,용토끼,서울 동대문구 휘경로10길 38 103호 (이문동),서울 동대문구,4.8,25.0,페테르부르크,2023.04.28.,"wa...wa...
왜 이문동에 계시나요? 너무 감사합니다 사장님.. 충성 고객 되겠습니다",2024-04-06 - 19:37:19
420,Kakao,29,용토끼,서울 동대문구 휘경로10길 38 103호 (이문동),서울 동대문구,4.8,25.0,jj,2023.03.23.,비건치고 맛있고 이게 아니라 그냥 진짜로 맛있어요 진짜 무슨일이죠,2024-04-06 - 19:37:48
422,Kakao,29,용토끼,서울 동대문구 휘경로10길 38 103호 (이문동),서울 동대문구,4.8,25.0,감자,2022.11.18.,소금빵 존맛..! 빵 내용물이 엄청 실해요!,2024-04-06 - 19:38:37
425,Kakao,29,용토끼,서울 동대문구 휘경로10길 38 103호 (이문동),서울 동대문구,4.8,25.0,ㅌㄹ,2022.08.28.,"소금빵 시리즈 정말 너무너무 맛있다
오래오래 번창하셔서 사라지지 않았으면 좋겠다...",2024-04-06 - 19:39:46
426,Kakao,29,용토끼,서울 동대문구 휘경로10길 38 103호 (이문동),서울 동대문구,4.8,25.0,앩옹,2022.07.16.,"찾았다 내 인생 빵집. 사장님이 친절하고 빵이 맛있어요! 
다들 꼬옥 이태리 소금빵 먹어주면 돼.. 🫶
물론 다른빵도 맛있어요!",2024-04-06 - 19:40:05
427,Kakao,29,용토끼,서울 동대문구 휘경로10길 38 103호 (이문동),서울 동대문구,4.8,25.0,유당불내증 외계인,2022.05.08.,말해뭐해...최고입니다 이문동 빵 불모지에 한 줄기 소금같은 비건빵집이라니... 담백하고 엄청 달지않아서 좋아요 곰돌이 브리오슈 너무 맛있어요 ㅠㅠ 주말에만 하시는게 아쉬울 정도입니다. 사장님 번창하세요!!!,2024-04-06 - 19:40:25
428,Kakao,29,용토끼,서울 동대문구 휘경로10길 38 103호 (이문동),서울 동대문구,4.8,25.0,후기남기기는 재밌찡,2022.04.10.,"외맛게에서 보고 가야지 가야지 하다가 이제야 가봤당. 가격도 좋고 맛있당~~~
사장님도 짱짱친절하당~~~ 인스타 안하는 내게 직접 문자로 사진찍어보내주신거 정말 감동입니당~~~",2024-04-06 - 19:40:44
429,Kakao,29,용토끼,서울 동대문구 휘경로10길 38 103호 (이문동),서울 동대문구,4.8,25.0,ㅅㅇ,2022.01.23.,"비건빵 처음 먹어봤는데 정말 맛있었어요
저는 빵 스콘 전종류 다 먹어봤는데 다 맛있어요
제 최애는 단팥크림빵과 마늘스콘인데요!
단팥크림빵은 먹느라 바빠서 사진을 못 찍었지만 사장님께서 팥까지 직접 쒀서 만드셨다더라고요 ㅠㅠ
너무 맛있어서 순삭해버렸답니다!
꼭 한 번 가보세요",2024-04-06 - 19:42:26
430,Kakao,30,뽀르뚜아경희대점,서울 동대문구 이문로 32 (휘경동),서울 동대문구,2.7,26.0,호롤롤로,2023.12.18.,난 갠적으로 좋았음.,2024-04-06 - 19:42:45
431,Kakao,30,뽀르뚜아경희대점,서울 동대문구 이문로 32 (휘경동),서울 동대문구,2.7,26.0,예의바르지만솔직한곰,2023.12.17.,진짜 튼튼한데 배탈남………,2024-04-06 - 19:43:05
432,Kakao,30,뽀르뚜아경희대점,서울 동대문구 이문로 32 (휘경동),서울 동대문구,2.7,26.0,김승재,2023.11.12.,"1점도 아깝습니다. 빼빼로는 다 굳어서 먹기도 힘들고, 말차쿠키는 오래된 거라서 교환해준다는 스티커 붙여져있는걸 그냥 떼서 줬습니다. 그날 너무 바빠서 암말도 안하고 넘어갔는데, 심지어 한 입 먹어보니 타이어 냄새가 나서 도저히 먹을 수가 없을 정도입니다. 절대 가지 마세요",2024-04-06 - 19:43:25
433,Kakao,30,뽀르뚜아경희대점,서울 동대문구 이문로 32 (휘경동),서울 동대문구,2.7,26.0,전농동주민,2023.10.06.,포도 생크림 케익을 구매하였습니다. 가격은 3만원. 건너편에 뜨레쥬르도 있었지만 일부러 팔아주고 싶어 이곳을 찾았습니다. 솔직히 가격은 저렴한 편은 아니더군요. 저는 서비스로주신 소금빵도 잘 담아서 기분좋게 나왔습니다. 그런데 집에와서 커피를 내리고 케익을 한조각 먹으려 꺼내보았는데 청포도 한쪽 케익면이 누가 손가락으로 찍어먹은듯한 자국이 있더군요. 손가락 두개로 훑은 모습입니다. 싼값이면 그냥 그러려니 하겠는데 3만원짜리 케익에 저런식으로 되어있으니 기분이 조금 그렇네요. 다시가서 컴플레인 하는것도 귀찮고 여기에 후기 남겨봅니다. 이런식이라면 다시는 방문할 의사가 없습니다.,2024-04-06 - 19:43:44
434,Kakao,30,뽀르뚜아경희대점,서울 동대문구 이문로 32 (휘경동),서울 동대문구,2.7,26.0,고영희,2023.05.13.,크림치즈먹물바게뜨 크림치즈 낭낭하고 맛있어요 :),2024-04-06 - 19:44:04
435,Kakao,30,뽀르뚜아경희대점,서울 동대문구 이문로 32 (휘경동),서울 동대문구,2.7,26.0,냠,2023.05.07.,처음으로 글 남깁니다.. 사장님이 진짜 불친절하시네요.. 계산대에 서 있는데도 계속 통화만 하고 계산은 안 해주시고.. 빵 담는 쟁반의 유산지는 닦아서 재사용 하시더라고요. 매장에는 날파리가 날아다니고… 다시는 안 갑니다.,2024-04-06 - 19:44:23
436,Kakao,30,뽀르뚜아경희대점,서울 동대문구 이문로 32 (휘경동),서울 동대문구,2.7,26.0,white,2023.05.06.,이건 돈줘도 안먹을듯…..사장님이 인성이 나락이길래 그 만큼 맛이라도 있는줄…여기서 먹으면 강철 면역 소화기관은 얻거나 천국행 티켓 둘중 하나는 얻을 수 있겠네요,2024-04-06 - 19:44:43
437,Kakao,30,뽀르뚜아경희대점,서울 동대문구 이문로 32 (휘경동),서울 동대문구,2.7,26.0,ㅂ,2023.04.04.,제발 맨손으로 빵 좀 잡지 마세요 집게로 포장하세요....포장하는 작업대도 항상 더럽고... 위생만 신경쓰면 좋을 동네 빵집...ㅎ,2024-04-06 - 19:45:02
438,Kakao,30,뽀르뚜아경희대점,서울 동대문구 이문로 32 (휘경동),서울 동대문구,2.7,26.0,쩝,2023.02.27.,위생이 너무 별로에요..,2024-04-06 - 19:45:22
439,Kakao,30,뽀르뚜아경희대점,서울 동대문구 이문로 32 (휘경동),서울 동대문구,2.7,26.0,프로리뷰꾼,2023.02.02.,호우타르트 5500원 비추. 딱딱하고 이에 물엿이 달아 붙어 먹기 안 좋음. 먹다가 버림. 관상용임.,2024-04-06 - 19:45:41
440,Kakao,30,뽀르뚜아경희대점,서울 동대문구 이문로 32 (휘경동),서울 동대문구,2.7,26.0,lime,2022.12.23.,"ㅠ크레이프 기대했는데, 개인적 후기입니다만 터벅하고 느끼하네요. 빌리엔젤꺼 사먹을걸 그랬어요. 그특유의 층층이 살아있는 맛이없어요. 크레이프가아닌 퍼석한빵을 겹겹이쌓고 생크림도 너무많이바른 느낌. 빵이 뿔은듯한.. 이건 크레이프라고 보기힘들구 일반케잌보다도 빵이많다보니 맛이없네요. 다른빵들 시식은맛있었는데, 아래후기처럼 빵종류가 많다보니 복불복인듯해요..  저렴하지두않음ㅠ. 사장님 종류를 줄이시고 맛에 신경을 쓰시고, 가격은 좀 낯추시던지 하면 좋겠습니다.",2024-04-06 - 19:46:01
441,Kakao,30,뽀르뚜아경희대점,서울 동대문구 이문로 32 (휘경동),서울 동대문구,2.7,26.0,현서,2022.10.27.,"여기서 빵 자주 먹었었는데 장염 심하게 걸렸어요 처음에는 이유를 뽀르뚜아라고 생각안했는데
여기 빵 먹을때마다 배가 아프더라고요 
알바생들이 여기 더러우니 먹지말라고 하는것에 납득이 감 
그리고 여기 옛날에 알바 지원했었는데 사장님이 약간 나사 하나빠져있어요 저한테 합격했다 했다가 잠수 탔다가 다시 오라고 하다가.. 알바도 빡센거같아요 지원 웬만하면 하지마셈..",2024-04-06 - 19:46:21
442,Kakao,30,뽀르뚜아경희대점,서울 동대문구 이문로 32 (휘경동),서울 동대문구,2.7,26.0,ㅇㄱㅇ~~,2022.05.29.,"빵마다 퀄리티 차이가 좀 심함. 파바는 그냥저냥 평타는 하는데 여기는 들쭉날쭉..?
먹어보면서 업뎃할게여.
빵종류 많고 역이랑 가까워서 자주 감.

식빵류: 푸석푸석x 부드럽고 맛남 
(빵은 대채로 괜춘)
쿠키류: 요즘 트랜드랑 살짝 거리먼..? 쿠키류는 몇개빼구 거의 실패....
케잌: 가격대비 쏘쏘..... 큐브퍼즐만한 쪼그마한 케잌이 5900인데 맛은 그냥 평범... 쉬폰케잌 안좋아해서 그런진 모르겠지만..ㅜ",2024-04-06 - 19:46:40
443,Kakao,30,뽀르뚜아경희대점,서울 동대문구 이문로 32 (휘경동),서울 동대문구,2.7,26.0,ㅇ,2022.04.27.,"누가 영업시간 24라고 해놨읍
새벽에 좋다고 뛰어 나왔는데 6시반부터임

일단 맛집짐",2024-04-06 - 19:47:00
444,Kakao,30,뽀르뚜아경희대점,서울 동대문구 이문로 32 (휘경동),서울 동대문구,2.7,26.0,꾸끌지도후기참고,2022.03.05.,맛은 있지만 가격표 빵이름 매치 안되서 2점 내림,2024-04-06 - 19:47:19
445,Kakao,30,뽀르뚜아경희대점,서울 동대문구 이문로 32 (휘경동),서울 동대문구,2.7,26.0,루이비통,2022.02.27.,"별점 한 개 주기도 아까워요. 생크림 가득 든 빵을 먹고 싶어서 빵집에 들어갔는데 생크림빵이 한개도 없었어요 그래서 6천원짜리 생크림케이크를 샀어요 

그런데 거짓말하나도 안 보태고 빵이 너무 푸석푸석해서 빵을쪼개는데 힘이 들어가요. 진짜 생크림도 싸구려맛나고 빵도 오래된 것 같았어요 최악이었어요 정말최악",2024-04-06 - 19:47:39
446,Kakao,30,뽀르뚜아경희대점,서울 동대문구 이문로 32 (휘경동),서울 동대문구,2.7,26.0,르라,2022.02.19.,사장님이 친절해요~,2024-04-06 - 19:47:58
447,Kakao,30,뽀르뚜아경희대점,서울 동대문구 이문로 32 (휘경동),서울 동대문구,2.7,26.0,뇸뇸잉,2022.01.19.,못난이빵 진짜 맛있어욤,2024-04-06 - 19:48:18
448,Kakao,30,뽀르뚜아경희대점,서울 동대문구 이문로 32 (휘경동),서울 동대문구,2.7,26.0,동네사람8,2021.10.22.,벌써 내가 안지 10년이 지났지만 아직도 밀리지 않는 빵 맛,2024-04-06 - 19:48:37
449,Kakao,30,뽀르뚜아경희대점,서울 동대문구 이문로 32 (휘경동),서울 동대문구,2.7,26.0,.,2021.10.01.,"와진짜... 내가 웬만하면 빵은 하나도 안 남기고  다 먹는데.... 진짜 너무 맛이 없다 동물성 크림이래서 믿고 샀는데 동물성은 무슨 양초맛 나는 식물성크림 --; 역하고 느끼해서 결국 반도 못 먹고 버림
동물성이라고 하지나 말든가 왜 속여서 팖? 다신 안가 가격이 싼 것도 아니고",2024-04-06 - 19:48:57
450,Kakao,30,뽀르뚜아경희대점,서울 동대문구 이문로 32 (휘경동),서울 동대문구,2.7,26.0,.,2021.07.05.,포장 좀 해주세요... 파리도 막 날아다니는데,2024-04-06 - 19:49:26
452,Kakao,30,뽀르뚜아경희대점,서울 동대문구 이문로 32 (휘경동),서울 동대문구,2.7,26.0,찡긋,2021.02.05.,케익맛있구 무화과 캄파뉴? 무튼 그 호밀빵 개취 존맛탱,2024-04-06 - 19:50:06
453,Kakao,30,뽀르뚜아경희대점,서울 동대문구 이문로 32 (휘경동),서울 동대문구,2.7,26.0,족발당수,2020.11.09.,초코쿠키에서 냄새 납니다. 알바들 포스 입력 교육좀 시키시구요,2024-04-06 - 19:50:35
455,Kakao,30,뽀르뚜아경희대점,서울 동대문구 이문로 32 (휘경동),서울 동대문구,2.7,26.0,빵칼로리,2020.02.09.,알바들 손으로 시식 담음.. 빵도 손으로 집어서 옮김ㅋㅋㅋ 충격,2024-04-06 - 19:52:29
469,Kakao,33,케이크풀,서울 동대문구 답십리로 149 1층 (답십리동),서울 동대문구,4.5,12.0,신종민,2024.02.17.,"과일, 크림, 빵 너뮤 맛있어요.
선물용으로 구입했는데 모두 맛있다고 난리였습니다. 가격도 저렴하고 좋았어요.
특별한 날 아니더라도 케이크 생각나면 사먹으려구요
앞에 주차가 어렵지만 괜찮어요.
다음에 또 주문해서 먹을예정이에요.",2024-04-06 - 19:58:27
470,Kakao,33,케이크풀,서울 동대문구 답십리로 149 1층 (답십리동),서울 동대문구,4.5,12.0,아지라이더,2023.10.08.,"과일이 풍성하고 동물성 생크림이 잘 어울려요!
사장님도 친절하게 응대해주십니다",2024-04-06 - 19:58:47
471,Kakao,33,케이크풀,서울 동대문구 답십리로 149 1층 (답십리동),서울 동대문구,4.5,12.0,푸짜렐라,2023.08.09.,"생일케이크 하루전에 주문했는데 해주셨어요
과일이 엄청 가득이라 묵직합니다
생크림도 맛있고 최고에요!",2024-04-06 - 19:59:07
472,Kakao,33,케이크풀,서울 동대문구 답십리로 149 1층 (답십리동),서울 동대문구,4.5,12.0,deon,2022.11.04.,기대를 너무 했나봐요 내용물도 빈약하고 시트도 푸석하고 크림도 맛있지는 않았어요 ㅠㅠ… 친절하셔서 2점 드려요,2024-04-06 - 19:59:26
473,Kakao,33,케이크풀,서울 동대문구 답십리로 149 1층 (답십리동),서울 동대문구,4.5,12.0,.,2022.09.27.,시트랑 크림은 사실 그렇게 맛있는지 모르겠는데 과일이 엄청 실하게 들어있고 묵직해서 좋았어요.,2024-04-06 - 19:59:46
474,Kakao,33,케이크풀,서울 동대문구 답십리로 149 1층 (답십리동),서울 동대문구,4.5,12.0,en christo,2022.07.24.,"어머님 팔순 식사모임. 가족들 생크림 별로 안좋아해서 크지않으면서도 빈약해보이지 않는걸 찾다가 단가가 좀 있지만 여기 케이크로 선택했어요. 반전! 우리식구들 케잌칭찬은 처음이었어요. 케잌이 과일로 꽉!! 넣을수 있는만큼 최선을 다해 넣은것 같은 느낌이네요^^
로그인 싫어서 후기 잘 안남기는데 너무 고마운 마음에 남겨봅니다",2024-04-06 - 20:00:05
475,Kakao,33,케이크풀,서울 동대문구 답십리로 149 1층 (답십리동),서울 동대문구,4.5,12.0,알데하이드,2022.07.09.,친절하시고 톡도 잘 응대해주십니다 ㅎㅎ 케이크도 기대,2024-04-06 - 20:00:25
476,Kakao,33,케이크풀,서울 동대문구 답십리로 149 1층 (답십리동),서울 동대문구,4.5,12.0,메타메타몽몽,2022.04.22.,답십리 케이크 최고 맛집,2024-04-06 - 20:00:44
477,Kakao,33,케이크풀,서울 동대문구 답십리로 149 1층 (답십리동),서울 동대문구,4.5,12.0,리시안셔스,2022.02.12.,"너무 맛나요, 종류별로 다 먹어보고 있어요.",2024-04-06 - 20:01:04
478,Kakao,33,케이크풀,서울 동대문구 답십리로 149 1층 (답십리동),서울 동대문구,4.5,12.0,융,2022.01.22.,"답십리의 축복2..♡
크림도 느끼하지 않고 맛있고
특히 과일들어간 케이크는 많이 들어서 좋다.
케이크가 사이즈에 비해 가격대가 조금 있는 편인것같지만 카페 케이크보다 훨씬 맛있다",2024-04-06 - 20:01:23
479,Kakao,33,케이크풀,서울 동대문구 답십리로 149 1층 (답십리동),서울 동대문구,4.5,12.0,ms,2021.12.15.,조각 케익 크기에 비해 많이 비싸네요 가격을 표시해놓으셨다면 구매하지 않았을것 같아요. 시트도 좀 거칠고 크림도 별루였어요.,2024-04-06 - 20:01:43
480,Kakao,33,케이크풀,서울 동대문구 답십리로 149 1층 (답십리동),서울 동대문구,4.5,12.0,⠀,2021.11.27.,케이크 선물했는데 친구가 좋아했어요,2024-04-06 - 20:03:11
481,Kakao,34,베이크하우스,서울 동대문구 전농로 11 (답십리동),서울 동대문구,4.0,13.0,코코,2023.12.08.,"빵 생각날때마다 들르는곳인데 빵 종류도 다양하고
시식용 빵 준비되어있는것도 감동이에요^^
대왕카스테라, 소세지빵, 쌀고로케 등등 다 맛있어요",2024-04-06 - 20:03:31
482,Kakao,34,베이크하우스,서울 동대문구 전농로 11 (답십리동),서울 동대문구,4.0,13.0,.,2023.10.28.,허니브레드같은거랑 옥수수빵 샀는데 오후까지 진열되어있던거라 그런지 빵이 질기기가 장난아니라 씹히지가 않고 소스도 하나없고 걍 식빵인데 그렇다고 싸지도 않고 다신 안갈듯. 먹다 버렸어요. 안넘어가는데 아깝다고 참고 먹다가 내가 왜그래야하지 싶어서,2024-04-06 - 20:03:50
483,Kakao,34,베이크하우스,서울 동대문구 전농로 11 (답십리동),서울 동대문구,4.0,13.0,ㅇㅇ,2023.06.22.,ㄹㅇ 빵 맛나다 생각 잘 안하는데 너무 맛있음,2024-04-06 - 20:04:10
484,Kakao,34,베이크하우스,서울 동대문구 전농로 11 (답십리동),서울 동대문구,4.0,13.0,ddnen,2023.04.21.,"빵이 진짜 다양하고 맛있어요.
성수동 유명한 빵집들보다도 훨씬 맛있어요!!",2024-04-06 - 20:04:29
485,Kakao,34,베이크하우스,서울 동대문구 전농로 11 (답십리동),서울 동대문구,4.0,13.0,김만호,2022.11.16.,"빵이 맛있습니다.  시식용 빵도 있고 빵이 맛있습니다. 
유명 상표 빵집보다 맛있습니다.",2024-04-06 - 20:04:49
486,Kakao,34,베이크하우스,서울 동대문구 전농로 11 (답십리동),서울 동대문구,4.0,13.0,.,2022.11.08.,치아바타 겉은 얇고 바삭 안에는 촉촉하고 진짜 맛있어요! 소금빵은 너무 딱딱하고 두꺼워서 먹기 힘들었어요.. 가격이 좀 사악한 편,2024-04-06 - 20:05:08
487,Kakao,34,베이크하우스,서울 동대문구 전농로 11 (답십리동),서울 동대문구,4.0,13.0,판다곰,2022.10.31.,빵 넘 맛있어요 ㅠㅠ🤤🤤,2024-04-06 - 20:05:28
488,Kakao,34,베이크하우스,서울 동대문구 전농로 11 (답십리동),서울 동대문구,4.0,13.0,김구,2022.08.13.,"답십리에서 빵집은 여기만 다닙니다 
소금빵 식빵 샌드위치 비롯 모든 빵이 다 맛있음",2024-04-06 - 20:05:47
489,Kakao,34,베이크하우스,서울 동대문구 전농로 11 (답십리동),서울 동대문구,4.0,13.0,니얼굴,2022.06.27.,점심시간에 빵샀는데 카운터 보시는분 불친절합니다 별거아닐수도 있는데 카드를 카운터에 내리꽂네요. 무슨 화투판에서 화투치는것도아니고 갑자기 빵먹고싶은 생각이 싹 사라졌어요,2024-04-06 - 20:06:07
490,Kakao,34,베이크하우스,서울 동대문구 전농로 11 (답십리동),서울 동대문구,4.0,13.0,꽈배기만두,2022.01.13.,맛있어요..,2024-04-06 - 20:06:27
491,Kakao,34,베이크하우스,서울 동대문구 전농로 11 (답십리동),서울 동대문구,4.0,13.0,kki,2021.09.09.,가성비 좋고 빵 종류도 되게 다양한데 빵 만드시는 아저씨 마스크좀 제대로 끼세요...찝찝해서 가기 꺼려지게 됩니다.,2024-04-06 - 20:06:46
492,Kakao,34,베이크하우스,서울 동대문구 전농로 11 (답십리동),서울 동대문구,4.0,13.0,♡̷̷̷,2021.07.25.,"일요일 쉽니다 ㅠㅠ
사진 못 찍구 ㅠ 이미 먹어버렸어요. 맛있네요. 
햄버거 3,500 강추에요! 엄마가 만들어준 것 같은
맛이에요. 하지만 맥주랑 먹었네요 ㅎㅎ
저렴한데 빵이 담백하고 고급스러워요! 
답십리 산지 3년 되가는데 빵집이 잘 안보여서
자주 안사먹는데 요기는 또 갈 것 같아요 
담에 다른 빵도 도전하겠습니다 ㅎㅎ",2024-04-06 - 20:07:06
493,Kakao,34,베이크하우스,서울 동대문구 전농로 11 (답십리동),서울 동대문구,4.0,13.0,김상규/Ricky,2021.05.28.,가성비 있는 빵집,2024-04-06 - 20:08:22
494,Kakao,35,풍밀,서울 동대문구 고산자로34길 70 (용두동),서울 동대문구,5.0,3.0,낑깡,2024.03.01.,"밤식빵 처음먹어봤는데 맛있네요.
빵 별로 안좋아하는데 앉자마자 3조각이나 흡입했어요. 다음에 또 사러갈게요~",2024-04-06 - 20:08:42
495,Kakao,35,풍밀,서울 동대문구 고산자로34길 70 (용두동),서울 동대문구,5.0,3.0,이인범,2024.02.18.,좋은 재료 쓰는 게 느껴지는 맛입니다.,2024-04-06 - 20:09:01
496,Kakao,35,풍밀,서울 동대문구 고산자로34길 70 (용두동),서울 동대문구,5.0,3.0,Jieun,2023.09.11.,옆에 커피나인 카페에서 오픈하신 디저트 베이커리네요~ 재료가 많이들어간 달달한 쿠키 추천!,2024-04-06 - 20:10:19
505,Kakao,37,케이크케이크(K크CAKE),서울 동대문구 전농로 23 1층 (답십리동),서울 동대문구,5.0,2.0,summmmmer,2024.03.30.,"가격은 다른데보다 좀 있는데요, 
먹어보니까 크림이나 이런게 다른데랑 다르고 맛있었어요. 그림도 요청한대로 딱 해주시고 좋았어요. 이 동네에서 제일 디자인 잘하는 곳 인정!",2024-04-06 - 20:14:11
506,Kakao,37,케이크케이크(K크CAKE),서울 동대문구 전농로 23 1층 (답십리동),서울 동대문구,5.0,2.0,geejee,2023.12.16.,"케이크는 꼭!!!!!! 여기서 드셔보세요😍 맛보장합니다👍
기본(바닐라빵+크림치즈+생크림)인데도 진짜진짜 맛있어요!!
크림이 느끼하지 않고, 물리지 않고, 더부룩하지 않아서 끝까지 다 먹는 제 자신에게 깜짝 놀랬네용.
보통 남자들도 케이크 맛있게 먹기 드문데.. 첫입 먹자마자 세명 모두 눈이 동그레지더니ㅋㅋㅋ 극찬하면서 먹더라구요. 
다들 크림 있는 케이크를 좋아하지 않아서 이거보다 조금 더 작은 도시락 크기로 할까.. 고민했었는데 미니 크기로 사길 잘했어요😭 
너무 크지도 작지도 않고, 감칠맛 나는게 딱이에요!!!
내년 부모님 결혼기념일에는 인절미쑥케이크로 예약해야겠어용
오늘 사장님 덕분에 눈도 즐겁고, 입도 행복한 시간 보냈습니다❤️",2024-04-06 - 20:15:26
510,Kakao,48,히포케이크,서울 동대문구 장한로13길 11-6 1층 (장안동),서울 동대문구,3.7,3.0,zz,2023.03.01.,"사장님께서 친절하시고 케이크가 맛있어요 
케이크를 그렇게 많이 좋아하는 편은 아닌데 여기꺼는 먹어요",2024-04-06 - 20:17:40
511,Kakao,48,히포케이크,서울 동대문구 장한로13길 11-6 1층 (장안동),서울 동대문구,3.7,3.0,ㅇㅇ,2022.06.06.,정기휴무에 자체휴무에 시간안맞으면 주문도안받고 여기꺼못먹어서 안달난것도아닌데,2024-04-06 - 20:18:47
512,Kakao,48,히포케이크,서울 동대문구 장한로13길 11-6 1층 (장안동),서울 동대문구,3.7,3.0,ㅇ,2020.12.13.,이쁜데다가 맛도 너무 좋아요!! 적당히 달아서 어른들이 다 좋아하셨어요!!,2024-04-06 - 20:19:56
513,Kakao,50,보니또케이크,서울 동대문구 답십리로48길 4 1층 (답십리동),서울 동대문구,5.0,1.0,코끼리의코,2024.02.18.,자세한 상담에 도안 그대로 잘 만들어주십니다 :),2024-04-06 - 20:20:16
514,Kakao,51,좋은아침패스츄리제기동역점,"서울 동대문구 왕산로 92 동대문베네스트 1층 101,102호 (용두동)",서울 동대문구,2.2,11.0,ㆍ,2024.01.23.,별로 빵도 별로 없고 불친절,2024-04-06 - 20:20:45
515,Kakao,51,좋은아침패스츄리제기동역점,"서울 동대문구 왕산로 92 동대문베네스트 1층 101,102호 (용두동)",서울 동대문구,2.2,11.0,코난,2024.01.06.,여기 크로아상 맛있는데...,2024-04-06 - 20:21:05
517,Kakao,51,좋은아침패스츄리제기동역점,"서울 동대문구 왕산로 92 동대문베네스트 1층 101,102호 (용두동)",서울 동대문구,2.2,11.0,코코코,2023.10.29.,"초코가나슈케이크를 사왓는데
케이크를 오래 둔 걸 판매하신건지
시트가 딱딱해서 먹기아 힘들엇네요",2024-04-06 - 20:21:44
518,Kakao,51,좋은아침패스츄리제기동역점,"서울 동대문구 왕산로 92 동대문베네스트 1층 101,102호 (용두동)",서울 동대문구,2.2,11.0,꺄랄루,2023.02.18.,토요일 오후 알바가 화장실에서 손 안 씻고 나가는걸 목격.. 충격 …,2024-04-06 - 20:22:03
519,Kakao,51,좋은아침패스츄리제기동역점,"서울 동대문구 왕산로 92 동대문베네스트 1층 101,102호 (용두동)",서울 동대문구,2.2,11.0,꼬꼬마,2022.08.26.,맛은 있어요!,2024-04-06 - 20:22:23
520,Kakao,51,좋은아침패스츄리제기동역점,"서울 동대문구 왕산로 92 동대문베네스트 1층 101,102호 (용두동)",서울 동대문구,2.2,11.0,ㅇㅅㅇ,2022.07.17.,"일본에만 살아봐도 알아요. 

빵을 구울때는 버터풍미가 반드시 가게주변 바깥으로 흘러 나와옵니다. 

이 가게는 전혀 그런게 없어요.",2024-04-06 - 20:22:42
521,Kakao,51,좋은아침패스츄리제기동역점,"서울 동대문구 왕산로 92 동대문베네스트 1층 101,102호 (용두동)",서울 동대문구,2.2,11.0,미,2022.06.19.,덮개...필요해 보입니다..,2024-04-06 - 20:23:02
