,Platform,Number,Store,Address,Review_score,Review_counts,ID,Date,Review_text,Time
0,naver,1,치즈인더스트리 [치즈공업사],서울 종로구 수표로28길 33-7,, 658,EZtimecapture,3.7.목,"《 ""풀 먹는 소 구경해요"" 치즈인더스트리💛》 성수동 에 가면 으레껏 레인리포트 크루아상과 치즈인더스트 리 성수, 익선동에 오면 소하염전과 치즈인더...",2024-04-04 - 23:49:44
1,naver,1,치즈인더스트리 [치즈공업사],서울 종로구 수표로28길 33-7,, 658,Food Quest,3.19.화,익선동 골목길에 들어선 치즈 농장. 외양간 느낌의 인 테리어를 바탕으로 치즈 제조 공정을 보여주고자 하 는 공간 기획자의 컨셉이 강렬하게 다가옵니다...,2024-04-04 - 23:49:44
2,naver,1,치즈인더스트리 [치즈공업사],서울 종로구 수표로28길 33-7,, 658,thf****,3.13.수,익선동의 분위기와 잘 어우러지는 치즈인더스트리 치즈를 좋아해서 덱스 맛카롱 보고 꼭 가보고 싶었는 데 컨셉에 정말 진심이고 즉석에서 카라멜라이...,2024-04-04 - 23:49:44
3,naver,1,치즈인더스트리 [치즈공업사],서울 종로구 수표로28길 33-7,, 658,품안에,3.12.화,종롱로에 요런 갬성골목이 있는줄 몰랐어요~~ 굉장 히 한국스럽지 않은 이색적이고 개성있는 각자의 인 테리어 상가들이 눈에 뜨게 예쁘고 감탄스러웠...,2024-04-04 - 23:49:44
4,naver,1,치즈인더스트리 [치즈공업사],서울 종로구 수표로28길 33-7,, 658,내돈내산 맛집에 진심인 고독한 미식가,2.24.토,"치즈 케익이 가격대가 있는 편이지만 정말 맛있습니 다. 볼거리 많고 먹을 거리 많은 익선동에 위치에 있 습니다. 빵값은 스콘 종류가 4,500원 정도, 토...",2024-04-04 - 23:49:44
5,naver,1,치즈인더스트리 [치즈공업사],서울 종로구 수표로28길 33-7,, 658,쥬쥬yam,3.10.일,찌이인한 치즈에 진심인 디저트카페✨ 성수만 알고 익선에도 있는 줄 몰랐어요! 토치로 녹여주는 카라멜 바스크 치즈 케이크가 먹고싶었지만 품절이었...,2024-04-04 - 23:49:44
6,naver,1,치즈인더스트리 [치즈공업사],서울 종로구 수표로28길 33-7,, 658,버블복,3.3.일,두번째방문 치즈케잌이 종류도많고 엄청맛있어요! 마 굿간컨셉인지 의자밑에도 지푸라기같은게깔려있어 요 ㅋㅋㅋ 저번엔 와인이랑먹었어서 더맛있었...,2024-04-04 - 23:49:44
7,naver,1,치즈인더스트리 [치즈공업사],서울 종로구 수표로28길 33-7,, 658,zz783,2.16.금,브리치즈 케익 완전 추천 !! 그리고 바스크치즈케익도 꾸덕한 느낌보단 전체적으로 모든케익이 부드러워 서 좋았어요 담엔 에멘탈이랑 고다치즈 먹으러...,2024-04-04 - 23:49:44
8,naver,1,치즈인더스트리 [치즈공업사],서울 종로구 수표로28길 33-7,, 658,mask1834,1.15.월,주말엔 사람이 꽉꽉이었는데 월욜에가니 여유로워서 좋았습니다. 베리로제와인에이드.달달하니상큼탄산 맛. 치즈인더스트리크림커피 레알부드럽고맛...,2024-04-04 - 23:49:44
9,naver,1,치즈인더스트리 [치즈공업사],서울 종로구 수표로28길 33-7,, 658,또새롱,3.11.월,치즈인더스트리 커피 맛있어요~ 치즈파이는 겉바속 촉에 고소하고 진하니 맛있어요~~!! 겉에 바삭한부분 떼서 커피위 크림에 찍어먹어도 맛있고 파이자...,2024-04-04 - 23:49:44
10,naver,1,치즈인더스트리 [치즈공업사],서울 종로구 수표로28길 33-7,, 658,크로마스토리,23.12.16.토,"음료는 치즈 인더스트리와 연유 치즈 라떼, 디저트는 브리 치즈 케이크와 콰트로 치즈 페이스트리를 주문 했습니다. 음료에도 치즈가 들어가 치즈 향이 ...",2024-04-04 - 23:49:44
11,naver,1,치즈인더스트리 [치즈공업사],서울 종로구 수표로28길 33-7,, 658,먹꾸미,3.28.목,"디저트다 너뮤맛있었어요!!
브리치즈케익이랑 스콘 ㅠㅠ 같이먹음 귣귣
또 가고싶네용",2024-04-04 - 23:49:44
12,naver,1,치즈인더스트리 [치즈공업사],서울 종로구 수표로28길 33-7,, 658,킁킁5530,2.9.금,고다 케이크 넘 맛있어요 케이크 겉표면이 치즈인지 화이트초콜렛인지 모르겠는데 맛있어요 바스크 치즈 케이크는 주문하면 직워분이 테이블로 갖구와...,2024-04-04 - 23:49:44
13,naver,1,치즈인더스트리 [치즈공업사],서울 종로구 수표로28길 33-7,, 658,달래8436,23.12.28.목,따님 둘 모시고 서울 여행 갔다가~ 익선동에서 고르 고 골라서 들어간 디저트샵이에요~! 셋이 가서 메뉴 3 개 골랐는데~ 하나같이 다 맛있네요~ 고르다 ...,2024-04-04 - 23:49:44
14,naver,1,치즈인더스트리 [치즈공업사],서울 종로구 수표로28길 33-7,, 658,마법사657,3.1.금,"브리치즈케익 넘나 맛있었어요! 보들보들 ㅠㅠ 또 먹
고 싶당 ㅠ 하나만 사와서 아쉽 ㅠ ㅎㅎ 손님이 엄청 
많아서 포장해와서 먹었어요! 스콘은 짭짤하...",2024-04-04 - 23:49:44
15,naver,1,치즈인더스트리 [치즈공업사],서울 종로구 수표로28길 33-7,, 658,pattyji97,23.12.1.금,"익선동가면 꼭가야겠다고 생각해둔곳인데 이제야방 문 익선동 독특한컨셥속에 제대로 누가봐도 ""치즈케 잌맛집입니다"" 라고 외관부터 뿜뿜중 ㅋ 커피...",2024-04-04 - 23:49:44
16,naver,1,치즈인더스트리 [치즈공업사],서울 종로구 수표로28길 33-7,, 658,로지와88,3.10.일,"치즈공장에 온듯해요 커피도 맛있고 케익인지 치즈인
지 구분안가는 모양!",2024-04-04 - 23:49:45
17,naver,1,치즈인더스트리 [치즈공업사],서울 종로구 수표로28길 33-7,, 658,구름하늘빛,1.17.수,"저녁먹고 배부르다 하면서 방문햇는데 치즈전문카 페네요,제빵도 하고 에멘탈치즈케잌. 에스프레소 마 스카포네 페이스트리 빵류도 이렇게 맛있을수...",2024-04-04 - 23:49:45
18,naver,1,치즈인더스트리 [치즈공업사],서울 종로구 수표로28길 33-7,, 658,hyoun0423,4.2.화,방송보고찾아갔는데 먹느라바빠서 사진 못찍었네 크 림치즈밀크 .베리로제와인에이드 날씨가 더워서 아 이스로 주문했는데 흡족했네요 고다.브리케이...,2024-04-04 - 23:49:45
19,naver,1,치즈인더스트리 [치즈공업사],서울 종로구 수표로28길 33-7,, 658,융융씨 라이프,23.11.29.수,인테리어때문에 가보고 싶었는데 가보니 빵이 빵이 너무 먹음직해요 ㅠㅠ 주문한 빵들 전부 치즈가 포함 된건데 너무 맛나요 고다케이크 강추에요 조그...,2024-04-04 - 23:49:45
20,naver,1,치즈인더스트리 [치즈공업사],서울 종로구 수표로28길 33-7,, 658,델푸트 dailyfoodtrip81,23.10.29.일,글로우 서울이 만든 핸드메이드 치즈와 다양한 변주 를 만날 수 있는 치즈 그로서리 마펫 카페 치즈 공업 사에 다녀왔습니다. 다양한 수제 치즈와 치즈 ...,2024-04-04 - 23:49:45
21,naver,1,치즈인더스트리 [치즈공업사],서울 종로구 수표로28길 33-7,, 658,채126,3.31.일,치즈케이크 좀 비싸지만 맛있었어요. 근데 직원분들 너무 불친절합니다. 붐비지 않는 시간대에 가서 손님 에 비해 직원이 많았는데 손님이 나가도 뒷정...,2024-04-04 - 23:49:45
22,naver,1,치즈인더스트리 [치즈공업사],서울 종로구 수표로28길 33-7,, 658,금규의리뷰,3.2.토,치즈케이크를 좋아해서 방문했는데 주말에 연휴도 포 함이라서 사람이 정말 많았어요 ㅠ 근데 웨이팅 하는 기계가 카운터 앞에 있고 디저트 고르는 사람...,2024-04-04 - 23:49:45
23,naver,1,치즈인더스트리 [치즈공업사],서울 종로구 수표로28길 33-7,, 658,EZtimecapture,23.10.26.목,CGV피카디리에 영화 예매하고 일찍 도착해 익선동 갔어요 익선동 첫방문 때 꼬불꼬불 골목돌다가 길 잃 고 갔던길 또가고 그랬는데 이젠 한번에 목적...,2024-04-04 - 23:49:45
24,naver,1,치즈인더스트리 [치즈공업사],서울 종로구 수표로28길 33-7,, 658,J Pearl,2.5.월,치즈케이크가 종류가 많아서 뭘 먹어야할지 몰라서 인기 많아보이는 걸로 주문!! 근데 제가 생각했던 맛 은 아니었어요 ㅋㅋ 짭짤한 느낌보다는 과일치...,2024-04-04 - 23:49:45
25,naver,1,치즈인더스트리 [치즈공업사],서울 종로구 수표로28길 33-7,, 658,알럽맛집,3.31.일,"치즈 덕후라 방문했는데 키작은 남자직원 너무 불친절해요
재방문 의사 없음",2024-04-04 - 23:49:45
26,naver,1,치즈인더스트리 [치즈공업사],서울 종로구 수표로28길 33-7,, 658,Lab B2,4.2.화,"#유명세X푸대접#할많하않 #snubbed#terrible custo
mer service 무서운 표정으로 다짜고짜 포장할거냐고
. 시비거는줄;;",2024-04-04 - 23:49:45
27,naver,1,치즈인더스트리 [치즈공업사],서울 종로구 수표로28길 33-7,, 658,군침이터져나오노,23.11.21.화,지인짜 찐한 치즈케이크였어요! 익선동 골목을 걷다 보면 눈에 띄는 치즈인더스트리. 치즈케이크 포장하 러 다녀왔습니다. 낮보다 밤에 더 예쁜 것 같아...,2024-04-04 - 23:49:45
28,naver,1,치즈인더스트리 [치즈공업사],서울 종로구 수표로28길 33-7,, 658,윤디야,23.12.9.토,덱스의 맛카롱보고 방문했어요. 찐 치즈케익크 맛을 볼수 있겠구나 해서 방문. 주문 한 음료와 커피는 맛 있었어요. 치즈케익크는 제가 아는 치크케익크...,2024-04-04 - 23:49:45
29,naver,1,치즈인더스트리 [치즈공업사],서울 종로구 수표로28길 33-7,, 658,개 토끼,3.1.금,치즈라떼는 마치 자판기우유에 치즈맛이 진하게나서 맛있었는데 페스트리는 겉표면은 페스트리인데 잘라보면 그냥 빵...식감도 그냥 빵...,2024-04-04 - 23:49:45
30,naver,1,치즈인더스트리 [치즈공업사],서울 종로구 수표로28길 33-7,, 658,별이예쁘지,1.31.수,"에스프레소페이스트리 맛나요
마스카포네치즈
커피도 진한게 고소해요",2024-04-04 - 23:49:45
31,naver,1,치즈인더스트리 [치즈공업사],서울 종로구 수표로28길 33-7,, 658,joo****,23.12.26.화,"치즈케이크가 맛있는 곳! 그런데 가격대는 좀 있습니
다ㅠ다른 케이크도 먹어보고싶었는데 가격때문에 고
민이 되긴하네욤ㅎㅎ 다음에 또 가서 다른치케...",2024-04-04 - 23:49:45
32,naver,1,치즈인더스트리 [치즈공업사],서울 종로구 수표로28길 33-7,, 658,leeleee,2.27.화,"햇빛이 완벽하게 들어와서 너무 예쁘고 따뜻했어요 ㅎㅎ 스무디 맛있고, 매장 전체에 퍼져있는 치즈 냄새가 정말 좋았어용",2024-04-04 - 23:49:45
33,naver,1,치즈인더스트리 [치즈공업사],서울 종로구 수표로28길 33-7,, 658,미각 감별사,3.15.금,토마토바질에이드 너무맛있어요,2024-04-04 - 23:49:45
34,naver,1,치즈인더스트리 [치즈공업사],서울 종로구 수표로28길 33-7,, 658,아이올라이트73,1.25.목,"커피 진짜 맛있어요!
추천",2024-04-04 - 23:49:45
35,naver,1,치즈인더스트리 [치즈공업사],서울 종로구 수표로28길 33-7,, 658,띵구르르똥,1.26.금,진한 치즈맛 느껴지는 찐 치즈케이크 너무 맛있어요:),2024-04-04 - 23:49:45
36,naver,1,치즈인더스트리 [치즈공업사],서울 종로구 수표로28길 33-7,, 658,수우우웅,1.22.월,익선동 갔다 들리기 좋아요 직접 치즈를 만드신다고 하셔요 브리 치즈 등등 케이쿠가 많고 맛있어용 치즈 맛을 기대했는데 치즈도 맛있지만 페스트리가 ...,2024-04-04 - 23:49:45
37,naver,1,치즈인더스트리 [치즈공업사],서울 종로구 수표로28길 33-7,, 658,우니5694,23.10.28.토,궁투어 갔다가 다리가 아파서 쉬면서 커피 수혈하러 익석동 갔어요 마침 창가 자리가 있어서 잠시 쉬면서 디저트랑 커피 마셨지요 커피 맛도 너무 좋았...,2024-04-04 - 23:49:45
38,naver,1,치즈인더스트리 [치즈공업사],서울 종로구 수표로28길 33-7,, 658,애플애니,23.12.31.일,인테리어 특이하고 커피랑 케이크 맛있어요!!!,2024-04-04 - 23:49:45
39,naver,1,치즈인더스트리 [치즈공업사],서울 종로구 수표로28길 33-7,, 658,빵구리,1.13.토,가격은 좀 비싸지만 맛있었어요,2024-04-04 - 23:49:45
40,naver,1,치즈인더스트리 [치즈공업사],서울 종로구 수표로28길 33-7,, 658,국밥집막내딸,23.11.19.일,치즈를 주재료로 해서 만든 디저트들이 있는 곳이에 요. 유명한 치즈케이크는 배불러서 못먹어봤지만 냄 새 엄청 좋으네요. 우유 포카치아를 크림치즈...,2024-04-04 - 23:49:46
41,naver,1,치즈인더스트리 [치즈공업사],서울 종로구 수표로28길 33-7,, 658,나들이란,23.11.11.토,덱스에 마카롱에 나온거 보고 와보고 싶었는데~ 의자 랑 테이블이랑 불편하고 손님이 너무 많아서 정신없 고..마굿간느낌으로 바닥에 깔린 나무조각? 톱...,2024-04-04 - 23:49:46
42,naver,1,치즈인더스트리 [치즈공업사],서울 종로구 수표로28길 33-7,, 658,얌췐,23.12.16.토,치즈 케이크 진짜 맛있어요.,2024-04-04 - 23:49:46
43,naver,1,치즈인더스트리 [치즈공업사],서울 종로구 수표로28길 33-7,, 658,에다야,1.8.월,짭짤한 디저트가 먹고싶어서 방문했습니다. 핫플이라 가격대는 비싼 편이었지만 무난한 것 같아요. 빵도 맛있고 시그니처 커피도 특색있었어요. 히터 ...,2024-04-04 - 23:49:46
44,naver,1,치즈인더스트리 [치즈공업사],서울 종로구 수표로28길 33-7,, 658,cha****,2.11.일,"넓지않아요 
직접 만든 고다치즈 포장함
 기대돼요",2024-04-04 - 23:49:46
45,naver,1,치즈인더스트리 [치즈공업사],서울 종로구 수표로28길 33-7,, 658,쏘선생0803,23.10.3.화,익선동에서 유명한 카페라서 방문해보고 싶었는데 마 침 사람이 빠지는 타이밍이라서 방문해봤어요 치즈구 경하는 맛이 있더라고요 빵종류도 다양하고 음...,2024-04-04 - 23:49:46
46,naver,1,치즈인더스트리 [치즈공업사],서울 종로구 수표로28길 33-7,, 658,skywater,2.17.토,커피도 디저트도 맛나요. 치즈케잌도 괜찮지만 페스츄리들이 기대이상이어서 놀랐어요.,2024-04-04 - 23:49:46
47,naver,1,치즈인더스트리 [치즈공업사],서울 종로구 수표로28길 33-7,, 658,샌드라28,23.11.30.목,매장도 이쁘고 치즈케이크 정말 맛있어요!! 처음엔 비싸서 고민했는데 먹자마자 인정해버렸어요!! 정말 맛있어요!!,2024-04-04 - 23:49:46
48,naver,1,치즈인더스트리 [치즈공업사],서울 종로구 수표로28길 33-7,, 658,angssen,23.9.10.일,치즈인더트리 덱스 유투브 보고 가보고 싶어서 다녀 왔어요 자스민치즈폼티 향긋하고 어디에도 없는 고급 스러운 독특한 맛이었고요~~ 에멘탈치즈케이...,2024-04-04 - 23:49:46
49,naver,1,치즈인더스트리 [치즈공업사],서울 종로구 수표로28길 33-7,, 658,겨울아이5429,1.28.일,고급진 맛이네요,2024-04-04 - 23:49:46
50,naver,1,치즈인더스트리 [치즈공업사],서울 종로구 수표로28길 33-7,, 658,f0rest64,23.11.2.목,"가격대는 있지만 맛있어요 고다케이크 도톰하고 예쁜
만큼 맛도 좋아요 브리케이크 부드럽고 진한 브리치
즈의 맛이 느껴져 커피나 와인과 함께하니 맛있어요",2024-04-04 - 23:49:46
51,naver,1,치즈인더스트리 [치즈공업사],서울 종로구 수표로28길 33-7,, 658,sun213,23.10.27.금,"원래 다른 카페 가려다가 자리가 없어서 여기 갔는데 
인테리어도 독특하고 탁월한 선택이었어요 ㅋ 빵종류
는 많이 없지만 구입한 빵 다 너무 맛있었어요",2024-04-04 - 23:49:46
52,naver,1,치즈인더스트리 [치즈공업사],서울 종로구 수표로28길 33-7,, 658,Believe Simha,23.11.29.수,"치즈덕후들 모여라!!!!!
컨셉 제대로여요 ㅎㅎㅎ
비싸지만 않으면 다 먹어보고 싶습니댜^ㅠ^",2024-04-04 - 23:49:46
53,naver,1,치즈인더스트리 [치즈공업사],서울 종로구 수표로28길 33-7,, 658,푸른하늘 은하수 하얀 쪽배,23.10.28.토,치즈🧀 의 고소함과 브라운허니페이스트리의 바삭바삭하고 고소한 견과류의 식감이 더해져 아메리카노 ☕️ 와 찰떡궁합 ~ 💕,2024-04-04 - 23:49:46
54,naver,1,치즈인더스트리 [치즈공업사],서울 종로구 수표로28길 33-7,, 658,EUNB,23.9.18.월,특별한 메뉴들로 가득했던 매장. 치즈 좋아하는 분들 이라면 꼭 방문해보세요. 분위기도 좋고 커피부터 와 인 즐기기에도 좋겠더라구요. 가격대가 있지만...,2024-04-04 - 23:49:46
55,naver,1,치즈인더스트리 [치즈공업사],서울 종로구 수표로28길 33-7,, 658,tns****,23.11.19.일,"선물용으로 샀는데 너무 예뻐서 제가 만족 
선물 받은 분도 진심 맛있었대용!",2024-04-04 - 23:49:46
56,naver,1,치즈인더스트리 [치즈공업사],서울 종로구 수표로28길 33-7,, 658,코스모스7360,3.22.금,,2024-04-04 - 23:49:46
57,naver,1,치즈인더스트리 [치즈공업사],서울 종로구 수표로28길 33-7,, 658,날아라정폴리,23.10.28.토,"목장느낌에 익선동 신상카페예요. 가격이 너무 사악
합니다. 치즈 싫어하시는 분은 비추! 커피는 맛있는데
..디저트&빵은..별로네요~~ 한번은 먹어볼만 ...",2024-04-04 - 23:49:46
58,naver,1,치즈인더스트리 [치즈공업사],서울 종로구 수표로28길 33-7,, 658,Shuvely516,23.11.21.화,"케이크도 맛있고, 커피랑 치즈는 안 어울릴줄 알았는데 잘 어울려서 좋았어요",2024-04-04 - 23:49:46
59,naver,1,치즈인더스트리 [치즈공업사],서울 종로구 수표로28길 33-7,, 658,dyO,23.12.30.토,치즈케이크 좋아해서 여러곳에서 많이 먹어봤지만 여기만큼 부드럽고 맛있고 치즈에 이렇게나 진심인곳은 처음이에요..🥹,2024-04-04 - 23:49:46
60,naver,1,치즈인더스트리 [치즈공업사],서울 종로구 수표로28길 33-7,, 658,도리잼도리잼,23.12.17.일,"전반적으로 비싸고 맛은 쏘쏘해요 
근데 너무 추워요 진짜 카페 온 보람이 없었어요....
그리고 책상 닦았는데 진짜 너무 더러웠어요.......",2024-04-04 - 23:49:46
61,naver,1,치즈인더스트리 [치즈공업사],서울 종로구 수표로28길 33-7,, 658,kwo****,2.6.화,치즈케익 너무 조아해서 일부러 찾아갔어요 맛은 있 는데 고다치즈케익은 좀 짭쪼름합니다 전체적으로 가 격이 사악한데다가 쇼핑백을 100원도 아닌 50...,2024-04-04 - 23:49:46
62,naver,1,치즈인더스트리 [치즈공업사],서울 종로구 수표로28길 33-7,, 658,카라ㅇ커피한모금,23.11.6.월,"치~~~~~즈케익 좋아요
음료 치즈인더스트리도 연유치즈라떼도 달아요.
케익이랑 먹을땐 아메리카노로 드세요",2024-04-04 - 23:49:46
63,naver,1,치즈인더스트리 [치즈공업사],서울 종로구 수표로28길 33-7,, 658,ghkddmlfuf,23.9.10.일,아메리카노 고소해서 맛있음여 브리치즈는 딱히 내스 탈은 아닌듯 산미있고 상큼한치즈좋아하는분들은 좋 아하실듯!! 담에는 에멘탈이나 고다먹어봐야겠...,2024-04-04 - 23:49:46
64,naver,1,치즈인더스트리 [치즈공업사],서울 종로구 수표로28길 33-7,, 658,먹는데 진심인 편,23.11.18.토,"Of the cheese, by the cheese, for the cheese 🧀",2024-04-04 - 23:49:47
65,naver,1,치즈인더스트리 [치즈공업사],서울 종로구 수표로28길 33-7,, 658,우훗38,23.11.21.화,에멘탈치즈케익 독특하고 맛있네요 가격은 좀 비싼데 양이많아요,2024-04-04 - 23:49:47
66,naver,1,치즈인더스트리 [치즈공업사],서울 종로구 수표로28길 33-7,, 658,Bongbong00,23.8.13.일,서울 한복판에서 한적한 목장에 놀러온 듯한 느낌을 받을 수 있는 신박한 인테리어... 카페 안에는 목가적 인 비지엠와 풀벌레 소리 양 울음소리에 평화...,2024-04-04 - 23:49:47
67,naver,1,치즈인더스트리 [치즈공업사],서울 종로구 수표로28길 33-7,, 658,루피등장,23.10.9.월,치즈를 좋아한다면! 무조건 가야하는 곳! 시그니처 치 즈커피도 너무 맛있었고! 치즈빵도 너무 너무 맛있었 습니다🫢👍🏻 방문 하기 전! 웨이팅이 있을 수 ...,2024-04-04 - 23:49:47
68,naver,1,치즈인더스트리 [치즈공업사],서울 종로구 수표로28길 33-7,, 658,리뷰돌이96,3.17.일,"알바분이 친절하십니다
음료랑 빵도 맛있어여",2024-04-04 - 23:49:47
69,naver,1,치즈인더스트리 [치즈공업사],서울 종로구 수표로28길 33-7,, 658,즐거운룰루,23.11.6.월,"치즈, 넘 맛나고
인테리어 멋져요",2024-04-04 - 23:49:47
70,naver,1,치즈인더스트리 [치즈공업사],서울 종로구 수표로28길 33-7,, 658,Jiyeongchoi,2.29.목,맛있어용여요요용요요요ㅛ,2024-04-04 - 23:49:47
71,naver,1,치즈인더스트리 [치즈공업사],서울 종로구 수표로28길 33-7,, 658,하늘토리,23.12.8.금,맛은 아주 좋습니다. 치즈케이크는 굉장히 촉촉하고 표면에 빠삭빠삭한 초콜릿 같은 것도 맛있어요,2024-04-04 - 23:49:47
72,naver,1,치즈인더스트리 [치즈공업사],서울 종로구 수표로28길 33-7,, 658,승현9814,23.12.23.토,음료랑 케이크 둘 다 맛있어요,2024-04-04 - 23:49:47
73,naver,1,치즈인더스트리 [치즈공업사],서울 종로구 수표로28길 33-7,, 658,Bacardi,23.11.30.목,"음료, 디저트 모두 맛있어요 :)
인테리어가 따뜻해서 겨울에도 가기 좋은 것 같아요",2024-04-04 - 23:49:47
74,naver,1,치즈인더스트리 [치즈공업사],서울 종로구 수표로28길 33-7,, 658,길동H,23.9.19.화,"시그니처 치즈커피 너무 맛있어요!!!!!!! 치즈폼과 블루
베리치즈가 올라간 아인슈페너☕️찐한 케이크도 먹
고싶은뎅 ㅎㅎ 배불러서 못먹었는데 조만간 꼭...",2024-04-04 - 23:49:47
75,naver,1,치즈인더스트리 [치즈공업사],서울 종로구 수표로28길 33-7,, 658,하나츠루,23.7.17.월,맛있어요!!! 저 아이스크림 제 취향이에요 치즈좋아하 시면 츄라이해보세요😋😋😋 다 치즈로드셔도좋구 반반으로도 드셔보세요 유제품천국 행복❤️❤️...,2024-04-04 - 23:49:47
76,naver,1,치즈인더스트리 [치즈공업사],서울 종로구 수표로28길 33-7,, 658,숄라숑,23.9.29.금,"요거트 맛있었고, 치즈케이크는 꾸덕한 맛은 좋은데 
생각보다 무난해요. 인테리어는 예뻐요. 사람 너무 많
고, 밖에 보이게 앉는 일렬로 된 좌석은 불편해...",2024-04-04 - 23:49:47
77,naver,1,치즈인더스트리 [치즈공업사],서울 종로구 수표로28길 33-7,, 658,des5489,3.16.토,,2024-04-04 - 23:49:47
78,naver,1,치즈인더스트리 [치즈공업사],서울 종로구 수표로28길 33-7,, 658,술딱한잔만,23.9.28.목,분위기 좋아요~ 자리는 딱 나면 찜꽁하고 앉아야해요 ㅋㅋ 치즈 선물용으로 파는데 좋은거 같아요 ㅎㅎ 바 닥에 지푸라기 같은 걸로 인테리어 되어있는데...,2024-04-04 - 23:49:47
79,naver,1,치즈인더스트리 [치즈공업사],서울 종로구 수표로28길 33-7,, 658,Ariana Grande size,23.12.9.토,"치즈케이크 기대했는데
기대만큼은 아니어서 아쉬웠어요 🥲",2024-04-04 - 23:49:47
80,naver,1,치즈인더스트리 [치즈공업사],서울 종로구 수표로28길 33-7,, 658,lov****,1.13.토,우연히 익선동 나들이 갔다가 치즈냄새에 이끌리어 구매했어요^^ 치즈가 많이 들어가 부드럽고 맛나네요^^,2024-04-04 - 23:49:47
81,naver,2,서촌스코프 2호점,서울 종로구 자하문로7길 54,, 613,coc****,3.24.일,스콘 맛집으로 유명한만큼 스콘이 맛있네요 버터풍 미도 확실하고 겉은 바삭 속은 촉촉 스타일은 아니고 쫀득한 느낌 맛있어요~~ 생강 케이크는 밀도...,2024-04-04 - 23:50:22
82,naver,2,서촌스코프 2호점,서울 종로구 자하문로7길 54,, 613,햅피미,3.16.토,내돈내산))) 서촌 돌아댕기다가 사람이 밖에까지 많길 리 뭐지뭐지? 하고 인파를 뚫고 들어간 스코프🤣🤣 베이커리 종류가 너무너무 다양하고 크기가 정...,2024-04-04 - 23:50:22
83,naver,2,서촌스코프 2호점,서울 종로구 자하문로7길 54,, 613,카페또뿡,3.24.일,"친구의 추천으로 방문한 서촌스코프 2호점 서촌의 골
목감성을 느낄 수 있는 알록달록 야외좌석도 마련되
어 있습니다. 디저트는 비주얼부터 압도적이라...",2024-04-04 - 23:50:22
84,naver,2,서촌스코프 2호점,서울 종로구 자하문로7길 54,, 613,똘이쌤,3.15.금,"스코프에서 더블초코칩쿠키, 당근케이크, 버터스콘 
구매하였습니다. 3개다 모두 맛있었어요. 다음에 다
른것도 먹어보고 싶습니다.",2024-04-04 - 23:50:22
85,naver,2,서촌스코프 2호점,서울 종로구 자하문로7길 54,, 613,yam****,1.27.토,빵순이들이 가야할 곳!!! 서촌에서 여기저기 들러보다 가 인기맛집이라 해서 방문했어요~~가격대도 정말 괜찮고 포장해서 집에서 먹었는데 치즈케이크...,2024-04-04 - 23:50:22
