,Platform,Number,Store,Address,Review_score,Review_counts,ID,Date,Review_text,Time
3671,naver,37,솔방울베이커리,서울 종로구 서순라길 89-15 솔방울,, 816,로즈캐슬,23.12.22.금,맛있어요,2024-04-05 - 00:11:10
3672,naver,37,솔방울베이커리,서울 종로구 서순라길 89-15 솔방울,, 816,후니처,23.9.23.토,굿,2024-04-05 - 00:11:10
3673,naver,37,솔방울베이커리,서울 종로구 서순라길 89-15 솔방울,, 816,동지1181,23.6.4.일,사랑채 예약하길 정말 잘했던 것 같아요! 모임장소로 정말 좋은 것 같습니다ㅎㅎ 차 설명지와 티백 빼는 자기가 정말 센스있는 것 같습니다!,2024-04-05 - 00:11:10
3674,naver,37,솔방울베이커리,서울 종로구 서순라길 89-15 솔방울,, 816,설이랑나랑,23.3.18.토,"순라길에 있는 숨은 카페
소금빵부터 커피까지~~~♡♡두말할필요없음 또가야지~~~",2024-04-05 - 00:11:10
3675,naver,37,솔방울베이커리,서울 종로구 서순라길 89-15 솔방울,, 816,minh777,23.2.11.토,오 빵이 맛있어요! 빵카페들 종종 가봤지만 그냥 암 생각없이 먹는 맛들이었눈데 여긴 시킨거 다 맛있네 염 남친이 요리하는데 까눌레 존맛이라고함ㅎ...,2024-04-05 - 00:11:10
3676,naver,37,솔방울베이커리,서울 종로구 서순라길 89-15 솔방울,, 816,베로니카9088,23.10.3.화,커피도 맛있고 빵도 맛있어요~~,2024-04-05 - 00:11:10
3677,naver,37,솔방울베이커리,서울 종로구 서순라길 89-15 솔방울,, 816,엘프1216,23.10.27.금,,2024-04-05 - 00:11:10
3678,naver,39,카페시사,서울 동대문구 전농로 217 정우빌딩 1층 카페시사, 4.51, 338,화정인,3.27.수,"서울시립대학교 앞 카페라 콘센트 석도 많고 노트북 과제하기도 좋아요. 매장 넓고 테이블도 다양하네요. 학생들 포함 주민, 직장인 할 것 없이 손님이 찾...",2024-04-05 - 00:11:55
3679,naver,39,카페시사,서울 동대문구 전농로 217 정우빌딩 1층 카페시사, 4.51, 338,bjj****,2.25.일,"카페 시사 음료, 디저트 둘다 맛집인정입니다ㅠㅠ 너 무 맛있어서 먹는내내 입이 행복했어요~ ㅎㅎ 서울시 립대입구에 위치하고 청량리역에서도 가까워...",2024-04-05 - 00:11:55
3680,naver,39,카페시사,서울 동대문구 전농로 217 정우빌딩 1층 카페시사, 4.51, 338,또니551,3.7.목,시립대 정문 앞에 공부하기 좋은 카페에용 넓고 타르트도 넘 맛있어요!!! 타르트는 배달로 많이 시켜먹었는데 항상 맛있어요 🫶🏻,2024-04-05 - 00:11:55
3681,naver,39,카페시사,서울 동대문구 전농로 217 정우빌딩 1층 카페시사, 4.51, 338,spd****,3.9.토,"시립대 앞에 이렇게 예쁜 카페가 있었다니🫶 저는 왜 이제 알았을까요 ,, 디저트 너무너무 맛있고 메뉴도 다양해요! 시끄러운 카페 분위기가 아니어서 ...",2024-04-05 - 00:11:55
3682,naver,39,카페시사,서울 동대문구 전농로 217 정우빌딩 1층 카페시사, 4.51, 338,rlawkdud46,2.25.일,음료 양이 진짜 많아서 몇시간동안 먹을 수 있고 요기 딸기타르트 맛집입니당..ㅎㅎ 넘 맛있어요ㅠㅠ 흑임 자라떼도 진짜 흑임자를 갈아주셔서 엄청 고소...,2024-04-05 - 00:11:55
3683,naver,39,카페시사,서울 동대문구 전농로 217 정우빌딩 1층 카페시사, 4.51, 338,효니효니호니,1.6.토,"너무 맛있는곳 찾았어요❤️ 날씨좋은 주말에, 나들이 겸 다녀왔어요! 엄청 넓고 아늑해요. 깨끗하고 분위 기도 좋아요. 아주 완벽한 카페를 발견했습니...",2024-04-05 - 00:11:55
3684,naver,39,카페시사,서울 동대문구 전농로 217 정우빌딩 1층 카페시사, 4.51, 338,130334,1.8.월,샌드위치&디저트 맛집 카페시사! 커피도 맛나서 종종 가는데 이번에는 생과일주스랑 스무디 처음으로 시 켜봤어요. 샌드위치랑 궁합 잘맞고 간단하고 ...,2024-04-05 - 00:11:55
3685,naver,39,카페시사,서울 동대문구 전농로 217 정우빌딩 1층 카페시사, 4.51, 338,gracejji,1.24.수,"이집 치아바타샌디취는 진짜 ㅈㅁㅌ입니다
커피도 맛있고 머물다가기 좋은 카페예요♡",2024-04-05 - 00:11:55
3686,naver,39,카페시사,서울 동대문구 전농로 217 정우빌딩 1층 카페시사, 4.51, 338,Mary Mary,23.12.24.일,배민으로 자주 시켜먹던곳 인데:) 직접와보니 커피도 디저트도 더 맛있어요!! 바스크치즈케이크 자주 시켜 먹었는데 딸기 타르트 진짜 맛있네용~ 스페셜 ...,2024-04-05 - 00:11:55
3687,naver,39,카페시사,서울 동대문구 전농로 217 정우빌딩 1층 카페시사, 4.51, 338,od****,1.5.금,제철을 맞은 딸기를 듬뿍올린 딸기타르트를 시켰는데 너무 신선하고 맛있은 딸기가 타르트위에 ... 까페시 사는 스페셜티원두가 있어서 남편이 정말 좋아...,2024-04-05 - 00:11:55
3688,naver,39,카페시사,서울 동대문구 전농로 217 정우빌딩 1층 카페시사, 4.51, 338,보리깽이,23.12.3.일,청량리 커피 1등! 원두 고를 수 있어서 좋고 디저트도 하나같이 다 맛도리네요. 손님 많은 이유가 있었네요. 강쥐는 안고있으면 입장가능❣️ 시립대학생들 ...,2024-04-05 - 00:11:55
3689,naver,39,카페시사,서울 동대문구 전농로 217 정우빌딩 1층 카페시사, 4.51, 338,배볼쨔리,1.6.토,카페시사 몇번 이용했었는데 늘 느끼는 거지만 혼자 가서 있는 것도 편하고 친구들이랑 함께 가도 넘 좋은 카페인 거 같이요!! 카페 내부가 깔끔하면서도 ...,2024-04-05 - 00:11:55
3690,naver,39,카페시사,서울 동대문구 전농로 217 정우빌딩 1층 카페시사, 4.51, 338,Qwertttuii27,2.4.일,조용해서 대화하기 편해요! 빵도 종류가 진짜 많고 마실거리도 많아서 좋았습니당 ㅎㅎ,2024-04-05 - 00:11:55
3691,naver,39,카페시사,서울 동대문구 전농로 217 정우빌딩 1층 카페시사, 4.51, 338,알콩언니33,23.11.28.화,"시립대생이 추천하는 디저트맛집 서울시립대 정문 카 페 시사 다녀왔어요 매장이 넓고 청결하고, 테이블도 많아요 데이트 소개팅 하기좋아요 카공하는분...",2024-04-05 - 00:11:55
3692,naver,39,카페시사,서울 동대문구 전농로 217 정우빌딩 1층 카페시사, 4.51, 338,뎅이15,23.11.2.목,분위기 좋고 시립대 앞에있어 접근성 완전 좋은 곳이 네용 ㅎㅎㅎ 멜론타르트는 잘 찾아볼 수 없는 타르트 인데 먹어보고 완전 깜놀 ㅎㅎ 타르트 시트가 ...,2024-04-05 - 00:11:55
3693,naver,39,카페시사,서울 동대문구 전농로 217 정우빌딩 1층 카페시사, 4.51, 338,아트솔33,2.10.토,"직원분이 정말 친절하시고 카페가 넓어서 좋아요. 노 트북 하거나 책 읽기도 좋을 것 같고, 저는 아기랑 함 께 왔는데 공간이 넓어서 편하게 있다가 왔습...",2024-04-05 - 00:11:55
3694,naver,39,카페시사,서울 동대문구 전농로 217 정우빌딩 1층 카페시사, 4.51, 338,평생사랑해주마,2.29.목,"기본 아메리카노는 원두 두 가지 고를 수 있
는데 매일 맛이 달라요 ㅋㅋㅋㅋㅋㅋㅋㅋㅋㅋ
하지만 드립도 있고 디저트도 맛잇습니다",2024-04-05 - 00:11:55
3695,naver,39,카페시사,서울 동대문구 전농로 217 정우빌딩 1층 카페시사, 4.51, 338,GoodReviewer,1.21.일,"원두 종류가 다양하고, 드립커피로 주문할 수 있는 곳이에요.
조용하진 않지만 커피가 맛있고, 대화하기 좋아요!",2024-04-05 - 00:11:55
3696,naver,39,카페시사,서울 동대문구 전농로 217 정우빌딩 1층 카페시사, 4.51, 338,가드냐,23.10.26.목,"샌드위치가 진짜 맛있는 동대문카페로 강추합니다. 
남편이랑 데이트 겸 나왔는데 직접 가게에서 로스팅
하는 커피도 넘나 좋아요. 콜드브루도 사서 갈 ...",2024-04-05 - 00:11:55
3697,naver,39,카페시사,서울 동대문구 전농로 217 정우빌딩 1층 카페시사, 4.51, 338,Oee,23.9.22.금,카페시사 처음 왔는데 무화과 타르트 너무 존맛이에 요!!!!!! 무화과 처음 먹어보는데 존맛이라 반해버렸네 요. 타르트 안쪽은 부드럽고 끝에는 바삭해서 ...,2024-04-05 - 00:11:55
3698,naver,39,카페시사,서울 동대문구 전농로 217 정우빌딩 1층 카페시사, 4.51, 338,밥이인형ACE,23.12.31.일,알바생들이겠죠? 카운터. 주문받던.. 여자들이 왜 이 렇게 불친절해요? 그냥 집에서 쉬던지 하지. 서비스 교육 좀 하시던지. 설마 시립대학생들은 아니...,2024-04-05 - 00:11:55
3699,naver,39,카페시사,서울 동대문구 전농로 217 정우빌딩 1층 카페시사, 4.51, 338,민츄루츄,23.10.31.화,"시대인은 무조건 안다는 카페시사 🤍 단연코, 시립대 정문 최고의 카페입니다. 디저트 맛있고 음료 양도 많아요 !! 공부하기도 , 팀프로젝트하기도 완벽...",2024-04-05 - 00:11:55
3700,naver,39,카페시사,서울 동대문구 전농로 217 정우빌딩 1층 카페시사, 4.51, 338,SSM스,23.11.8.수,"블루베리 치즈 베이글이랑 아이스티, 바닐라 까눌레 먹었어요! 달달 + 달달 + 달달 조합인데 다 너무 맛 있어서 부담스럽지 않고 피로가 풀리는 느낌...",2024-04-05 - 00:11:55
3701,naver,39,카페시사,서울 동대문구 전농로 217 정우빌딩 1층 카페시사, 4.51, 338,작은호랭이,4.2.화,간만에 시립대 앞에 갔더니 처음보는 카페가 생겼더라고요~ 커피도 맛있고 대화하기도 편하고 즐겁게 한시간 보내고 왔습니다~ ㅎㅎㅎㅎ,2024-04-05 - 00:11:55
3702,naver,39,카페시사,서울 동대문구 전농로 217 정우빌딩 1층 카페시사, 4.51, 338,비니별82,3.20.수,,2024-04-05 - 00:11:55
3703,naver,39,카페시사,서울 동대문구 전농로 217 정우빌딩 1층 카페시사, 4.51, 338,놈팽쑝,3.6.수,"타르트 맛있어요.
크기도 크고",2024-04-05 - 00:11:55
3704,naver,39,카페시사,서울 동대문구 전농로 217 정우빌딩 1층 카페시사, 4.51, 338,오리온s,23.9.21.목,딸기라떼 맛있어요! 근데 아래로 갈수록 좁아지는 컵 이라 양이 조금 적은것 같가도 해요ㅠ 그래도 손잡이 가 있어서 좋았습니다. 대파 크림치즈 베이글...,2024-04-05 - 00:11:55
3705,naver,39,카페시사,서울 동대문구 전농로 217 정우빌딩 1층 카페시사, 4.51, 338,호랑님king,23.11.12.일,타르트 종류가 많아요~ 사장님(?)인지 모르겠지만 여자 직원 분이 친절해요😊,2024-04-05 - 00:11:55
3706,naver,39,카페시사,서울 동대문구 전농로 217 정우빌딩 1층 카페시사, 4.51, 338,리뷰님,23.12.9.토,타르트가 맛있어보여서 방문했는데 카공하기에 좋고 노트북작업하기에도 좋아요✌️,2024-04-05 - 00:11:56
3707,naver,39,카페시사,서울 동대문구 전농로 217 정우빌딩 1층 카페시사, 4.51, 338,gmlakd0845,23.11.28.화,"양이 이렇게 많아도 되나효,,,? ❤️ 흑임자라떼는 완전
꼬숩고 레몬에이드는 진짜 상큼박사 그자체,, 진짜 
찐은 메론케이쿠요,, 여지껏 먹은 메론케이크...",2024-04-05 - 00:11:56
3708,naver,39,카페시사,서울 동대문구 전농로 217 정우빌딩 1층 카페시사, 4.51, 338,SSM스,23.12.14.목,"까눌레 전에 한 번 매장에서 먹고 반해서 오늘 2개 포
장했어요! 여전히 넘 달달하고 바삭촉촉하고 맛있어
요! 언젠가 시사 빵, 디저트 전부 도장깨기 할 결심...",2024-04-05 - 00:11:56
3709,naver,39,카페시사,서울 동대문구 전농로 217 정우빌딩 1층 카페시사, 4.51, 338,lov****,23.12.31.일,"키위에이드 생과일 씹히는맛이 최고였고 딸기타르트
는 딸기가 좀 신선하지않았던게 아쉽지만 맛있었습
니다.",2024-04-05 - 00:11:56
3710,naver,39,카페시사,서울 동대문구 전농로 217 정우빌딩 1층 카페시사, 4.51, 338,나를찾자,1.8.월,샌드위치가 가격대비 푸짐하고 맛나요~,2024-04-05 - 00:11:56
3711,naver,39,카페시사,서울 동대문구 전농로 217 정우빌딩 1층 카페시사, 4.51, 338,전농동토박이,2.8.목,음료가 좀 비씸,2024-04-05 - 00:11:56
3712,naver,39,카페시사,서울 동대문구 전농로 217 정우빌딩 1층 카페시사, 4.51, 338,정우석7299,23.7.31.월,공부하기도 대화하기도 적당한 백색소음이 잔잔한 카 페였어요 디카페인 라떼와 딸기요거트치즈케잌스무 디 브라우니타르트 먹었는데 브라우니타르트...,2024-04-05 - 00:11:56
3713,naver,39,카페시사,서울 동대문구 전농로 217 정우빌딩 1층 카페시사, 4.51, 338,LOVEON74,23.9.23.토,동네에 있어서 종종 왔었어요. 디저트 맛집인거 알고 있었는데 바스크 치즈케이크 정말 촉촉하고 맛있네요 💛💛 다음에 오면 무화과 타르트도 먹어보고...,2024-04-05 - 00:11:56
3714,naver,39,카페시사,서울 동대문구 전농로 217 정우빌딩 1층 카페시사, 4.51, 338,꽃 얼렁뚱땡,23.9.26.화,카페시사 내부가 이렇게 넓은지 몰랐어요ㅋㅋ 심지어 원두도 다양해서 골라먹을 수 있는 커피전문점이였 네요♡♡ 커피 너무 고소해서 맛있고 특히 무...,2024-04-05 - 00:11:56
3715,naver,39,카페시사,서울 동대문구 전농로 217 정우빌딩 1층 카페시사, 4.51, 338,볶봇봌,23.8.25.금,시립대 맞은편에있어서 학생들 많고 좌석도 넓어서 작업하기 좋네요 사장님들도 젊고 친절하시구요 베이커리 특히 타르트 맛있네요,2024-04-05 - 00:11:56
3716,naver,39,카페시사,서울 동대문구 전농로 217 정우빌딩 1층 카페시사, 4.51, 338,SSM스,23.11.1.수,"당, 카페인 줄이려고 스트로베리 티 먹었어요😆 저번 에 이터널 썸머 루이보스 티도 먹었는데 커피뿐만 아 니라 티도 다양하고 좋아요! 개인적으로 종이...",2024-04-05 - 00:11:56
3717,naver,39,카페시사,서울 동대문구 전농로 217 정우빌딩 1층 카페시사, 4.51, 338,이이이89,3.7.목,조아용! 맛있어용!,2024-04-05 - 00:11:56
3718,naver,39,카페시사,서울 동대문구 전농로 217 정우빌딩 1층 카페시사, 4.51, 338,모꾸밍,1.1.월,동네에서 커피랑 음요 제일 맛있는 맛집❤️,2024-04-05 - 00:11:56
3719,naver,39,카페시사,서울 동대문구 전농로 217 정우빌딩 1층 카페시사, 4.51, 338,명땡글,23.9.20.수,"타르트 많이 달지않고 과일은 아주 신선한게 요물이더라구요.
커피도 적당히 산미있는게 맛이 좋았어요.",2024-04-05 - 00:11:56
3720,naver,39,카페시사,서울 동대문구 전농로 217 정우빌딩 1층 카페시사, 4.51, 338,긍정의달인,23.10.28.토,카페 데이트하며 커피 마시기 좋은 카페에요 ㅎㅎ 커피 원두도 다양해 선택의 폭이 넓어 좋고 카페도 예뻐요 ㅎㅎ,2024-04-05 - 00:11:56
3721,naver,39,카페시사,서울 동대문구 전농로 217 정우빌딩 1층 카페시사, 4.51, 338,leeleee,23.10.16.월,무화과타르트 넘 예쁘고 맛있어요 까눌레도 최고!!🥹🥹🥹,2024-04-05 - 00:11:56
3722,naver,39,카페시사,서울 동대문구 전농로 217 정우빌딩 1층 카페시사, 4.51, 338,gracejji,23.9.21.목,아니 샌드위치 완전 제 서톼일 ♡ 극강의 쫀득함 너무 맛이쒀여,2024-04-05 - 00:11:56
3723,naver,39,카페시사,서울 동대문구 전농로 217 정우빌딩 1층 카페시사, 4.51, 338,소소한 바람,23.12.4.월,"정말 큼지막한 딸기가 듬뿍 올라간 카페시사의 딸기 
타르트와 밀크티, 메이플크림 콜드브루에요:_ 맛있
어요 ㅎ",2024-04-05 - 00:11:56
3724,naver,39,카페시사,서울 동대문구 전농로 217 정우빌딩 1층 카페시사, 4.51, 338,세공주의전설,23.10.3.화,카페가 널찍하고 분위기가 좋아요 청포도타르트는 크림치즈요거트의 맛이 풍미가 좋아요 동대문디저트 맛집입니다 !,2024-04-05 - 00:11:56
3725,naver,39,카페시사,서울 동대문구 전농로 217 정우빌딩 1층 카페시사, 4.51, 338,leeleee,23.10.12.목,"시사 까눌레 진짜 너무 맛있어요,,,,,",2024-04-05 - 00:11:56
3726,naver,39,카페시사,서울 동대문구 전농로 217 정우빌딩 1층 카페시사, 4.51, 338,감미로운고래2487,23.12.29.금,네이버 주문 픽업 연락이 안 와서 계속 대기했어요,2024-04-05 - 00:11:56
3727,naver,39,카페시사,서울 동대문구 전농로 217 정우빌딩 1층 카페시사, 4.51, 338,림탁,23.9.5.화,분위기도 좋고 다양한 디저트들 다 먹어 보고 싶은 전농동 카페,2024-04-05 - 00:11:56
3728,naver,39,카페시사,서울 동대문구 전농로 217 정우빌딩 1층 카페시사, 4.51, 338,jiahn,3.19.화,굿,2024-04-05 - 00:11:56
3729,naver,39,카페시사,서울 동대문구 전농로 217 정우빌딩 1층 카페시사, 4.51, 338,0nl****,23.10.22.일,시립대 근처에서 이렇게 디저트 잘하는 집 없는거 같 아요 ..💓💚 베이글부터 타르트까지 디저트 맛집이 에요 시사만의 차분한 분위기도 넘 좋아서 동...,2024-04-05 - 00:11:56
3730,naver,39,카페시사,서울 동대문구 전농로 217 정우빌딩 1층 카페시사, 4.51, 338,어썸e,23.11.3.금,"디저트가 예쁘고 맛있음!
과일디저트 많은 게 좋아요👍
전농카페로 추천;)",2024-04-05 - 00:11:56
3731,naver,39,카페시사,서울 동대문구 전농로 217 정우빌딩 1층 카페시사, 4.51, 338,앙싱당옹,23.11.12.일,"커피도 디저트도 맛있고
공부하기 좋은 카페입니다~",2024-04-05 - 00:11:56
3732,naver,39,카페시사,서울 동대문구 전농로 217 정우빌딩 1층 카페시사, 4.51, 338,자기만족리뷰,23.8.25.금,동대문 카페 추천! 시립대앞 카페 시사 디저트 맛집이에요,2024-04-05 - 00:11:56
3733,naver,39,카페시사,서울 동대문구 전농로 217 정우빌딩 1층 카페시사, 4.51, 338,예유갓댓예미예미,23.9.20.수,항상 학교 앞에 있어서 지나치기만 했는데 이렇게 베이글 맛집일 줄은... 넘 맛있어요!,2024-04-05 - 00:11:57
3734,naver,39,카페시사,서울 동대문구 전농로 217 정우빌딩 1층 카페시사, 4.51, 338,윤잔,23.12.11.월,생초콜릿 음료 진쩌 말 그대로 꾸덕한 초코 음료예요 초코 덕후 필수~~,2024-04-05 - 00:11:57
3735,naver,39,카페시사,서울 동대문구 전농로 217 정우빌딩 1층 카페시사, 4.51, 338,보통의나날,23.12.5.화,"에이드 종류 항상
여기서 먹어요",2024-04-05 - 00:11:57
3736,naver,39,카페시사,서울 동대문구 전농로 217 정우빌딩 1층 카페시사, 4.51, 338,흐헤76,23.9.26.화,"맛도 있고 넓고 쾌적해서 좋아요! 직원분이 친절해서 
더 좋았고 친구들과 과제나 이야기 하기 좋았어요 
동대문카페는 여기로 추천합니다 !!",2024-04-05 - 00:11:57
3737,naver,39,카페시사,서울 동대문구 전농로 217 정우빌딩 1층 카페시사, 4.51, 338,쵸코우유딸기우유,23.10.11.수,"세트 크림치즈살라미샌드위치 + 아메_시사블렌딩hot
 7,800원에 잘먹고갑니다~",2024-04-05 - 00:11:57
3738,naver,39,카페시사,서울 동대문구 전농로 217 정우빌딩 1층 카페시사, 4.51, 338,아이러브단백질,23.8.28.월,"시립대 국룰 카공/밥약 코스 !!! 로 추천합니다.
무화과타르트 좀 가격대가 있지만 존맛탱이에요! 무화과시즌에 먹어야죠 ㅎㅎ",2024-04-05 - 00:11:57
3739,naver,39,카페시사,서울 동대문구 전농로 217 정우빌딩 1층 카페시사, 4.51, 338,뽀뇨뇸,23.12.6.수,밀크티도 맛있어요~,2024-04-05 - 00:11:57
3740,naver,39,카페시사,서울 동대문구 전농로 217 정우빌딩 1층 카페시사, 4.51, 338,Wwas,23.8.15.화,"원두 고를수도 있고, 원두맛도 좋아요 
베이커리도 근방에 비해 많은편이고 
노트북하기도 좋고 자주 가게 되는 카페에요",2024-04-05 - 00:11:57
3741,naver,39,카페시사,서울 동대문구 전농로 217 정우빌딩 1층 카페시사, 4.51, 338,쇼바냥,23.8.5.토,무더운 날씨에 시원한 카페인이 땡기는 그런 오전~ 맛있는 커피 마시러 동대문카페 카페시사 동대문디 저트가 맛있는 전농카페 다녀왔어요! 시립대 ...,2024-04-05 - 00:11:57
3742,naver,39,카페시사,서울 동대문구 전농로 217 정우빌딩 1층 카페시사, 4.51, 338,이유3859,23.10.22.일,타르트맛집... 진짜 여기만큼 타르트 맛있는 곳 본적이 없어요 특히 청포도요거트타르트 대추천이욤,2024-04-05 - 00:11:57
3743,naver,39,카페시사,서울 동대문구 전농로 217 정우빌딩 1층 카페시사, 4.51, 338,lif****,23.12.25.월,굿,2024-04-05 - 00:11:57
3744,naver,39,카페시사,서울 동대문구 전농로 217 정우빌딩 1층 카페시사, 4.51, 338,뽀뇨뇸,23.11.17.금,커피가 맛있어요~,2024-04-05 - 00:11:57
3745,naver,39,카페시사,서울 동대문구 전농로 217 정우빌딩 1층 카페시사, 4.51, 338,itl****,23.12.4.월,좋아요,2024-04-05 - 00:11:57
3746,naver,39,카페시사,서울 동대문구 전농로 217 정우빌딩 1층 카페시사, 4.51, 338,모든걸먹어치우는,23.10.3.화,샌디치 맛나융,2024-04-05 - 00:11:57
3747,naver,39,카페시사,서울 동대문구 전농로 217 정우빌딩 1층 카페시사, 4.51, 338,EUD,23.8.16.수,"여기 디저트 종류랑 커피 존맛,,
맨날 배달만으로 만나다가 근처 들렸는데 완전 넓음!",2024-04-05 - 00:11:57
3748,naver,39,카페시사,서울 동대문구 전농로 217 정우빌딩 1층 카페시사, 4.51, 338,4329,23.7.19.수,"커피랑 디저트가 맛있어요 빵맛집입니다
베이글 샌드위치 까눌레 타르트..",2024-04-05 - 00:11:57
3749,naver,39,카페시사,서울 동대문구 전농로 217 정우빌딩 1층 카페시사, 4.51, 338,leeleee,23.9.25.월,좋아용,2024-04-05 - 00:11:57
3750,naver,39,카페시사,서울 동대문구 전농로 217 정우빌딩 1층 카페시사, 4.51, 338,하얀사과78,23.8.23.수,카페가ㅈ넓고 에이드 맛있어요,2024-04-05 - 00:11:57
3751,naver,39,카페시사,서울 동대문구 전농로 217 정우빌딩 1층 카페시사, 4.51, 338,hap****,1.17.수,맛있어요,2024-04-05 - 00:11:57
3752,naver,39,카페시사,서울 동대문구 전농로 217 정우빌딩 1층 카페시사, 4.51, 338,내머리꽃밭,23.5.26.금,빵이 다 맛있어요 오늘은 초코 들어간 동글동글한 빵 이 없어서 소금빵이랑 다른거 포장해왔는데 사진은 제 최애빵으로 올렸네용 ㅎ_ㅎ 주차가 불편하...,2024-04-05 - 00:11:57
3753,naver,39,카페시사,서울 동대문구 전농로 217 정우빌딩 1층 카페시사, 4.51, 338,가로수길미세스채,23.5.2.화,"1. 다크쵸코 아메리카노 맛있음 2. 여기는 빵맛집임 3.
매장이 넓어서 시험기간에 여기서 공부하는 시립대
생 많음 4. 화장실 매장 안에 있음",2024-04-05 - 00:11:57
3754,naver,39,카페시사,서울 동대문구 전농로 217 정우빌딩 1층 카페시사, 4.51, 338,4329,23.6.13.화,커피가 저렴하고 맛있어용,2024-04-05 - 00:11:57
3755,naver,39,카페시사,서울 동대문구 전농로 217 정우빌딩 1층 카페시사, 4.51, 338,it****,23.4.5.수,타르트가 다른 곳에 비해 과일도 맛잇고 타르트 자체도 맛잇어서 맛이 잘 조화를 이룹니다 추천합니다,2024-04-05 - 00:11:57
3756,naver,39,카페시사,서울 동대문구 전농로 217 정우빌딩 1층 카페시사, 4.51, 338,나를찾자,23.6.1.목,타르트 아래 부분이 너무 두껍고 퍼석거려요~,2024-04-05 - 00:11:57
3757,naver,39,카페시사,서울 동대문구 전농로 217 정우빌딩 1층 카페시사, 4.51, 338,gogogo413,23.10.22.일,일찍부터 모닝커피,2024-04-05 - 00:11:57
3758,naver,39,카페시사,서울 동대문구 전농로 217 정우빌딩 1층 카페시사, 4.51, 338,Beatrice70,23.8.7.월,좋아요,2024-04-05 - 00:11:57
3759,naver,39,카페시사,서울 동대문구 전농로 217 정우빌딩 1층 카페시사, 4.51, 338,4329,23.5.26.금,카페시사 편안하고 커피와 디저트가 맛있습니다,2024-04-05 - 00:11:58
3760,naver,39,카페시사,서울 동대문구 전농로 217 정우빌딩 1층 카페시사, 4.51, 338,소망가득8,23.7.17.월,,2024-04-05 - 00:11:58
3761,naver,39,카페시사,서울 동대문구 전농로 217 정우빌딩 1층 카페시사, 4.51, 338,4329,23.5.11.목,커피저렴하고 깨끗합니다,2024-04-05 - 00:11:58
3762,naver,39,카페시사,서울 동대문구 전농로 217 정우빌딩 1층 카페시사, 4.51, 338,rtg66,23.4.22.토,타르트 존맛 탱탱탱탱구리 가성비도 굿굿굿음료 보다는 베이커리류 강자예요 카공하기 너무너무 좋음! 콘센트가 많지 않긴한데 의자가 편해서 좋아요,2024-04-05 - 00:11:58
3763,naver,39,카페시사,서울 동대문구 전농로 217 정우빌딩 1층 카페시사, 4.51, 338,it****,23.3.14.화,타르트가 진짜 맛잇습니다! 커피 다 맛있어요,2024-04-05 - 00:11:58
3764,naver,39,카페시사,서울 동대문구 전농로 217 정우빌딩 1층 카페시사, 4.51, 338,사랑해3037,23.3.8.수,매장이 청결한 느낌은 없음요ㅠㅠ 남자직원분 밖에서 담배태우고 왔는데 손도 안닦고 음료만드심....,2024-04-05 - 00:11:58
3765,naver,39,카페시사,서울 동대문구 전농로 217 정우빌딩 1층 카페시사, 4.51, 338,Blue2l,23.1.6.금,"디저트, 음료가 다양해요:) 혼카페 가기도 같이 가기 도 좋아요 분위기도 편하고 공부나 작업하기 편해요 밀크티는 별로 맛이없어요ㅠ 컵에서 퐁퐁향 나...",2024-04-05 - 00:11:58
