,Platform,Number,Store,Address,Review_score,Review_counts,ID,Date,Review_text,Time
2372,naver,25,러프도우,서울 노원구 동일로 986 118호,, 405,yoo****,3.9.토,공릉동 하드빵 맛집답게 전부 다 맛있었어요! 깜빠뉴 는 퐁신 쫀득한게 부담없이 술술 들어갔고 푸가스는 바삭 쫀득한게 매콤짭짤해서 매력적이었어요:)...,2024-04-05 - 00:04:01
2373,naver,25,러프도우,서울 노원구 동일로 986 118호,, 405,밥그릇콜렉터,3.23.토,태릉입구역에 있는 러프도우 라는 빵집 치아바타 깜 빠뉴등 식사 빵 위주의 베이커리 비교적 저렴한 가격 으로 맛있는 빵을 구매 할 수있는 테이크아웃 ...,2024-04-05 - 00:04:01
2374,naver,25,러프도우,서울 노원구 동일로 986 118호,, 405,티파니11,4.2.화,2시쯤 갔더니 원래 사려던 빵은 다 팔려서 남아있는 빵중에 골라 왔어요. 맛은 좋았습니다. 담백하고 속도 편해서 식사빵으로 좋아요. 올리브치아바타 먹...,2024-04-05 - 00:04:01
2375,naver,25,러프도우,서울 노원구 동일로 986 118호,, 405,최강 앨프녀,3.13.수,"치아바타랑 초코크림 깜바뉴 먹었는데 진짜 맛있었어
요 ! 촉촉하고 재료가 알차게 들어가있는 느낌이라 담
백한데 맛있어요 ! 올리브+발사믹은 꼭 찍어드...",2024-04-05 - 00:04:01
2376,naver,25,러프도우,서울 노원구 동일로 986 118호,, 405,gyw****,3.28.목,"드디어 왔다,,, 미친메뉴들아닌가요 다 맛없없 텅장
되는 순간인데 이 멋진이들을 겟하기위해 일찍오십쇼
 사장님 너무 친절하시고 멋지세여",2024-04-05 - 00:04:01
2377,naver,25,러프도우,서울 노원구 동일로 986 118호,, 405,sb****,2.1.목,"출장가다가 빵집이 보여서 갑자기 들렸네요. 11시 오 픈인데 손님이 몇분 서 계셨습니다. 노원구 빵집은 제 법 많이 아는데, 이곳은 처음입니다. 입구에서...",2024-04-05 - 00:04:01
2378,naver,25,러프도우,서울 노원구 동일로 986 118호,, 405,솔솔몬90,3.27.수,빵 종류도 많고 신선하고 무엇보다 맛있어요!!! 뭘 선택해도 성공이에요 치아바타는 엄청 부드럽고 잠봉뵈르는 안 짜고 버터향이 가득해서 좋았습니다,2024-04-05 - 00:04:01
2379,naver,25,러프도우,서울 노원구 동일로 986 118호,, 405,잰이얌,3.16.토,오픈하고 한시간 후에 왔는데 선택지가 많아서 좋았 어요! 문열면 빵냄새가 확 나는데 향긋해요…ㅎㅎㅎ 방부제 안 쓰신다고해서 조금 멀어도 방문했는...,2024-04-05 - 00:04:01
2380,naver,25,러프도우,서울 노원구 동일로 986 118호,, 405,숟댕,1.27.토,예전부터 궁금했던 곳이라 집이랑 거리가 있는데도 불구하고 찾아왔어요! 하드빵 좋아하는데 바게트 치 아바타 깜파뉴 등등 종류가 다양해서 고르는 ...,2024-04-05 - 00:04:01
2381,naver,25,러프도우,서울 노원구 동일로 986 118호,, 405,귤귤5973,3.21.목,친구가 너무 맛있는 빵집이라고 이야기해서 따라가 봤어요. 의자가 2개 있는데 마침 자리가 비어 있어서 매장에서 먹고 갈 수 있었는데요. 저희가 구매...,2024-04-05 - 00:04:01
2382,naver,25,러프도우,서울 노원구 동일로 986 118호,, 405,1st****,3.9.토,"하드빵 좋아하는데 태릉입구역 바로 앞에 있는 러프
도우에서 살 수 있어서 행복해요..💗 아메리카노도 
맛있고 가격도 합리적이라서 자주 방문할 것 같아요!",2024-04-05 - 00:04:01
2383,naver,25,러프도우,서울 노원구 동일로 986 118호,, 405,Jdddworld,1.29.월,"전부터 궁금했던 태릉입구 신상 빵집. 생각보다 더 아 담했는데 종류는 다양해서 좋았어요. 당찬 사장님도 너무 친절하시고 ㅎㅎ 치즈, 초코, 단호박 등 각...",2024-04-05 - 00:04:01
2384,naver,25,러프도우,서울 노원구 동일로 986 118호,, 405,댜댜링,3.30.토,"사장님도 너무너무 친절하시구 공릉동에 이런건강하 고 맛있는 빵집이 생겨서 넘넘 행복해요♥️♥️😊 건강한 재료, 맛에 이 가격이라니...🫢 벌써 내돈내산...",2024-04-05 - 00:04:01
2385,naver,25,러프도우,서울 노원구 동일로 986 118호,, 405,bim****,3.12.화,태릉입구 근처 갈일이 있어서 갔다가 즐겨찾기해놓은 러프도우의 빵을 드디어 사서 이틀 내내 빵으로 식사 를 했습니다 ㅎㅎ 원래 위장이 안좋은 편인데 ...,2024-04-05 - 00:04:02
2386,naver,25,러프도우,서울 노원구 동일로 986 118호,, 405,피크닉3924,1.2.화,요즘 깜빠뉴의 맛을 알아버린 사람인데 집근처에 다 양한 깜빠뉴 파는곳을 발견! 깜빠뉴외에도 피자와 바 게트등 다른류의 빵도 팔고있어서 고르는데 ...,2024-04-05 - 00:04:02
2387,naver,25,러프도우,서울 노원구 동일로 986 118호,, 405,mwmw,3.6.수,빵맛집이 여기 있었네요! 빵하나하나 너무 건강하고 맛있었어요! 빵종류도 다양하고 다 너무 맛있어보여 서 고르기 힘들었어요 ㅎㅎ 사장님도 너무 친...,2024-04-05 - 00:04:02
2388,naver,25,러프도우,서울 노원구 동일로 986 118호,, 405,loveand,3.19.화,초코크치랑 단호박크치가 주기적으로 생각나더라구 요 ! 가족들이 너무 좋아해서 방문했어요 사장님도 친절하시고 매장도 너무 청결합니다! 태릉에서...,2024-04-05 - 00:04:02
2389,naver,25,러프도우,서울 노원구 동일로 986 118호,, 405,주주따우전,1.2.화,태릉입구 6번출구와 5번출구 나와서 바로앞에 맛있 는 빵집이 있다고 해서 갔는데! 매장도 너무 예쁘고 빵 종류도 많고 감자스프도 팔아서 잔뜩 폭풍 ...,2024-04-05 - 00:04:02
2390,naver,25,러프도우,서울 노원구 동일로 986 118호,, 405,애플민트3853,2.8.목,"좋은 재료로 잘 만들어진 빵이 가득한 곳이예요. 메 뉴 도장깨기 하고 있는데 오늘은 잠봉뵈르. 투머치 바 나나 , 올리브 치아바타 러스크(달콤하고 고급...",2024-04-05 - 00:04:02
2391,naver,25,러프도우,서울 노원구 동일로 986 118호,, 405,나는맛도리,1.13.토,"태릉입구역과 엄청 가까운 건강한 빵집! 유기농, 프랑 스 밀가루로 만드는 하드빵집이라고 하네요! 테이크 아웃 매장이라 저는 빵 2개를 포장해서 집에서 ...",2024-04-05 - 00:04:02
2392,naver,25,러프도우,서울 노원구 동일로 986 118호,, 405,제니쓰,1.3.수,러프도우는 프랑스 유기농 밀가루를 사용한다고 하 네요!!! 매일 아침 갓 구워 매우 빵이 매우 쫄깃했으며 저온숙성으로 속이 매우 편했고 부담없이 먹...,2024-04-05 - 00:04:02
2393,naver,25,러프도우,서울 노원구 동일로 986 118호,, 405,Yeriel쩡,3.1.금,"감자치이즈깜뱌누만 살라 햇는데 비주얼이 너무 맛잇어 보여서 고구마치아바타도구매!
사장님 친절하세요👍",2024-04-05 - 00:04:02
2394,naver,25,러프도우,서울 노원구 동일로 986 118호,, 405,하하살,3.14.목,하드빵인데 종류가 참 많아요. 건강한 느낌입니다.,2024-04-05 - 00:04:02
2395,naver,25,러프도우,서울 노원구 동일로 986 118호,, 405,둥둥228,23.12.7.목,"태릉입구 지나가다가 본 매장인데 완전 빵 맛집이에 요. 초코 크림치즈 깜파뉴, 무화과 깜파뉴를 주문했는 데 쫀득 담백해서 정말 맛있어요!! 초코 크림치...",2024-04-05 - 00:04:02
2396,naver,25,러프도우,서울 노원구 동일로 986 118호,, 405,유니맘 밍밍,3.22.금,"검색해보고 맛집이라 들렀어요~
사장님 넘 친절하시고 좋아요 ^-^",2024-04-05 - 00:04:02
2397,naver,25,러프도우,서울 노원구 동일로 986 118호,, 405,등뼈,2.12.월,근처 들렀다가 배고파서 들어갔는데 외국온것 같았어 요. 하드빵 종류도 많고 사와서 나오자마자 먹었는데 오오 맛있어요!!!! 기본 도우며 베이스가 풍미가...,2024-04-05 - 00:04:02
2398,naver,25,러프도우,서울 노원구 동일로 986 118호,, 405,체리샤벳,1.29.월,지나가다가 빵냄새가 너무 맛있게나서 홀리듯이 들어 갔어요🫠 빵수니도 아닌데 빵냄새가 너무 좋더라구 요 인기가 많은거같아요! 여자분들이 지나치지...,2024-04-05 - 00:04:02
2399,naver,25,러프도우,서울 노원구 동일로 986 118호,, 405,지현4149,3.7.목,"평소에 하드빵보다는 크림빵 종류를 좋아하는데 여기
빵 먹어보고 하드빵에 빠졌어요! 정말 소화도 잘되고
맛도 너무 맛있더라구요! 다음에 다시 한번 들...",2024-04-05 - 00:04:02
2400,naver,25,러프도우,서울 노원구 동일로 986 118호,, 405,백서리언니,2.26.월,"몇번째 방문인지 세는건 무의미해짐 아 뭔가 잊었는 데? 싶으면 그 주에 러프도우 빵 안사먹은것.. 일주일 에 한번은 꼭 먹어야 하는, 도무지 참을 수 없는...",2024-04-05 - 00:04:02
2401,naver,25,러프도우,서울 노원구 동일로 986 118호,, 405,Hoyaaaaaa,1.5.금,공릉에 빵맛집 생겼네요?? 프랑스 빵집인데 너무 빵 종류가 다양하고 비주얼도 너무 맛있어 보였어요 자 칭 빵순이로써안 들릴 수가 없더라구요!! 유럽 ...,2024-04-05 - 00:04:02
2402,naver,25,러프도우,서울 노원구 동일로 986 118호,, 405,여륾,23.12.23.토,빵 하나를 먹어도 제대로 된 식사처럼 건강하고 든든 하게 먹을 수 있어요☺️ 수제 하드빵이라 프랜차이즈 와는 다르게 더 특색있고 건강하게 고소한 맛...,2024-04-05 - 00:04:02
2403,naver,25,러프도우,서울 노원구 동일로 986 118호,, 405,lov****,1.23.화,건강하게 만든 하드빵인데 맛도 좋아요 겉은 바삭하고 속은 쫄깃하니 비건빵인데도 맛있네요 앞으로 하드빵 자주 찾을 것 같네요,2024-04-05 - 00:04:02
2404,naver,25,러프도우,서울 노원구 동일로 986 118호,, 405,쀼의세상,1.17.수,"빵 종류도 진짜다양하고 건강한 하드빵이 많아요~~
집근처에 발효빵집이 생겨서 넘 좋네요!
식사빵류도 많아서 종종 이용합니다",2024-04-05 - 00:04:02
2405,naver,25,러프도우,서울 노원구 동일로 986 118호,, 405,Naranja17,2.29.목,진짜 유로프스탈 겉바촉촉 쫜득한 깜빠뉴!!! 솔트트위 스트도 완전 맛남... 이런 빵집을 늘 찾았는데 딱 이곳 에서 발견 ㅠㅠ그냥 먹으면 씹는맛이 고소하고...,2024-04-05 - 00:04:02
2406,naver,25,러프도우,서울 노원구 동일로 986 118호,, 405,산들48,3.14.목,"태릉입구역 1분컷이라 접근성 좋고 맛도 조아요👍
건강한 느낌, 빵이 딱딱하지않고 부드럽고 맛있어요~ 종류도 엄청 다양해요",2024-04-05 - 00:04:02
2407,naver,25,러프도우,서울 노원구 동일로 986 118호,, 405,강물41,3.6.수,"무화과깜파뉴, 올리브치아바타 모두 치즈가 들어가있
어서 맛을 더 맛있게 해줘요. 빵 종류도 다양하고 식
사 하기에 든든해요 ✌🏽 사장님 너무 유쾌하고 ...",2024-04-05 - 00:04:02
2408,naver,25,러프도우,서울 노원구 동일로 986 118호,, 405,뚜어니뚜어니,3.1.금,가는길에 홀려서 들어왔숨둥 맛있고 건강할 것 같아여,2024-04-05 - 00:04:02
2409,naver,25,러프도우,서울 노원구 동일로 986 118호,, 405,0104pey,2.16.금,"최근에 새로나온 롤치즈식빵 존맛이에요!! 전자렌지 에 1분 데우면 따끈촉촉폭신해서 더 맛있게 먹을수있 어요😋 올리브치아바타, 고구마치아바타, 무...",2024-04-05 - 00:04:02
2410,naver,25,러프도우,서울 노원구 동일로 986 118호,, 405,윰유메,23.12.9.토,러프도우 단호박 깜파뉴 너무 맛있네요🥹 빵도 쫄깃 쫄깃한데 안에 단호박과 크림치즈가 아낌 없이 들어 가있어요..!! 이렇게 맛있는 깜빠뉴 처음 먹어...,2024-04-05 - 00:04:02
2411,naver,25,러프도우,서울 노원구 동일로 986 118호,, 405,sun****,23.12.27.수,"태릉입구쪽에 새로생긴 베이커리집이있어서 방문해
봤는데 빵종류도 글코 건강한 빵들이 많아요~ 초코
치즈빵이랑 페퍼로니피자빵 둘다 쫀득하고 너...",2024-04-05 - 00:04:03
2412,naver,25,러프도우,서울 노원구 동일로 986 118호,, 405,반짝이맘1028,1.29.월,"러프도우는 건강한 빵이예요 당일 생산해서 당일판매
해요 샌드위치는 품절이라 안타까웠지만 페페로니피
자 감자호로록 페스츄리 구매했어요^0^ 맛있...",2024-04-05 - 00:04:03
2413,naver,25,러프도우,서울 노원구 동일로 986 118호,, 405,mal****,1.11.목,빵이 완전 건강한맛이에요! 피자맛있다고 추천해주셔 서 피자빵 샀는데 와! 넘 맛있어요. 건깅한 피자 먹는 느낌!!! 부모님도 좋아하실맛이에요~~! 깜바뉴...,2024-04-05 - 00:04:03
2414,naver,25,러프도우,서울 노원구 동일로 986 118호,, 405,mnm50278,23.11.2.목,빵 먹고 나면 속 부대낌도 없고 빵 자체가 정말 맛있 어요. 테이크아웃 밖에 안되긴 하지만 빵 자체가 맛있 어서 단골분들이 많이들 찾아오시는것 같았어...,2024-04-05 - 00:04:03
2415,naver,25,러프도우,서울 노원구 동일로 986 118호,, 405,별빛아낙,3.23.토,늘 와보고 싶었던 곳이에요. 건강하면서도 맛있는 빵. 단골될 것 같아요.^^,2024-04-05 - 00:04:03
2416,naver,25,러프도우,서울 노원구 동일로 986 118호,, 405,hye****,3.16.토,넘 맛있어요 ㅠㅠㅠㅠ 새로운 메뉴들도 넘 좋으네유 사장님 친절하세요 ❤️❤️,2024-04-05 - 00:04:03
2417,naver,25,러프도우,서울 노원구 동일로 986 118호,, 405,Laura0928,23.11.14.화,"하드빵을 정말 좋아해서 일부러 찾아갔어요. 깊은 고 민 끝에 감자호로록과 무화과크치깜바뉴 샀어요. 사 장님이 친절하시고, 감자스프 정말 진하고, 깜...",2024-04-05 - 00:04:03
2418,naver,25,러프도우,서울 노원구 동일로 986 118호,, 405,나라올라888,2.12.월,빵이 맛있고 건강한 맛임다,2024-04-05 - 00:04:03
2419,naver,25,러프도우,서울 노원구 동일로 986 118호,, 405,myc****,23.12.29.금,"저번에 사먹구 맛있어서 또 방문했어요!! 버섯크림피
자 빵이랑 버섯크림이 너무 잘어울리고 앙버터는 제
가 먹어본 앙버터 중에 제일 맛있는거 같아요!!",2024-04-05 - 00:04:03
2420,naver,25,러프도우,서울 노원구 동일로 986 118호,, 405,Socats,3.27.수,진짜 마싯어요 단골 !!!!!!!!! 다 먹어볼끄야 !!,2024-04-05 - 00:04:03
2421,naver,25,러프도우,서울 노원구 동일로 986 118호,, 405,에이미다람,3.16.토,앙버터랑 시오트위스트 맛있어요,2024-04-05 - 00:04:03
2422,naver,25,러프도우,서울 노원구 동일로 986 118호,, 405,로 운,3.14.목,지나다닐 때마다 빵냄새가 너무 좋아서 홀린듯이 방문... 사장님도 친절하세요 🥺🥺,2024-04-05 - 00:04:03
2423,naver,25,러프도우,서울 노원구 동일로 986 118호,, 405,Socats,3.12.화,"동네에서 발견한 빵집 ! 지난번에 먹고 맛있어서 또 
방문했어요 🥹 뭔가 고급스러운 맛 남 ㅎㅎ 동네에 
있어서 넘 좋아요",2024-04-05 - 00:04:03
2424,naver,25,러프도우,서울 노원구 동일로 986 118호,, 405,hyolos,3.9.토,"매장이 유럽같아용
빵도 맛있어보입니다 🤍",2024-04-05 - 00:04:03
2425,naver,25,러프도우,서울 노원구 동일로 986 118호,, 405,UUUH,23.10.26.목,예전에 근처 친구에게 서프라이즈 선물로 배달했었는 데 워낙 반응이 좋았던 기억이 났어요. 그래서 북한산 다녀오는 길에 들러서 제가 먹을 빵과 지인들 ...,2024-04-05 - 00:04:03
2426,naver,25,러프도우,서울 노원구 동일로 986 118호,, 405,엉큼한주노,23.12.19.화,"태릉 빵집 찾다가 완전 맛집을 찾았어요!! 특별한 빵 들이 많아서 너무 신기했고, 맛도 너무 있어서 행복하 게 빵 고르고 갑니다!! 사장님 너무 친절하고 위...",2024-04-05 - 00:04:03
2427,naver,25,러프도우,서울 노원구 동일로 986 118호,, 405,윤소정51,2.28.수,빵이 너무 고소하고 맛있어요~ 빵 생각날 때마다 들르는 곳 이에요~:),2024-04-05 - 00:04:03
2428,naver,25,러프도우,서울 노원구 동일로 986 118호,, 405,Lauren Ko,2.27.화,빵 쫀득쫀득하고 넘 맛있어요!! 가격도 괜찮네요 :),2024-04-05 - 00:04:03
2429,naver,25,러프도우,서울 노원구 동일로 986 118호,, 405,울룰루라랄,23.10.26.목,오전 일찍가서 갓나온 빵을 먹어봤는데 너무 맛있었 어요! 특히 단호박 깜파뉴와 올리브 치아바타가 맛있 었습니다👍👍 유기농 프랑스 밀로 만드시구 ...,2024-04-05 - 00:04:03
2430,naver,25,러프도우,서울 노원구 동일로 986 118호,, 405,안 찌,3.12.화,빵이 종류가 다양하고 전부 맛있어 보여요! 사장님도 친절하시고 매장 분위기도 넘 좋아요 자주 올게요!,2024-04-05 - 00:04:03
2431,naver,25,러프도우,서울 노원구 동일로 986 118호,, 405,티파니11,23.11.2.목,식사빵 맛집이에요. 먹고 나서 속도 편하고 빵이 쫄깃 하고 부드러워요. 라임크림은 있으면 꼭 사야 해요. 너무 상큼하고 맛있어요. 빵이 전체적으로 약...,2024-04-05 - 00:04:03
2432,naver,25,러프도우,서울 노원구 동일로 986 118호,, 405,민지157,3.16.토,사장님 친절하시구요ㅎㅎ 일찍 방문했는데도 빵 많았어용ㅎㅎ 감자스프는 다음주부터 하신대요ㅎㅎ!! 다음주 또 방문 예약이용🥰,2024-04-05 - 00:04:03
2433,naver,25,러프도우,서울 노원구 동일로 986 118호,, 405,김찬2294,3.11.월,빵이 종류도 다양하고 맛있어요! 역 근처라 들리기 편하고 사장님도 친절하세요ㅎ ㅎ,2024-04-05 - 00:04:03
2434,naver,25,러프도우,서울 노원구 동일로 986 118호,, 405,똑똑이3771,23.12.26.화,"빵 2개랑 커피 포장해서 갔는데,, 엄청 맛있었어요!완전 제가 좋아하는 담백하고 쫄깃한 빵이더라고요👍 커피도 산미없이 고소해서 맛있었어요😆",2024-04-05 - 00:04:03
2435,naver,25,러프도우,서울 노원구 동일로 986 118호,, 405,Ilovematzip,3.29.금,"예약하고 가셔야합니다!!
진짜 맛있는 빵집이에용ㅎㅎ",2024-04-05 - 00:04:03
2436,naver,25,러프도우,서울 노원구 동일로 986 118호,, 405,햄5282,3.8.금,"빵맛집! 사장님도 친절해요:)
하드계열 빵을 좋아해서 완전 제 취향 빵집입니다!!
저희 집앞으로 와주세요ㅠㅠ",2024-04-05 - 00:04:03
2437,naver,25,러프도우,서울 노원구 동일로 986 118호,, 405,재키31,3.8.금,갈때마다 빵 고르는 재미가 쏠쏠해요! 이번에 고른 초코크치 깜빠뉴 맛있었어용🩷,2024-04-05 - 00:04:03
2438,naver,25,러프도우,서울 노원구 동일로 986 118호,, 405,YUSU90,3.16.토,호두크림치즈깜빠뉴 진짜 짱이에요,2024-04-05 - 00:04:04
2439,naver,25,러프도우,서울 노원구 동일로 986 118호,, 405,애플민트3853,2.14.수,"발렌타인데이에 휘낭시에 좋아하는 남편 위해 예약하고 받아왔어요~!! 잘 구워진 휘낭시에 식감이 좋았고
바질향 가득한 바질휘낭시에가 특히 맛있네요~^^",2024-04-05 - 00:04:04
2440,naver,25,러프도우,서울 노원구 동일로 986 118호,, 405,Gourmet Queen,23.9.26.화,소문만 듣고 간다만다 하다가 처음으로 갔는데 상냥 하게 웃어주시면서 맞이해주셨고 아담한 사이즈의 사 장님에 비해서 빵을 너무나 맛있게 베이킹 하...,2024-04-05 - 00:04:04
2441,naver,25,러프도우,서울 노원구 동일로 986 118호,, 405,Ssiung,3.9.토,"빵이 항상 맛있어요 
오늘은 먹고 싶었던게 품절 되서 새로운 걸로 시도해 봅니다 ~^^",2024-04-05 - 00:04:04
2442,naver,25,러프도우,서울 노원구 동일로 986 118호,, 405,gracejji,23.9.25.월,소화가 잘되는 유럽식 빵 스타일이라 속 더부룩함앖 이 편안히 먹었고 샌드위치 하몽스퇄의 햄이 짭쪼롬 하면서 달달 무화과잼과 ㅏ삭 채소의 조합이 ...,2024-04-05 - 00:04:04
2443,naver,25,러프도우,서울 노원구 동일로 986 118호,, 405,올리브 77,3.21.목,"유기농 밀가루로 만든 건강한 베이커리 집 입니다~ 
사장님 친절 햇살 맛집",2024-04-05 - 00:04:04
2444,naver,25,러프도우,서울 노원구 동일로 986 118호,, 405,ssubb,3.18.월,식사빵 좋아하신다면 무조건 추천합니다~!!,2024-04-05 - 00:04:04
2445,naver,25,러프도우,서울 노원구 동일로 986 118호,, 405,서노하80,3.13.수,"건강하고 맛있는 빵이에요
회사근처에 이런 빵집이 생겨서 너무 좋아요ㅠㅠ",2024-04-05 - 00:04:04
2446,naver,25,러프도우,서울 노원구 동일로 986 118호,, 405,향기롭게21,3.15.금,"분위기 좋고, 빵 맛있다고 해서 첨 방문해봤어요.
단골 될 듯^^",2024-04-05 - 00:04:04
2447,naver,25,러프도우,서울 노원구 동일로 986 118호,, 405,박혜진1267,2.22.목,지나가면서 항상 먹어보고 싶었던 가게에요! 친절하시고 매장도 아담한데 깨끗하고 빵 냄새가 엄청 좋아요🥰🥰,2024-04-05 - 00:04:04
2448,naver,25,러프도우,서울 노원구 동일로 986 118호,, 405,애기얼굴,1.24.수,"공릉동 빵수니 여러분 여기 다 모이십셔,,, 왼쪽 끝에 살짝 보이는 쉐이크기계가 얼음쳐돌이를 설레게 합니다 그러,,,",2024-04-05 - 00:04:04
2449,naver,25,러프도우,서울 노원구 동일로 986 118호,, 405,부천후후,3.9.토,치아바타가 메인이고 매장작지만 퀄리티 대박입니다,2024-04-05 - 00:04:04
2450,naver,25,러프도우,서울 노원구 동일로 986 118호,, 405,숑숑나,2.17.토,"와보고싶었던 새로생긴 빵집! 
작지만 메뉴가 다양해서 좋았어요
사장님 친절하시고 재방문의사 있습니다 :)",2024-04-05 - 00:04:04
2451,naver,25,러프도우,서울 노원구 동일로 986 118호,, 405,gg93hyun,2.20.화,재료도 건강하고 사장님도 친절하시고 빵도 맛있어서 재방문 했어요:) 엘리게이터 강추에요😊👍🏻,2024-04-05 - 00:04:04
2452,naver,25,러프도우,서울 노원구 동일로 986 118호,, 405,백서리언니,23.10.10.화,"편도염이 심해서 감자호로록! 스프랑 (바게트보단) 부드러운 치아바타랑 옴뇸뇸 썬드라이 치아바타에 꽂 혀있는 요즘입니다 올리브와 꼬숩짭짤 치즈, ...",2024-04-05 - 00:04:04
2453,naver,25,러프도우,서울 노원구 동일로 986 118호,, 405,루시아송,2.19.월,재구매입니당 ㅎㅎ 단골 예약입니다 이런 빵집 생겨서 넘 좋아요 번창하세요!!!,2024-04-05 - 00:04:04
2454,naver,25,러프도우,서울 노원구 동일로 986 118호,, 405,eunice8787,1.13.토,"좋은 재료로 만든 빵이 맛뿐만아니라 마음까지 편해
지는 건강함이 느껴져요.",2024-04-05 - 00:04:04
2455,naver,25,러프도우,서울 노원구 동일로 986 118호,, 405,욘두욘두,23.12.19.화,인생 빵집을 찾았오요…. 초코크림치즈빵 다들 먹어보셔요… 초코맛도 잘 느껴지고 크림치즈와 조합도 아주 좋아요. 빵도 딱딱하지 않고 식감이 아주 좋아요,2024-04-05 - 00:04:04
2456,naver,25,러프도우,서울 노원구 동일로 986 118호,, 405,술술이이,4.1.월,"빵이 맛있어보이구 좋아요^^
자주방문할게용",2024-04-05 - 00:04:04
2457,naver,25,러프도우,서울 노원구 동일로 986 118호,, 405,오난다,23.10.21.토,"테이크 아웃 전문점인데, 태릉역에 빵집이 있는줄 몰
랐네요~~ 프랑스 여행 간것 같아서 좋아요! 건강한 빵
집이라 자주 올듯해요!😄",2024-04-05 - 00:04:04
2458,naver,25,러프도우,서울 노원구 동일로 986 118호,, 405,AGhj,23.11.13.월,"늘 친절하시고 맛있어요! #시오트위스트 솔트트위스
트 #무화과브리샌드위치 #머핀 #라임크림",2024-04-05 - 00:04:04
2459,naver,25,러프도우,서울 노원구 동일로 986 118호,, 405,ziu****,1.16.화,"전체적으로 건강한 맛이랄까 싱거운 편인데
차하고 같이 먹으니 딱 좋았습니다.",2024-04-05 - 00:04:04
2460,naver,25,러프도우,서울 노원구 동일로 986 118호,, 405,지오닝5,23.9.22.금,"오늘은 대자연의 날 시작.. 꼭 안먹던 초코가 먹고 싶 었는데,러프도우에는 단빵이 없어 고민하던 중에 초 코스틱을 사보았어요.. 사장님께서 별로 안달...",2024-04-05 - 00:04:04
2461,naver,25,러프도우,서울 노원구 동일로 986 118호,, 405,ksy50278,23.11.2.목,"지난번에 맛있게 먹어서 재방문했어요! 이번에는 고 구마 깜파뉴와 마르게리따 피자 사왔음😋 막 나왔을 때는 바로 먹으니 맛있었는데, 이날은 퇴근하...",2024-04-05 - 00:04:04
2462,naver,25,러프도우,서울 노원구 동일로 986 118호,, 405,YUSU90,2.17.토,"빵이 쫄깃하고 맛있어요
잼이나 다른거 없이 그냥 먹어도 맛있어요",2024-04-05 - 00:04:04
2463,naver,25,러프도우,서울 노원구 동일로 986 118호,, 405,영인공주39,3.26.화,빵이다양하고 맛있어요 건강에도돟은 식사빵이에요 추천추천,2024-04-05 - 00:04:04
2464,naver,25,러프도우,서울 노원구 동일로 986 118호,, 405,달빛여우jk,23.10.30.월,"재방문입니다 너무나 제 스타일이라 좋아요 오래 머
물러주세요 사장님도 친철하시고 다시 가고픈곳😍 
오늘은 배가불러 소소하게구매합니다 라임크...",2024-04-05 - 00:04:04
