,Platform,Number,Store,Address,Review_score,Review_counts,ID,Date,Review_text,Time
817,naver,26,만십리,"서울 성동구 무학봉길 82 1-3F, rooftop", 4.47, 768,부천사람,3.28.목,음악도 좋고 분위기도 아늑하고 굿입니다.,2024-04-05 - 00:29:46
818,naver,26,만십리,"서울 성동구 무학봉길 82 1-3F, rooftop", 4.47, 768,먹는게제일저아,3.23.토,디저트 예쁘고 맛있어요~~ 사장님도 친절하셔서 자주 방문할것같아요!,2024-04-05 - 00:29:46
819,naver,26,만십리,"서울 성동구 무학봉길 82 1-3F, rooftop", 4.47, 768,켈빈71,2.17.토,"방문해서 커피한잔 마시고 디저트가 맛있어서

포장해서 가져가요!!ㅎㅎ",2024-04-05 - 00:29:46
820,naver,26,만십리,"서울 성동구 무학봉길 82 1-3F, rooftop", 4.47, 768,소미는내꺼,1.13.토,"여기 디저트 진짜 존맛탱이에요..!!
특히 에그타르트 넘 맛있어서 종종 재방문 합니다 ㅎㅎ",2024-04-05 - 00:29:46
821,naver,26,만십리,"서울 성동구 무학봉길 82 1-3F, rooftop", 4.47, 768,삼화종합철강,3.24.일,귀엽고 사랑스러운 디저트 카페입니당.,2024-04-05 - 00:29:46
822,naver,26,만십리,"서울 성동구 무학봉길 82 1-3F, rooftop", 4.47, 768,미냉미냉96,23.12.9.토,"주택 개조해서 만든 카페네요~ 맛난 디저트들이 많았
는데 배불러서ㅠ 담에 다른것도 먹어보고 싶어요~ 친
절하고 아늑해요^^",2024-04-05 - 00:29:46
823,naver,26,만십리,"서울 성동구 무학봉길 82 1-3F, rooftop", 4.47, 768,Dear 사슴,1.7.일,"왕십리역 근처에 있는 카페인데 디저트가 맛있어요
이층 자리는 넓진 않지만 대화하기 아늑했어요",2024-04-05 - 00:29:46
824,naver,26,만십리,"서울 성동구 무학봉길 82 1-3F, rooftop", 4.47, 768,반짝궁딩이,1.29.월,집근처 디처트맛집 추천요 신랑 딸기케이크가 먹고싶 어서 왔어요 ㅎㅎㅎ 자다가도 생각날듯한 생크림 최 고입니다!!! 그리고 쿠키를 막 구우셔서 그런지 ...,2024-04-05 - 00:29:46
825,naver,26,만십리,"서울 성동구 무학봉길 82 1-3F, rooftop", 4.47, 768,mimi6532,23.12.2.토,"딸기슈크림, 말차스콘, 에그타르크, 고메버터바 먹어 봤어요! 다 맛있었지만 저는 말차스콘이 제일 맛있었 고 제 남자친구는 고메버터바가 가장 맛있었대...",2024-04-05 - 00:29:46
826,naver,26,만십리,"서울 성동구 무학봉길 82 1-3F, rooftop", 4.47, 768,무민1096,2.1.목,카페 분위기도 좋고 다양한 종류 베이커리가 있어서 좋아요! 특히 딸기케이크가 너무 맛있어보여요 ❤️,2024-04-05 - 00:29:46
827,naver,26,만십리,"서울 성동구 무학봉길 82 1-3F, rooftop", 4.47, 768,호호8457,2.18.일,분위가 마음에들어요 집을 개조한거 같은데 방으로 몇몇 테이블들이 구분되어 있어서 모임하기 좋았어요 특이한 커피메뉴있어서 좋았음,2024-04-05 - 00:29:46
828,naver,26,만십리,"서울 성동구 무학봉길 82 1-3F, rooftop", 4.47, 768,덩으닝,3.23.토,케이크가 정말 맛있어욤 분위기도 좋고 디저트 3개 시켜서 먹방하고 왔어요,2024-04-05 - 00:29:46
829,naver,26,만십리,"서울 성동구 무학봉길 82 1-3F, rooftop", 4.47, 768,Hyunoopy,23.10.15.일,"1층만 이용하다가 친구들하고 2층 매장도 이용했어 요!! 주말이라 도넛이나 다른제품들이 많진 않았지만 쿠키, 마들렌, 버터바도 맛있더라구요! 더블초...",2024-04-05 - 00:29:47
830,naver,26,만십리,"서울 성동구 무학봉길 82 1-3F, rooftop", 4.47, 768,Santapo,1.27.토,공간이 예쁘고 아기자기해요. 디저트류도 다양하고 친절합니다. 또 올것 같아요,2024-04-05 - 00:29:47
831,naver,26,만십리,"서울 성동구 무학봉길 82 1-3F, rooftop", 4.47, 768,벨봄,1.13.토,브라우니 완전 맛있어요! 초코 좋아하는 사람은 꼭 시 키세요. 음료도 다 맛있고 딸기케이크도 최고예요. 3 층까지 이용할 수 있는데 3층은 올라가는 계단...,2024-04-05 - 00:29:47
832,naver,26,만십리,"서울 성동구 무학봉길 82 1-3F, rooftop", 4.47, 768,진빵양,3.15.금,"자리도 좋고 디저트도 맛있어요 !! 
다음에 또 방문할게요",2024-04-05 - 00:29:47
833,naver,26,만십리,"서울 성동구 무학봉길 82 1-3F, rooftop", 4.47, 768,키키2955,3.15.금,너무 맛있어서 벌써 세번째 오고 있어요 버터 좋은거 쓰시는게 느껴지는 맛!!!!!!!!!!,2024-04-05 - 00:29:47
834,naver,26,만십리,"서울 성동구 무학봉길 82 1-3F, rooftop", 4.47, 768,파인애플1145,23.12.5.화,"커피, 디저트, 인테리어 모두다 쵝오에요!!🫶
그리고….사장님도 넘나 친절해요!!!!😍",2024-04-05 - 00:29:47
835,naver,26,만십리,"서울 성동구 무학봉길 82 1-3F, rooftop", 4.47, 768,태웅빵,23.12.2.토,"내부 인테리어도 귀엽고 따뜻해요!
디저트도 왕 많구 다 맛있어요!!!
연말 분위기 가득하네여!",2024-04-05 - 00:29:47
836,naver,26,만십리,"서울 성동구 무학봉길 82 1-3F, rooftop", 4.47, 768,망굴밍굴,23.12.3.일,디저트 포장하러 방문했는데 매장도 이쁘고 사장님도 친절하셔서 좋았습니다! 디저트 맛있게 먹겠습니다 ㅎㅎ 감사합니다!,2024-04-05 - 00:29:47
837,naver,26,만십리,"서울 성동구 무학봉길 82 1-3F, rooftop", 4.47, 768,냠냠냠냐미냠,23.12.24.일,크리스마스 분위기에 맞게 트리도 너무 예쁘고 매장 분위기도 따뜻해서 좋아요,2024-04-05 - 00:29:47
838,naver,26,만십리,"서울 성동구 무학봉길 82 1-3F, rooftop", 4.47, 768,nah****,2.17.토,커피가 맛있어요! 매장도 이쁘구요~,2024-04-05 - 00:29:47
839,naver,26,만십리,"서울 성동구 무학봉길 82 1-3F, rooftop", 4.47, 768,qysu,3.15.금,너무 맛있는게 많고 자리도 예쁘고 조아요 ♡꙼̈,2024-04-05 - 00:29:47
840,naver,26,만십리,"서울 성동구 무학봉길 82 1-3F, rooftop", 4.47, 768,deedoo,1.15.월,케이크 맛있구 분위기가 좋아용,2024-04-05 - 00:29:47
841,naver,26,만십리,"서울 성동구 무학봉길 82 1-3F, rooftop", 4.47, 768,임윤호65,1.26.금,"다음엔 도넛 먹으러 올게요ㅠㅠ
배만 안불렀어도 많이 먹을 수 있는데...
맛있게 먹겠습니다!",2024-04-05 - 00:29:47
842,naver,26,만십리,"서울 성동구 무학봉길 82 1-3F, rooftop", 4.47, 768,오다은00,1.8.월,"인테리어도 예쁘고, 디저트 종류도 많고 예뻐서 보는 재미와 먹는 재미 모두 있었어요 !! ㅎㅎ 우드톤 인테 리어라 추운 날씨와 더욱 잘 어울려서 커피 마...",2024-04-05 - 00:29:47
843,naver,26,만십리,"서울 성동구 무학봉길 82 1-3F, rooftop", 4.47, 768,55555ㅇ,3.17.일,,2024-04-05 - 00:29:47
844,naver,26,만십리,"서울 성동구 무학봉길 82 1-3F, rooftop", 4.47, 768,카페 탐방하는 운동인,3.9.토,"디저트 종류 많아요 사장님 친절하십니다
🍰♥️",2024-04-05 - 00:29:47
845,naver,26,만십리,"서울 성동구 무학봉길 82 1-3F, rooftop", 4.47, 768,khy****,23.12.1.금,넘무 이뿌고 분위기 좋아요! 따뜻하고 주인장님두 친절하세요!,2024-04-05 - 00:29:47
846,naver,26,만십리,"서울 성동구 무학봉길 82 1-3F, rooftop", 4.47, 768,바잇블,23.12.1.금,인테리어도 이쁘고 여러가지 디저트 류가 많아서 좋아용 ☺️ 왕십리 행당시장쪽에 구움류 디저트가 많은 커피숍이 없어서 만십리만의 매력이 더 돋보여요,2024-04-05 - 00:29:47
847,naver,26,만십리,"서울 성동구 무학봉길 82 1-3F, rooftop", 4.47, 768,enok95,23.12.2.토,왕십리 근처 카페찾다가 가게됐는데 건물분위기가 크 리스마스에 딱어울리는 분위기에요. 빵종류가 많아서 빵돌이인 나한테 딱 맞는가게 방금나온 따끈따...,2024-04-05 - 00:29:47
848,naver,26,만십리,"서울 성동구 무학봉길 82 1-3F, rooftop", 4.47, 768,myo****,1.31.수,"근처에 일이잇어서 왓다가 버터바랑 디저트 먹은 기억이잇어서 들렷는데 맛잇어서 또왓어요 
자리도 넓고 아늑해서 좋아요",2024-04-05 - 00:29:47
849,naver,26,만십리,"서울 성동구 무학봉길 82 1-3F, rooftop", 4.47, 768,오렝지,1.27.토,디저트랑 커피도 다 맛있고 분위기도 좋아여!,2024-04-05 - 00:29:47
850,naver,26,만십리,"서울 성동구 무학봉길 82 1-3F, rooftop", 4.47, 768,미소의 세상81,23.12.5.화,크럼블이 이쁘고 사장님이 맛있어요…..!,2024-04-05 - 00:29:47
851,naver,26,만십리,"서울 성동구 무학봉길 82 1-3F, rooftop", 4.47, 768,하나둘46,1.31.수,카페가 분위기가 따뜻해서 좋아요~ 디저트도 다양해서 다음에 또 오고싶어요^^,2024-04-05 - 00:29:47
852,naver,26,만십리,"서울 성동구 무학봉길 82 1-3F, rooftop", 4.47, 768,딤디디담다,1.26.금,3층이어서 너무 좋아요!!! 아늑하고 내부 인테리어도 마음에 들어용 잘 머물다 갑니당:),2024-04-05 - 00:29:47
853,naver,26,만십리,"서울 성동구 무학봉길 82 1-3F, rooftop", 4.47, 768,라빔,23.10.14.토,바나나푸딩샀습니다. 상왕십리역 근처라 꼭 한번 가 보고싶었지만 왕십리에서 걸어서 거리가 좀 있어서 가보지못하고있었는데 이번에 드뎌 가봤네요 ...,2024-04-05 - 00:29:47
854,naver,26,만십리,"서울 성동구 무학봉길 82 1-3F, rooftop", 4.47, 768,Rusty,2.3.토,딸기 케이크가 맛있어요. 근데 조금 비싼듯 ㅠㅠ 금딸기라 그런가..,2024-04-05 - 00:29:47
855,naver,26,만십리,"서울 성동구 무학봉길 82 1-3F, rooftop", 4.47, 768,나만먹어,23.12.26.화,매장도 예쁘고 디저트도 맛있어서 좋아요❤️ 집 앞이라 자주 올 것 같아용,2024-04-05 - 00:29:47
856,naver,26,만십리,"서울 성동구 무학봉길 82 1-3F, rooftop", 4.47, 768,amunababu,23.10.11.수,"소담히 이야기 나누기 좋아요
음료와 디저트 맛나요",2024-04-05 - 00:29:47
857,naver,26,만십리,"서울 성동구 무학봉길 82 1-3F, rooftop", 4.47, 768,slswkehfh,1.27.토,소문듣고찾아왔는데 너무 예뻐용🩵,2024-04-05 - 00:29:48
858,naver,26,만십리,"서울 성동구 무학봉길 82 1-3F, rooftop", 4.47, 768,reflower16,23.9.23.토,전체적으로 쪼금 달긴하지만 맛있어요! 밀크티는 로 즈향이 은은하게 나고 라떼도 신맛이 강하지 않아서 좋아요:) 인테리어도 외국 빈티지 카페 느낌이...,2024-04-05 - 00:29:48
859,naver,26,만십리,"서울 성동구 무학봉길 82 1-3F, rooftop", 4.47, 768,구름구름53,23.12.3.일,디저트 종류도 다양하고 무엇보다 반려동물입장이 가능해서 편안하게 올수가 있어 좋았습니당! 계속 이용할게요~,2024-04-05 - 00:29:48
860,naver,26,만십리,"서울 성동구 무학봉길 82 1-3F, rooftop", 4.47, 768,퐁퐁080,1.17.수,카페가 이쁘고 맛있어용!!,2024-04-05 - 00:29:48
861,naver,26,만십리,"서울 성동구 무학봉길 82 1-3F, rooftop", 4.47, 768,햄볶은맛,23.9.9.토,시그니처라떼인 꽃별정라떼 맛있게 먹고 왔어요~ 베이커리류도 맛있어보였습니당•••🥹🥹,2024-04-05 - 00:29:48
862,naver,26,만십리,"서울 성동구 무학봉길 82 1-3F, rooftop", 4.47, 768,안산숨겨진 맛집 미식가,23.12.1.금,"특별한 디저트&음료 너무 맛있네요.
연말모임으로 추천",2024-04-05 - 00:29:48
863,naver,26,만십리,"서울 성동구 무학봉길 82 1-3F, rooftop", 4.47, 768,옹옹12,23.12.2.토,특별한 버터바들과 맛난 디저트들이 있어요 추천!,2024-04-05 - 00:29:48
864,naver,26,만십리,"서울 성동구 무학봉길 82 1-3F, rooftop", 4.47, 768,jxsxx,23.12.2.토,디저트 맛있어보이는거 너뮤 많아요 ㅜ. ㅜ 또 올거에용,2024-04-05 - 00:29:48
865,naver,26,만십리,"서울 성동구 무학봉길 82 1-3F, rooftop", 4.47, 768,kan****,23.12.2.토,에그타르트도 맛있고 가게도 예뻐요!,2024-04-05 - 00:29:48
866,naver,26,만십리,"서울 성동구 무학봉길 82 1-3F, rooftop", 4.47, 768,ddddddd9,1.3.수,디저트가 맛있고 가게 인테리어가 예뻐서 사진도 잘 나와요!!,2024-04-05 - 00:29:48
867,naver,26,만십리,"서울 성동구 무학봉길 82 1-3F, rooftop", 4.47, 768,MIFFYS2,1.26.금,,2024-04-05 - 00:29:48
868,naver,26,만십리,"서울 성동구 무학봉길 82 1-3F, rooftop", 4.47, 768,whdgkqdls,23.12.3.일,"인스타감성충만!
데이트 코스로 와야할것같고
사장님이 친절해요!!",2024-04-05 - 00:29:48
869,naver,26,만십리,"서울 성동구 무학봉길 82 1-3F, rooftop", 4.47, 768,내가 다먹어야지,23.12.1.금,집근처에 분위기 좋은 디져트 집이 생겨서 너무 좋아요! 앞으로 자주 방문할게요 :),2024-04-05 - 00:29:48
870,naver,26,만십리,"서울 성동구 무학봉길 82 1-3F, rooftop", 4.47, 768,thunday,23.10.9.월,버터바 너무 맛있게 잘 먹었어요 !,2024-04-05 - 00:29:48
871,naver,26,만십리,"서울 성동구 무학봉길 82 1-3F, rooftop", 4.47, 768,사랑해8982,23.5.24.수,아기자기 인테리어도 예쁘고 통창이라 뷰도 좋고 사 진 찍을만한 포인트가 많아요. 디저트 맛집이란 리뷰 보고 왕십리에서 찾아갔는데 위치는 상왕십리...,2024-04-05 - 00:29:48
872,naver,26,만십리,"서울 성동구 무학봉길 82 1-3F, rooftop", 4.47, 768,celine0128,23.12.24.일,음료 맛있고 케이크도 맛있고 친절하세요,2024-04-05 - 00:29:48
873,naver,26,만십리,"서울 성동구 무학봉길 82 1-3F, rooftop", 4.47, 768,Friday6pm70,23.12.7.목,동네에 있어서 와봤는데 좋습니다.,2024-04-05 - 00:29:48
874,naver,26,만십리,"서울 성동구 무학봉길 82 1-3F, rooftop", 4.47, 768,푸우댕,23.5.27.토,"꼭 가보고 싶었던 카페였는데 분위기도 넘 좋고 빵이 랑 커피,더블초코라떼도 맛있었어요 주택을 개조하여 만든 건지 좌석은 많거나 넓지는 않았어요 애...",2024-04-05 - 00:29:48
875,naver,26,만십리,"서울 성동구 무학봉길 82 1-3F, rooftop", 4.47, 768,713****,23.12.1.금,맛있어요~~~♡ 분위기조아횽!,2024-04-05 - 00:29:48
876,naver,26,만십리,"서울 성동구 무학봉길 82 1-3F, rooftop", 4.47, 768,pectin,23.12.1.금,디저트 종류가 다양해서 새로운 맛의 디저트가 먹고 싶을 때 방문합니다!,2024-04-05 - 00:29:48
877,naver,26,만십리,"서울 성동구 무학봉길 82 1-3F, rooftop", 4.47, 768,헤리얼,23.7.29.토,"#상왕십리카페 #상왕십리데이트 친구들이랑 방문했
어요 다양한 디저트들이 많고 브라우니 위에 꼭 아이
스크림 추가해서 드세요🤭 #말차라떼 #바닐라라떼",2024-04-05 - 00:29:48
878,naver,26,만십리,"서울 성동구 무학봉길 82 1-3F, rooftop", 4.47, 768,흰여우리,23.6.12.월,"내부 인테리어가 아기자기하고, 직원분이 친절하셔서 좋았습니다. 계단이 가파르기 때문에 조심하셔야 할 것 같고, 화장실은 2층에 있습니다. 맛은 전반...",2024-04-05 - 00:29:48
879,naver,26,만십리,"서울 성동구 무학봉길 82 1-3F, rooftop", 4.47, 768,onemint4922,23.9.11.월,디저트 짱맛있어요! 커피도 맛있습니다,2024-04-05 - 00:29:48
880,naver,26,만십리,"서울 성동구 무학봉길 82 1-3F, rooftop", 4.47, 768,elin39,23.5.7.일,"4층 옥상뷰가 좋아요~! 카페 공간이 위로 많아서 각층 은 좀 좁긴해요 ㅠㅠ바스크치즈케이크 맛잇었는데 사진 찍는거 까먹엇어요,,, 다른데보다 좀더 진...",2024-04-05 - 00:29:48
881,naver,26,만십리,"서울 성동구 무학봉길 82 1-3F, rooftop", 4.47, 768,뚜미ㄴ,23.6.18.일,진짜 디저트들이 다 미쳤습미다..글고 커피도 넘 맛있고 어쩜 다 맛있죠..? 사장님도 매우 친절하세요!!!!!! 진짜 왕십리갈때마다 가고싶은곳입니다요!!💗,2024-04-05 - 00:29:48
882,naver,26,만십리,"서울 성동구 무학봉길 82 1-3F, rooftop", 4.47, 768,boltaeng,2.24.토,맛나요,2024-04-05 - 00:29:48
883,naver,26,만십리,"서울 성동구 무학봉길 82 1-3F, rooftop", 4.47, 768,qnxks,23.5.27.토,"사장님도 친절하시고 디저트들도 넘 맛잇어요 !! 보들 보들한 프토도 트러플치즈크럼블도 체고 ,, 크림라떼 들까지 맛도리 ,, 분위기도 좋구요 집 근처면 자...",2024-04-05 - 00:29:48
884,naver,26,만십리,"서울 성동구 무학봉길 82 1-3F, rooftop", 4.47, 768,느티나무5911,23.4.28.금,"디저트 맛집이네요 마들렌 가격 착해요 쫀득버터바 
맛있어요 적당히 달아서 좋아요 커피맛은 갠적으로..
. 직원분 친절해요",2024-04-05 - 00:29:48
885,naver,26,만십리,"서울 성동구 무학봉길 82 1-3F, rooftop", 4.47, 768,고옴962,23.8.20.일,로즈밀크티 맛있당,2024-04-05 - 00:29:49
886,naver,26,만십리,"서울 성동구 무학봉길 82 1-3F, rooftop", 4.47, 768,lke****,23.12.1.금,굿,2024-04-05 - 00:29:49
887,naver,26,만십리,"서울 성동구 무학봉길 82 1-3F, rooftop", 4.47, 768,peaceful life,23.5.8.월,음료가 맛있고 인테리어도 이쁘네요~,2024-04-05 - 00:29:49
888,naver,26,만십리,"서울 성동구 무학봉길 82 1-3F, rooftop", 4.47, 768,gggsss2525,23.7.22.토,"에그타르트 맛있었어요
공간이 나뉘어있어서 좋았습니다
조금 더운감이 있었지만 좋았어요",2024-04-05 - 00:29:49
889,naver,26,만십리,"서울 성동구 무학봉길 82 1-3F, rooftop", 4.47, 768,피자통닭,23.8.10.목,테이크아웃 하면 할인까지 해줘서 대박,2024-04-05 - 00:29:49
890,naver,26,만십리,"서울 성동구 무학봉길 82 1-3F, rooftop", 4.47, 768,앙퀴,23.3.26.일,"우연히 알게된 카페인데 디저트 다양하게 많아서 뭘 먹을지 고민댑니다..ㅎㅎ
가격대비 퀄리티 좋아서 나만 알고싶은 카페❤️❤️",2024-04-05 - 00:29:49
891,naver,26,만십리,"서울 성동구 무학봉길 82 1-3F, rooftop", 4.47, 768,코코리7144,23.5.7.일,"동네 주택가에 이런 커피숍이 있는지 이제 알았네요^^;;
디저트도 맛있고 커피도 맛있어요~",2024-04-05 - 00:29:49
892,naver,26,만십리,"서울 성동구 무학봉길 82 1-3F, rooftop", 4.47, 768,어쩌라개,23.6.4.일,디저트가 맛있네요,2024-04-05 - 00:29:49
893,naver,26,만십리,"서울 성동구 무학봉길 82 1-3F, rooftop", 4.47, 768,행동가들,23.5.1.월,"왕십리에 이런 카페가 있다니,, .넘 예뻐요 🥳😍",2024-04-05 - 00:29:49
894,naver,26,만십리,"서울 성동구 무학봉길 82 1-3F, rooftop", 4.47, 768,피자통닭,23.7.29.토,커피만 사는데 디저트가 맛있어 보이지만 디저트는 인상착의와 어울리지 못하다 생각할까봐 살 용기가 안 난다,2024-04-05 - 00:29:49
895,naver,26,만십리,"서울 성동구 무학봉길 82 1-3F, rooftop", 4.47, 768,달리는쉼14,23.5.19.금,동네 이정도 카페 흔하지 않쥬~~~,2024-04-05 - 00:29:49
896,naver,26,만십리,"서울 성동구 무학봉길 82 1-3F, rooftop", 4.47, 768,참치4889,23.4.16.일,조용하고 디저트도 맛있어요 👅,2024-04-05 - 00:29:49
897,naver,26,만십리,"서울 성동구 무학봉길 82 1-3F, rooftop", 4.47, 768,지금순간88,23.6.23.금,"커피랑 쫀득버터바 먹었는데 맛있었어요!
담소 나누기 너무 좋아요~!!",2024-04-05 - 00:29:49
898,naver,26,만십리,"서울 성동구 무학봉길 82 1-3F, rooftop", 4.47, 768,6MEGU9,23.3.15.수,"에그타르트가 역대급이네요. 음료도 디저트도 내공이 느껴지는 맛입니다. 다만 화장실 청결도가 신경쓰여 서 (바닥 머리카락, 거미줄, 이물질들) 이 부분...",2024-04-05 - 00:29:49
899,naver,26,만십리,"서울 성동구 무학봉길 82 1-3F, rooftop", 4.47, 768,알럽미67,23.5.7.일,"애견동반가능
계단이 가파름",2024-04-05 - 00:29:49
900,naver,26,만십리,"서울 성동구 무학봉길 82 1-3F, rooftop", 4.47, 768,방울이6569,23.4.29.토,얼그레이 마들렌이 맛있고 직원분이 엄청 친절해요,2024-04-05 - 00:29:49
901,naver,26,만십리,"서울 성동구 무학봉길 82 1-3F, rooftop", 4.47, 768,콕콕콕콕콕코코콕,23.3.9.목,매장도 넓고 디저트도 음료도 맛있어요,2024-04-05 - 00:29:49
902,naver,26,만십리,"서울 성동구 무학봉길 82 1-3F, rooftop", 4.47, 768,someday3616,23.6.11.일,"정말 너무 친절했고 분위기 좋았던 카페. 아이들이 목
마르다고해서 잠깐 들렀는데 너무 친절한덕에 기분
좋게 아이들과 1인1잔 호로록 마시고 왔네요~ ...",2024-04-05 - 00:29:49
903,naver,26,만십리,"서울 성동구 무학봉길 82 1-3F, rooftop", 4.47, 768,ESTJ찐,23.5.10.수,"디저트맛집이에요.
루프탑도 이용 가능해요",2024-04-05 - 00:29:49
904,naver,26,만십리,"서울 성동구 무학봉길 82 1-3F, rooftop", 4.47, 768,sosul41,23.3.22.수,분위기 좋은데 계단이 가파르고 오픈이 늦음,2024-04-05 - 00:29:49
905,naver,26,만십리,"서울 성동구 무학봉길 82 1-3F, rooftop", 4.47, 768,버럭쟁이92,23.2.11.토,인테리어가 예쁘고 커피가 맛있어요!,2024-04-05 - 00:29:49
906,naver,26,만십리,"서울 성동구 무학봉길 82 1-3F, rooftop", 4.47, 768,es39,23.8.19.토,좋아요,2024-04-05 - 00:29:49
907,naver,26,만십리,"서울 성동구 무학봉길 82 1-3F, rooftop", 4.47, 768,닝이야,23.6.5.월,,2024-04-05 - 00:29:49
908,naver,26,만십리,"서울 성동구 무학봉길 82 1-3F, rooftop", 4.47, 768,영 자,23.1.12.목,분위기도 좋고 예쁘고 커피 맛도 괜찮은 왕십리 카페 발견!! 다음에 또 갈 거예요🫶🏻,2024-04-05 - 00:29:49
909,naver,26,만십리,"서울 성동구 무학봉길 82 1-3F, rooftop", 4.47, 768,루터킹,23.5.13.토,,2024-04-05 - 00:29:49
910,naver,26,만십리,"서울 성동구 무학봉길 82 1-3F, rooftop", 4.47, 768,맹듀다,23.2.3.금,혼자 하셔서 시간은 조금 걸리지만 음료가 다 특색있고 좋아요,2024-04-05 - 00:29:49
911,naver,26,만십리,"서울 성동구 무학봉길 82 1-3F, rooftop", 4.47, 768,다요다요옹,23.4.16.일,인테리어도 예쁘고 디저트도 너무 맛있어요!!,2024-04-05 - 00:29:49
912,naver,26,만십리,"서울 성동구 무학봉길 82 1-3F, rooftop", 4.47, 768,백프로100,23.5.6.토,,2024-04-05 - 00:29:50
913,naver,26,만십리,"서울 성동구 무학봉길 82 1-3F, rooftop", 4.47, 768,빙글빙글나미51,23.3.2.목,"처음 방문..
커피도. 맛나도. 분위기도. 조아요~^^",2024-04-05 - 00:29:50
914,naver,26,만십리,"서울 성동구 무학봉길 82 1-3F, rooftop", 4.47, 768,eloizesweet,23.3.26.일,기대 이상의 공간❕,2024-04-05 - 00:29:50
915,naver,26,만십리,"서울 성동구 무학봉길 82 1-3F, rooftop", 4.47, 768,비그르히그르,22.12.26.월,"라떼가 고소하고 맛있어요☕️
도넛 먹어보고 싶었는데 월, 수요일에는 도넛이 안나온다고 하네요🥲",2024-04-05 - 00:29:50
916,naver,26,만십리,"서울 성동구 무학봉길 82 1-3F, rooftop", 4.47, 768,Bongsgo,23.1.26.목,쫀득버터바가 맛있어요. 아이스크림 추가해서 먹으니 더 맛나네요. 커피는 디저트와 마시기 적당한 맛입니다.,2024-04-05 - 00:29:50
917,naver,27,달콤한위로,서울 성북구 창경궁로43길 24 1층, 4.36," 2,141",초초는먹보,3.17.일,배민으로 보고 맛있겠다 생각하고 직접 찾아왔어요 ㅋㅋㅋ 종류도 다양하고 가격도 합리적인데 맛있어요 ..♥️ 구움과자보단 도넛이랑 케이크가 맛도리에...,2024-04-05 - 00:30:24
918,naver,27,달콤한위로,서울 성북구 창경궁로43길 24 1층, 4.36," 2,141",초초는먹보,3.30.토,"두번째 방문~! 오늘은 구움과자 안먹고 케이크랑 도
넛, 뉴욕롤 패스츄리 도전했어요 종류별로 다 먹어보
는 날이 생각보다 금방올것같아요 ㅋㅋㅋㅋ 다...",2024-04-05 - 00:30:24
919,naver,27,달콤한위로,서울 성북구 창경궁로43길 24 1층, 4.36," 2,141",오렌지우비,2.2.금,오랜만에 좋은 베이커리 카페를 찾았습니다. 여러 이 름있는 베이커리 카페들이 빵은 맛있어도 커피까지 맛있던 경우가 적었었는데 빵도 매우 훌륭한데...,2024-04-05 - 00:30:24
920,naver,27,달콤한위로,서울 성북구 창경궁로43길 24 1층, 4.36," 2,141",lIIllIllIl,2.9.금,유명한 맛집이라 처음 방문했는데 소문대로 정말 맛 있어요! 도넛속에 듬뿍 들어있는 크림이 진하고 부드 러운데 많이 달지는 않아서 전혀 질리지 않아...,2024-04-05 - 00:30:24
921,naver,27,달콤한위로,서울 성북구 창경궁로43길 24 1층, 4.36," 2,141",YI6,2.23.금,"트로피칼 선라이즈 (8,-) 비주얼 훌륭하고 무스 색깔 도 맛도 식감도 훌륭하고 안에 필링?도 과일들 있고 상큼달콤하니 안질리고 끝도없이 먹을 수 있음...",2024-04-05 - 00:30:24
922,naver,27,달콤한위로,서울 성북구 창경궁로43길 24 1층, 4.36," 2,141",팬지90,23.12.19.화,"근처에 주차가 가능한 카페를 찾다가 도넛 비주얼에 반해서 찾아간 곳. 주차장은 매장 약도를 잘보고 찾 아가야 하고, 생우유도넛과 타히티 바닐라 크...",2024-04-05 - 00:30:24
923,naver,27,달콤한위로,서울 성북구 창경궁로43길 24 1층, 4.36," 2,141",현서연,3.17.일,고등학교 이후로 다시 방문했는데 몇년 사이에 많은 종류가 생겼더라구요! 그래도 역시 다쿠아즈가 제일 맛난거 같아요😆,2024-04-05 - 00:30:24
924,naver,27,달콤한위로,서울 성북구 창경궁로43길 24 1층, 4.36," 2,141",외유내강369,23.11.4.토,"북악스카이가려다 차 밀려서 근처 카페 검색후 24시 까지 하는 곳 찾아 삼만리해서 방문한곳,,,,, 갬성있다 👏👏👏 노래도 좋구😊😊 가끔은 집동네가 ...",2024-04-05 - 00:30:24
