,Platform,Number,Store,Address,Review_score,Review_counts,ID,Date,Review_text,Time
2607,naver,42,츄스,서울 성북구 삼선교로16길 35 삼선SKVIEW아파트 상가1-1동 103호,, 150,hyejining_,22.12.26.월,"닭가슴살 샌드위치는 크로와상 빵에 신선한 야채, 치 즈, 토마토에 양념된 닭가슴살이 정말 맛있었어요. 크 로와상이 버터 풍미가 느껴지며 겉은 바삭 속...",2024-04-05 - 00:40:01
2608,naver,42,츄스,서울 성북구 삼선교로16길 35 삼선SKVIEW아파트 상가1-1동 103호,, 150,슛힝슷하91,23.4.7.금,"파니니 너무맛나요ㅎㅎ 집앞 프렌차이즈 안가고 굳이
여기오는 이유랄까....?ㅎㅎ 사장님 실력이 너무 아까
워요ㅜㅜ 번창하세요!!",2024-04-05 - 00:40:01
2609,naver,42,츄스,서울 성북구 삼선교로16길 35 삼선SKVIEW아파트 상가1-1동 103호,, 150,dtech36871,23.9.13.수,굿,2024-04-05 - 00:40:01
2610,naver,42,츄스,서울 성북구 삼선교로16길 35 삼선SKVIEW아파트 상가1-1동 103호,, 150,리루티,23.8.18.금,"사장님 너무 친절하세요 :) 회사근처에 있어서 갔는데
원두도 팔고, 고를 수도 있고 내부가 작긴 하지만 맛
있어요!!! 다음에 또 갈께요!!",2024-04-05 - 00:40:01
2611,naver,42,츄스,서울 성북구 삼선교로16길 35 삼선SKVIEW아파트 상가1-1동 103호,, 150,슛힝슷하91,23.3.9.목,"더워서 잠깐 들렀는데, 오렌지에이드가 새로 출시되었더라구요!! 시즌에 맞게 상큼한 과일음료 너무 잘먹고 갑니다ㅎㅎ 나른함이 싹 가시네요~~",2024-04-05 - 00:40:01
2612,naver,42,츄스,서울 성북구 삼선교로16길 35 삼선SKVIEW아파트 상가1-1동 103호,, 150,행님6156,23.8.6.일,괜찮아요,2024-04-05 - 00:40:01
2613,naver,42,츄스,서울 성북구 삼선교로16길 35 삼선SKVIEW아파트 상가1-1동 103호,, 150,Blue moon7,23.5.27.토,메뉴가 다양하고 사장님이 친절하세요,2024-04-05 - 00:40:01
2614,naver,42,츄스,서울 성북구 삼선교로16길 35 삼선SKVIEW아파트 상가1-1동 103호,, 150,슛힝슷하91,22.12.15.목,스노우뷰 너무 좋아요! 에그타르트도 사장님 솜씨가 좋아지셨는지 갈수록 맛있어지고 좋은 하루가 될 것 같습니다^^,2024-04-05 - 00:40:01
2615,naver,42,츄스,서울 성북구 삼선교로16길 35 삼선SKVIEW아파트 상가1-1동 103호,, 150,doo****,23.5.18.목,아메리카노가 맛있어요,2024-04-05 - 00:40:01
2616,naver,42,츄스,서울 성북구 삼선교로16길 35 삼선SKVIEW아파트 상가1-1동 103호,, 150,슛힝슷하91,23.2.17.금,"분조카라서 몇 번 찾아왔는데, 생각보다 포근하고 집 같이 편해서 좋아요ㅎㅎ 샌드위치는 갈수록 솜씨가 좋아지셔서 더더더 맛있구, 커피는 직접 원두...",2024-04-05 - 00:40:01
2617,naver,42,츄스,서울 성북구 삼선교로16길 35 삼선SKVIEW아파트 상가1-1동 103호,, 150,감구마구마,22.12.17.토,카페 분위기도 너무 좋고 진짜 사장님이 죄송할 정도 로 너무너무 친절하심 ㅜㅜ 디저트 진짜 다 줜맛탱 특 히 크로와상 샌드위치가 진짜 오짐.. 다들 크로...,2024-04-05 - 00:40:01
2618,naver,42,츄스,서울 성북구 삼선교로16길 35 삼선SKVIEW아파트 상가1-1동 103호,, 150,바구쯔99,23.1.20.금,사장님 짱 친절하시구 샌드위치 푸짐해서 맛있어요! 아늑한 집앞 카페 느낌^^ 대화하기도 좋고 책읽기도 좋은 아기자기한 공간이에요 크루아상 존맛탱...,2024-04-05 - 00:40:01
2619,naver,42,츄스,서울 성북구 삼선교로16길 35 삼선SKVIEW아파트 상가1-1동 103호,, 150,HJL99,23.4.1.토,"맛있게 자알~~ 먹고 갑니다
샌드위치는 언제나 꿀맛이예요😎",2024-04-05 - 00:40:01
2620,naver,42,츄스,서울 성북구 삼선교로16길 35 삼선SKVIEW아파트 상가1-1동 103호,, 150,별가루뿌링,23.5.19.금,크로와상 맛집!!,2024-04-05 - 00:40:01
2621,naver,42,츄스,서울 성북구 삼선교로16길 35 삼선SKVIEW아파트 상가1-1동 103호,, 150,슛힝슷하91,22.12.16.금,"식사 겸 업무보러 왔는데, 이건 식사가 아니라 요리에 요!! 아니 어떻게 간단해보이는 재료들로 이런맛을 낼수 있는거쥬...ㅎㅎ 너무너무 잘먹고갑니다 ...",2024-04-05 - 00:40:01
2622,naver,42,츄스,서울 성북구 삼선교로16길 35 삼선SKVIEW아파트 상가1-1동 103호,, 150,슛힝슷하91,22.12.18.일,추운겨울 따뜻한 라떼한잔에 몸녹이면서 시간보내기 너무 좋은 카페입니다. 묘하게 집같은 아늑함이 있네 요ㅎㅎ 자주와서 그런걸까요 사장님의 센스가 ...,2024-04-05 - 00:40:01
2623,naver,42,츄스,서울 성북구 삼선교로16길 35 삼선SKVIEW아파트 상가1-1동 103호,, 150,ㅇㅈ63,22.12.11.일,파니니 진짜맛있구 망고라떼도 맛있었어요!! 카페 분위기좋구 사장님 친절하셔요!!,2024-04-05 - 00:40:01
2624,naver,42,츄스,서울 성북구 삼선교로16길 35 삼선SKVIEW아파트 상가1-1동 103호,, 150,hyungmyung,23.1.6.금,"항상 만족스러운 츄스 카페!!!
오늘도 잘 먹었습니다 :)",2024-04-05 - 00:40:02
2625,naver,42,츄스,서울 성북구 삼선교로16길 35 삼선SKVIEW아파트 상가1-1동 103호,, 150,슛힝슷하91,23.1.9.월,"오랜만에와서 안먹어본 자몽라떼를 시켜봤어요! 의외
로 다른매장엔 없는 유니크한 음료인데, 너무 상큼하
고 맛있어요 진짜ㅎㅎ 오늘도 맛난음료에 잘 ...",2024-04-05 - 00:40:02
2626,naver,42,츄스,서울 성북구 삼선교로16길 35 삼선SKVIEW아파트 상가1-1동 103호,, 150,파페거북,23.3.11.토,"커피 맛있습니다. 후에 에그타르트도 먹었는데 달달
하니 맛있네요. 주차도 가능하고 위치도 괜찮아서 자
주 올듯합니다.",2024-04-05 - 00:40:02
2627,naver,42,츄스,서울 성북구 삼선교로16길 35 삼선SKVIEW아파트 상가1-1동 103호,, 150,슛힝슷하91,22.12.14.수,"사장님의 미모만큼 이쁜 디저트랑, 항상 청결해서 집중하기 좋아요! 음료,커피도 너무 맛있구.. 제 단골 매장입니당ㅎㅎ",2024-04-05 - 00:40:02
2628,naver,42,츄스,서울 성북구 삼선교로16길 35 삼선SKVIEW아파트 상가1-1동 103호,, 150,ob****,23.4.23.일,"다른 빵들도 맛있었는데 , 마카롱 맛집이네요👍👏꼬끄가 진짜 쫀득한거 조아하는데 진짜 쫀득쫀득했어요 ❗️ 5구 세트 순삭 했어요 아아랑 먹면 끝",2024-04-05 - 00:40:02
2629,naver,42,츄스,서울 성북구 삼선교로16길 35 삼선SKVIEW아파트 상가1-1동 103호,, 150,ggg****,22.11.28.월,비주얼 대박...사진을 못찍어서 이걸 못담네용ㅜ너무 맛있어요 친구랑 밥때놓쳐서간단히 먹으러 들어왔는데 뜻밖에 맛집발견😆😆자주올꺼같아용👍👍👍,2024-04-05 - 00:40:02
2630,naver,42,츄스,서울 성북구 삼선교로16길 35 삼선SKVIEW아파트 상가1-1동 103호,, 150,HJL99,23.1.28.토,"네~ 서브웨이 로스트치킨 매니아입니다.
그거보다 맛있어요. 이말로 끝내겠습니다 😎",2024-04-05 - 00:40:02
2631,naver,42,츄스,서울 성북구 삼선교로16길 35 삼선SKVIEW아파트 상가1-1동 103호,, 150,쿄쿄4680,23.3.19.일,주차하기 편해요,2024-04-05 - 00:40:02
2632,naver,42,츄스,서울 성북구 삼선교로16길 35 삼선SKVIEW아파트 상가1-1동 103호,, 150,MJ4039,22.12.30.금,분위기 좋고 음식도 맛나요ㅎㅎㅎ,2024-04-05 - 00:40:02
2633,naver,42,츄스,서울 성북구 삼선교로16길 35 삼선SKVIEW아파트 상가1-1동 103호,, 150,이유엔12,22.12.29.목,샌드위치랑 음료 넘 맛있고 혼자 가기도 같이 가기도 좋은 카페에요 :),2024-04-05 - 00:40:02
2634,naver,42,츄스,서울 성북구 삼선교로16길 35 삼선SKVIEW아파트 상가1-1동 103호,, 150,hyungmyung,22.12.18.일,맛있게 잘 먹었습니다. 츄스 카페 강추!!! ^^,2024-04-05 - 00:40:02
2635,naver,42,츄스,서울 성북구 삼선교로16길 35 삼선SKVIEW아파트 상가1-1동 103호,, 150,hom****,22.10.30.일,좌석마다 거의 콘센트가 가깝게 위치해 있어서 편리하고 음료와 디저트도 맛있어요 :) 의자와 책상도 모던해서 인테리어가 잘 어울려요,2024-04-05 - 00:40:02
2636,naver,42,츄스,서울 성북구 삼선교로16길 35 삼선SKVIEW아파트 상가1-1동 103호,, 150,id****,23.5.12.금,좋아요,2024-04-05 - 00:40:02
2637,naver,42,츄스,서울 성북구 삼선교로16길 35 삼선SKVIEW아파트 상가1-1동 103호,, 150,우걍ㅇ,22.12.7.수,"파니니 처음 먹어봤는데 치즈도 많이들어가고 맛잇어
요 매장도 깔끔하고 메뉴 엄청 다양해서 도장깨기 해
야겟어요^^ 주차 되는것도 너무편리합니다",2024-04-05 - 00:40:02
2638,naver,42,츄스,서울 성북구 삼선교로16길 35 삼선SKVIEW아파트 상가1-1동 103호,, 150,zhdRO2872,22.9.19.월,"사장님 친절하시고 샌드위치가 정말 맛있어요! 다른
빵들도 매우 기대가 되는 베이커리 카페 입니다. 해
당 제품은 제공받아 작성한 리뷰입니다.",2024-04-05 - 00:40:02
2639,naver,42,츄스,서울 성북구 삼선교로16길 35 삼선SKVIEW아파트 상가1-1동 103호,, 150,HJL99,22.12.23.금,"사장님~💕 분위기 좋고 음료 맛있고~ 사장님 예쁘고
~ 정신 차리고 보니 이만원을 태웠네요? 다음에 또 갈
게요😘",2024-04-05 - 00:40:02
2640,naver,42,츄스,서울 성북구 삼선교로16길 35 삼선SKVIEW아파트 상가1-1동 103호,, 150,doo****,23.1.30.월,커피가 맛있어요,2024-04-05 - 00:40:02
2641,naver,42,츄스,서울 성북구 삼선교로16길 35 삼선SKVIEW아파트 상가1-1동 103호,, 150,HJL99,23.1.6.금,"아메리카노 맛집 츄스💕
또 올게요😍👌",2024-04-05 - 00:40:02
2642,naver,42,츄스,서울 성북구 삼선교로16길 35 삼선SKVIEW아파트 상가1-1동 103호,, 150,소소한 바람,22.12.7.수,"브런치하기 정말 좋은 수제 디저트 맛집 ♡ 사장님이 정말 친절하시고 좋아요 😀😃😄
크로와상 샌드위치 강추!!!",2024-04-05 - 00:40:02
2643,naver,42,츄스,서울 성북구 삼선교로16길 35 삼선SKVIEW아파트 상가1-1동 103호,, 150,슛힝슷하91,22.12.8.목,"항상 청결하고 조용한 매장에서 잘마시고 볼일도 잘 
보다 갑니다. 집같은 푸근한 느낌이 너무 좋아요ㅎㅎ 
번창하세요 사장님!",2024-04-05 - 00:40:02
2644,naver,42,츄스,서울 성북구 삼선교로16길 35 삼선SKVIEW아파트 상가1-1동 103호,, 150,박뀨리,22.9.16.금,초코라떼도 너무 맛있고 커피번도 너무 취향저격당했 습니다❣️ 사장님이 친절하신건 기본이고 너무 이쁘 셔서 깜짝놀랬습니다😂 학생이라 카페갈 일이...,2024-04-05 - 00:40:02
2645,naver,42,츄스,서울 성북구 삼선교로16길 35 삼선SKVIEW아파트 상가1-1동 103호,, 150,shd****,23.4.12.수,굿,2024-04-05 - 00:40:02
2646,naver,42,츄스,서울 성북구 삼선교로16길 35 삼선SKVIEW아파트 상가1-1동 103호,, 150,그린무늬,23.4.12.수,좋아요!!,2024-04-05 - 00:40:02
2647,naver,42,츄스,서울 성북구 삼선교로16길 35 삼선SKVIEW아파트 상가1-1동 103호,, 150,ppu****,22.11.26.토,"오늘도 사장님이 미모로 열일하고 계십니다^^ 노트북
들고 편하게 작업하고가기 너무 좋은 동네최애카페에
요!! 추천추천 UP!!",2024-04-05 - 00:40:02
2648,naver,42,츄스,서울 성북구 삼선교로16길 35 삼선SKVIEW아파트 상가1-1동 103호,, 150,fri****,22.11.5.토,"주방이 훤히 보이는데 엄청 청결해 보여서 믿고 먹을 
수 있는 가게예요~ 카페라떼마셨는데 엄청 고소하고
 맛있네요!! 번창하세요!!👍🏻",2024-04-05 - 00:40:02
2649,naver,42,츄스,서울 성북구 삼선교로16길 35 삼선SKVIEW아파트 상가1-1동 103호,, 150,오지라퍼쿨걸,22.9.17.토,주차하기 힘든 곳인데 주차가능. 가격좋고 맛도 좋고 넘 좋았어요,2024-04-05 - 00:40:02
2650,naver,42,츄스,서울 성북구 삼선교로16길 35 삼선SKVIEW아파트 상가1-1동 103호,, 150,hyungmyung,22.9.12.월,삼선동 카페맛집👍 달달한 딸기라떼와 수제치즈마 카롱 맛있게 잘 먹고 가용 ^^ 맛있으면 장땡이지만 사 장님도 너무 친절하시고 카페 분위기도 좋고 ...,2024-04-05 - 00:40:02
2651,naver,42,츄스,서울 성북구 삼선교로16길 35 삼선SKVIEW아파트 상가1-1동 103호,, 150,윤뚜85,22.9.21.수,일하다 지쳐서 당 떨어질때 딱 방문했는데 너무 새 콤달달한 패션후르츠에 위로받고왔어요 여기 진짜 뷰맛집 크루와상 샌드위치 맛집이네요 ㅎㅎ 크...,2024-04-05 - 00:40:02
2652,naver,42,츄스,서울 성북구 삼선교로16길 35 삼선SKVIEW아파트 상가1-1동 103호,, 150,whd****,22.11.5.토,깔끔하고 모던한 인테리어 넘 좋네요,2024-04-05 - 00:40:02
2653,naver,42,츄스,서울 성북구 삼선교로16길 35 삼선SKVIEW아파트 상가1-1동 103호,, 150,081****,22.8.16.화,사장님이 너무너무 친절하시고 너무너무 이쁘셔용~ 집 주변에 디저트카페 오픈했다고해서 동네 친구랑 왔는데 오픈한지 얼마 안되셨다고 서비스로 마...,2024-04-05 - 00:40:03
2654,naver,42,츄스,서울 성북구 삼선교로16길 35 삼선SKVIEW아파트 상가1-1동 103호,, 150,오달23,22.12.17.토,맛남...^^,2024-04-05 - 00:40:03
2655,naver,42,츄스,서울 성북구 삼선교로16길 35 삼선SKVIEW아파트 상가1-1동 103호,, 150,슛힝슷하91,22.8.30.화,"노트북들고 작업하러 왔는데, 비오는날 창밖의 뷰가 
은근 분위기있고 집중이 잘 되네요.^^ 최애메뉴 초코
라떼와함께 인증남깁니다~",2024-04-05 - 00:40:03
2656,naver,42,츄스,서울 성북구 삼선교로16길 35 삼선SKVIEW아파트 상가1-1동 103호,, 150,hyungmyung,22.11.20.일,초코라떼 너무 맛있게 잘 먹고 갑니다. 또 방문할거에요 ^^,2024-04-05 - 00:40:03
2657,naver,42,츄스,서울 성북구 삼선교로16길 35 삼선SKVIEW아파트 상가1-1동 103호,, 150,슛힝슷하91,22.9.1.목,항상 깔끔해서 좋아요ㅎㅎ 주방도 깔끔하고 매장도 깔끔하고 창문도 자주닦으시는걸 많이봤어요ㅎㅎ 또올게요~,2024-04-05 - 00:40:03
2658,naver,42,츄스,서울 성북구 삼선교로16길 35 삼선SKVIEW아파트 상가1-1동 103호,, 150,슛힝슷하91,22.9.9.금,카야토스트랑 망고스무디 넘 맛있어요ㅋㅋㅋ 최애메뉴!!,2024-04-05 - 00:40:03
2659,naver,42,츄스,서울 성북구 삼선교로16길 35 삼선SKVIEW아파트 상가1-1동 103호,, 150,홍지7989,22.11.9.수,집근처 좋은 카페 발견👏🏻 자주갈거같아요,2024-04-05 - 00:40:03
2660,naver,42,츄스,서울 성북구 삼선교로16길 35 삼선SKVIEW아파트 상가1-1동 103호,, 150,슛힝슷하91,22.8.19.금,"사장님이 친절하시고 음료가맛있어요!! 특히 디저트 
정말 맛있으니 근처사시는분들은 와보시면 후회안하
실 것 같아요 :D",2024-04-05 - 00:40:03
2661,naver,42,츄스,서울 성북구 삼선교로16길 35 삼선SKVIEW아파트 상가1-1동 103호,, 150,doo****,22.10.21.금,커피가 맛있어요,2024-04-05 - 00:40:03
2662,naver,42,츄스,서울 성북구 삼선교로16길 35 삼선SKVIEW아파트 상가1-1동 103호,, 150,ppax,22.10.21.금,"커피 너무맛있구 매장도 청결해서 자주갈것같아요!!
(ง •̀ω•́)ง✧",2024-04-05 - 00:40:03
2663,naver,42,츄스,서울 성북구 삼선교로16길 35 삼선SKVIEW아파트 상가1-1동 103호,, 150,hyungmyung,22.9.18.일,아이스카푸치노&딸기요거트스무디 너무 맛있게 잘 먹고 갑니다 ^^ 자주 자주 찾아가서 먹을거에요 ㅎㅎ,2024-04-05 - 00:40:03
2664,naver,42,츄스,서울 성북구 삼선교로16길 35 삼선SKVIEW아파트 상가1-1동 103호,, 150,바스티안14,22.11.8.화,커피가 괜찮은 곳,2024-04-05 - 00:40:03
2665,naver,42,츄스,서울 성북구 삼선교로16길 35 삼선SKVIEW아파트 상가1-1동 103호,, 150,hoho1828,22.10.30.일,아늑한 분위기의 카페,2024-04-05 - 00:40:03
2666,naver,42,츄스,서울 성북구 삼선교로16길 35 삼선SKVIEW아파트 상가1-1동 103호,, 150,swk9311,22.9.15.목,샌드위치나 디저트 다 맛있어요 ㅋㅋ 인테리어도 깔끔해서 제일 애정하는 동네카페입니다,2024-04-05 - 00:40:03
2667,naver,42,츄스,서울 성북구 삼선교로16길 35 삼선SKVIEW아파트 상가1-1동 103호,, 150,윤뚜85,22.9.23.금,"오늘 두번째 방문인데 역시나 
너무 좋았어요 새로 오픈한 매장이다보니까 깔끔하고 한미모하시는 사장님이 엄청 친절해요",2024-04-05 - 00:40:03
2668,naver,42,츄스,서울 성북구 삼선교로16길 35 삼선SKVIEW아파트 상가1-1동 103호,, 150,별가루뿌링,22.8.24.수,"오늘은 시원하게 아아:)
쿠폰도 생겼네요~",2024-04-05 - 00:40:03
2669,naver,42,츄스,서울 성북구 삼선교로16길 35 삼선SKVIEW아파트 상가1-1동 103호,, 150,별가루뿌링,22.9.7.수,생지를 직접 구워 만든 샌드위치라 맛있어요!,2024-04-05 - 00:40:03
2670,naver,42,츄스,서울 성북구 삼선교로16길 35 삼선SKVIEW아파트 상가1-1동 103호,, 150,sike39,22.9.16.금,크로와상도 맛있고 앙버터도 맛있었습니다.,2024-04-05 - 00:40:03
2671,naver,42,츄스,서울 성북구 삼선교로16길 35 삼선SKVIEW아파트 상가1-1동 103호,, 150,현미 쌀,22.11.5.토,굿!좋아용,2024-04-05 - 00:40:03
2672,naver,42,츄스,서울 성북구 삼선교로16길 35 삼선SKVIEW아파트 상가1-1동 103호,, 150,별가루뿌링,22.8.19.금,아이가 좋아하는 자몽쥬스 ❤️,2024-04-05 - 00:40:03
2673,naver,42,츄스,서울 성북구 삼선교로16길 35 삼선SKVIEW아파트 상가1-1동 103호,, 150,비비안나24,22.8.31.수,커피가맛있고 샌드위치도맛있어요,2024-04-05 - 00:40:03
2674,naver,42,츄스,서울 성북구 삼선교로16길 35 삼선SKVIEW아파트 상가1-1동 103호,, 150,슛힝슷하91,22.9.8.목,,2024-04-05 - 00:40:03
2675,naver,42,츄스,서울 성북구 삼선교로16길 35 삼선SKVIEW아파트 상가1-1동 103호,, 150,별가루뿌링,22.8.9.화,커피도 맛있어요.,2024-04-05 - 00:40:03
2676,naver,42,츄스,서울 성북구 삼선교로16길 35 삼선SKVIEW아파트 상가1-1동 103호,, 150,별가루뿌링,22.8.19.금,마카롱 맛집! 연유맛 굿굿,2024-04-05 - 00:40:03
2677,naver,43,명동나비,서울 중구 삼일대로9길 8 명동나비,, 150,베라431705,2.28.수,일반적인 카페라기보다는 미술관 온거같은 아주 특별 한 카페에요. 근대 건축물로 지어진 명동 나비문양 벽 돌집이에요. 유기농 재료로 만든 수제케이크 ...,2024-04-05 - 00:40:38
2678,naver,43,명동나비,서울 중구 삼일대로9길 8 명동나비,, 150,연연7777777,3.5.화,창 밖 풍경볼 수 있는 분위기 좋은 카페에 가보고 싶 었는데 명동나비 카페가 그런 곳이더라구요~ 항상 명 동가면 그냥 스타벅스만 갔는데 명동 성당에서...,2024-04-05 - 00:40:38
2679,naver,43,명동나비,서울 중구 삼일대로9길 8 명동나비,, 150,eE,3.1.금,카페가 고즈넉하니 예쁘고 매장이 2층까지 있어서 넓 고 편하니 좋습니다. 디저트가 케이크부터 구움과자 까지 다양한데 다 맛있고ㅜ 어른들이 좋아하실...,2024-04-05 - 00:40:38
2680,naver,43,명동나비,서울 중구 삼일대로9길 8 명동나비,, 150,꿀숑이,2.13.화,커피랑 직접 만드신 수제 디저트 짱맛이에요. 2층 올 라가면 뷰도 멋지고 명동에 이런 멋진 카페가 있었네 요. 노트북 작업하기에도 좋고 대화하기에도 ...,2024-04-05 - 00:40:38
2681,naver,43,명동나비,서울 중구 삼일대로9길 8 명동나비,, 150,졍다미,1.5.금,"과거와 현재가 공존하는 카페에요. 건물 자체도 예쁘 고 카페 내부 도 예뻐요~ 미술 작품도 많고, 가구들도 하나같이 다 예뻐서 좋았답니다~ 갤러리카페 ...",2024-04-05 - 00:40:38
2682,naver,43,명동나비,서울 중구 삼일대로9길 8 명동나비,, 150,열일하는 토깽이,1.26.금,음료랑 디저트 종류가 다양하고 특별한 메뉴가 많아 요! 리얼당귤주스 주문해서 마셨는데 신선하고 맛있 어요🧡 자색고구마라떼랑 밤라떼가 있는게 신...,2024-04-05 - 00:40:38
2683,naver,43,명동나비,서울 중구 삼일대로9길 8 명동나비,, 150,My Serendipity,3.5.화,분위기 조용하고 매장이 넓어서 커피마시며 이야기하러 오거나 공부 일하러 오기 좋을 것 같아요 케이크 베이커리류 종류 많고 커피도 맛있어용,2024-04-05 - 00:40:38
2684,naver,43,명동나비,서울 중구 삼일대로9길 8 명동나비,, 150,제니쌤32,3.28.목,조용하고 대화하기 좋았어요,2024-04-05 - 00:40:38
2685,naver,43,명동나비,서울 중구 삼일대로9길 8 명동나비,, 150,내 인생은 꽃길,3.10.일,"조명과 공간이 아득하고 
주문한 헤이즐넛그림... 끝맛이 깔끔하고 맛있네요",2024-04-05 - 00:40:38
2686,naver,43,명동나비,서울 중구 삼일대로9길 8 명동나비,, 150,까밍밍0,1.2.화,창밖뷰가 대단했어요 명동에 이런곳이 있다니 !! 디 저트로 주문한 피스타치오딸기숲 진짜 너어어엉어무 맛있어요 평소에 맛보기 힘든 맛이에요 ! 딸기...,2024-04-05 - 00:40:38
2687,naver,43,명동나비,서울 중구 삼일대로9길 8 명동나비,, 150,DYmom37,1.11.목,커피도 음료도 모두 만족~~ 그중 앙버터 최고네요^^ 카페 분위기도 아득하니 좋고 인테리어도 아기자기 소품들 구경도 하고 좋네요~ 직원분들도 넘 친...,2024-04-05 - 00:40:38
2688,naver,43,명동나비,서울 중구 삼일대로9길 8 명동나비,, 150,여러가지 생각,2.3.토,명동성당 뷰에요 인테리어 멋있고 커피맛있어요,2024-04-05 - 00:40:38
2689,naver,43,명동나비,서울 중구 삼일대로9길 8 명동나비,, 150,단팥빵915,23.12.22.금,"평일에 방문했는데 조용한 분위기라 데이트하기 좋았
어요😄😆 화장실도 깨끗하고~ 음료 종류가 많아 선
택지가 많은듯요!",2024-04-05 - 00:40:38
2690,naver,43,명동나비,서울 중구 삼일대로9길 8 명동나비,, 150,아송시,23.12.5.화,"명동역 디저트카페로 추천하는 명동나비! 뷰도 이쁘
고 디저트도 맛있어서 데이트 장소로도 추천해요🤎
✨ 크리스마스 분위기두 뿜뿜나서 재미지게 ...",2024-04-05 - 00:40:38
2691,naver,43,명동나비,서울 중구 삼일대로9길 8 명동나비,, 150,듀이듀잇,23.12.23.토,"맛있는 커피와 디저트
명동성당 뷰가 부럽지않은 영락교회 뷰
사람 많은 명동에서 최고의 선택",2024-04-05 - 00:40:38
2692,naver,43,명동나비,서울 중구 삼일대로9길 8 명동나비,, 150,tls****,23.9.16.토,명동에 카페가 많아 여러카페를 다녀보았는데 이렇게 분위기 좋은 카페가 있는지 몰랐네요 ㅎㅎ 대화하기 에나 취미생활하기에도 좋아서 그런지 제가 방...,2024-04-05 - 00:40:38
2693,naver,43,명동나비,서울 중구 삼일대로9길 8 명동나비,, 150,쥐락펴락김학철,23.10.9.월,오랜동안 명동을 지나가며 한번은 가봐야 겠다고 생 각해 두었던 '명동나비카페' 휴일인 월요이지만 명동 나비카페 들러 커피한잔 하면 지인과 소통 그...,2024-04-05 - 00:40:38
2694,naver,43,명동나비,서울 중구 삼일대로9길 8 명동나비,, 150,다나99,23.11.2.목,분위기있는 인테리어와 창가뷰가 너무나도 좋았던 카 페에요! 다양한 수제 디저트와 음료가 준비되어 있어 디저트 고르는 재미까지..🤍 돼지바 케이크는 ...,2024-04-05 - 00:40:38
2695,naver,43,명동나비,서울 중구 삼일대로9길 8 명동나비,, 150,리리리리라라,23.12.1.금,매장이 아늑하고 사장님도 친절하세요. 케이크 종류가 다양하고 맛있어요! 크리스마스 분위기가 가득해요,2024-04-05 - 00:40:38
2696,naver,43,명동나비,서울 중구 삼일대로9길 8 명동나비,, 150,둥글둥글햇님이,23.12.9.토,"아메리카노,라떼, 아이스크림(많이 달아요) 맛있어요. ^ 오래 머물기보다 잠깐 쉬었다가기 좋아요. 30분정 도 있다나왔는데..좀 눈치가 보이더라구요. 손...",2024-04-05 - 00:40:39
2697,naver,43,명동나비,서울 중구 삼일대로9길 8 명동나비,, 150,Odserc,23.12.16.토,"명동에 좋은 카페를 발견했네요~:) 직원들분들도 친 절하시고, 무엇보다 카페 분위기가 아늑하니 너무 좋 은 곳이 었습니다~ 주문한 오미자차, 초코케잌...",2024-04-05 - 00:40:39
2698,naver,43,명동나비,서울 중구 삼일대로9길 8 명동나비,, 150,cestar880124,23.9.9.토,"오랜역사를 지닌 건물에 엔틱한 소품, 인테리어 거기 에 예쁜 뷰까지. 외국인친구 데리고 와도 좋을 것 같 은 맛집이에요. 커피와 디저트가 진심인 맛집. ...",2024-04-05 - 00:40:39
2699,naver,43,명동나비,서울 중구 삼일대로9길 8 명동나비,, 150,몽이소바,23.12.19.화,"사장님도 너무 친절하시고 분위기가 좋아요ㅎㅎ
커피랑 디저트도 맛있던 카페에요!",2024-04-05 - 00:40:39
2700,naver,43,명동나비,서울 중구 삼일대로9길 8 명동나비,, 150,Han Gyeol,23.12.19.화,"1950년대 앤틱한 건물의 예쁜 카페! 명동 가면 꼭 들
러야 할 곳 중 하나예요. 디저트, 케이크 예쁘고 맛있
어요. 커피, 티 종류도 많고, 자리도 넓어 수다...",2024-04-05 - 00:40:39
