,Platform,Number,Store,Address,Review_score,Review_counts,ID,Date,Review_text,Time
1677,naver,33,커피앤시가렛,서울 중구 서소문로 116 유원빌딩17층 1706호, 4.42," 2,202",김새싹32,23.8.5.토,밀크티 외에도 아이스아메리카노 솔티 스카치라떼 그 릭요거트 먹었는데 솔티스카치라떼는 친구가 먹어서 모르겠고 아메리카노는 맛있었고 밀크티는 시...,2024-04-05 - 00:34:18
1678,naver,33,커피앤시가렛,서울 중구 서소문로 116 유원빌딩17층 1706호, 4.42," 2,202",마이네임닉네임,23.5.13.토,웨이팅이 있는 핫플레이스에요. 창가 자리에 앉으려 면 다른 손님이 나올 때까지 무작정 기다려야 합니다. ㅠ 카페 자체가 고유의 분위기가 좋고 창가 자...,2024-04-05 - 00:34:18
1679,naver,33,커피앤시가렛,서울 중구 서소문로 116 유원빌딩17층 1706호, 4.42," 2,202",라타48,23.4.21.금,덕수궁과 정동길이 보이고 저 멀리 이름은 모르지만 산들도 보이는 cityview가 좋았던 카페였어요 당연히 창문 앞 자리는 경쟁이 치열하고요ㅋ 디저트가...,2024-04-05 - 00:34:18
1680,naver,33,커피앤시가렛,서울 중구 서소문로 116 유원빌딩17층 1706호, 4.42," 2,202",규규규76,23.8.9.수,평일 오후에도 사람 많아요,2024-04-05 - 00:34:18
1681,naver,33,커피앤시가렛,서울 중구 서소문로 116 유원빌딩17층 1706호, 4.42," 2,202",가필드0811,23.8.16.수,뷰도 좋지만 커피와 브라우니 맛나요~,2024-04-05 - 00:34:18
1682,naver,33,커피앤시가렛,서울 중구 서소문로 116 유원빌딩17층 1706호, 4.42," 2,202",JAVA,23.7.26.수,사람이 많고 시끄러운 공간이었지만 사람적으면 좋을 것 같아요. 카푸치노가 맛있었어요.,2024-04-05 - 00:34:18
1683,naver,33,커피앤시가렛,서울 중구 서소문로 116 유원빌딩17층 1706호, 4.42," 2,202",먹고기도하고또먹어라,23.7.11.화,"커피한입 먹고 눈떵그래지고 브라우니 한입먹고 으허
허하하하 비오는날 불쾌지수 제로뿅 음악까지 센스있
게 서소문 갬성 지려주심 유재하 메들리..캬",2024-04-05 - 00:34:18
1684,naver,33,커피앤시가렛,서울 중구 서소문로 116 유원빌딩17층 1706호, 4.42," 2,202",Hope9376,23.8.24.목,저녁시간대에 뷰자리에서 혼공은 오바인듯!,2024-04-05 - 00:34:18
1685,naver,33,커피앤시가렛,서울 중구 서소문로 116 유원빌딩17층 1706호, 4.42," 2,202",여행가35,23.7.8.토,"뷰도좋고, 커피도 맛있습니다!! 🤩
디저트계열도 맛있어요!!",2024-04-05 - 00:34:18
1686,naver,33,커피앤시가렛,서울 중구 서소문로 116 유원빌딩17층 1706호, 4.42," 2,202",육식꼬마,23.11.11.토,뷰가좋습니다.,2024-04-05 - 00:34:18
1687,naver,34,커피한약방,서울 중구 삼일대로12길 16-6, 4.42," 4,095",kim****,3.23.토,이름이 재미있는 커피들. 산미와 맛 정도를 선택 할 수 있다. 이름이 정겨워서 골라본 저녁상 콩자반. 콩 볶는 분이 계셔서 고소한 참기름 냄새(?)가 은...,2024-04-05 - 00:34:52
1688,naver,34,커피한약방,서울 중구 삼일대로12길 16-6, 4.42," 4,095",psickmsick,3.5.화,"오감만족 을지로 카페 커피한약방 두번째 방문입니다 . 평일 점심 시간인 12시 40분쯤 방문했습니다. 1층 주문하는곳에서 한쪽에는 로스팅, 한쪽에선 추...",2024-04-05 - 00:34:52
1689,naver,34,커피한약방,서울 중구 삼일대로12길 16-6, 4.42," 4,095",myroomex,3.16.토,🥇 ♡아포카토 (6.0) ♡아이스초코 (6.0) ♡블루베리 타르트 (8.0) ♥맛 -아포카토: 에스프레소를 따로 주셔 서 취향에 맞게 부을수 있어서 좋았습니다. 한...,2024-04-05 - 00:34:53
1690,naver,34,커피한약방,서울 중구 삼일대로12길 16-6, 4.42," 4,095",뚜벅뚜벅잉33,3.9.토,을지로 뒷편 좁은 골목에 위치한 커피한약방과 혜민 당 이 곳의 독특한 점은 음료는 커피한약방에서 디저 트는 혜민당에서 주문하고 좁은 골목 안에 이 ...,2024-04-05 - 00:34:53
1691,naver,34,커피한약방,서울 중구 삼일대로12길 16-6, 4.42," 4,095",찐핑쿠,3.23.토,을지로의 힙한 카페 커피 한약방 예전 혜민서 자리를 카페로 만든곳 한번쯤은 가볼만한 곳인데 토요일에 방문했더니 앉을자리 없이 사람들이 가득가득 ...,2024-04-05 - 00:34:53
1692,naver,34,커피한약방,서울 중구 삼일대로12길 16-6, 4.42," 4,095",마삔,2.22.목,"옛 느낌을 구현했다기보다는 그냥 진짜 골목에 들어 서자마자 옛날이 됐다. 살얼음이 살살 껴있었던 메이 플라떼, 메이플 시럽의 달달한 라떼를 생각했...",2024-04-05 - 00:34:53
1693,naver,34,커피한약방,서울 중구 삼일대로12길 16-6, 4.42," 4,095",나다7259,3.18.월,시간여행 온 듯 골목 하나 차이로 분위기가 확 다르네 요~ 매장내 분위기도.. 창문 너머 풍경?도 운치있어서 좋았어요 커피도 진하니 맛있었구요! 다음에는...,2024-04-05 - 00:34:53
1694,naver,34,커피한약방,서울 중구 삼일대로12길 16-6, 4.42," 4,095",넘좋아용,3.2.토,커피가 정말...짱맛있어요!! 외관이 예사롭지 않다 생 각했는데 핫플답게 북적북적해요 ㅋㅋ 3층까지 다 만 석이어서 자리먼저 잡고 시켜야됩니닷... 커피...,2024-04-05 - 00:34:53
1695,naver,34,커피한약방,서울 중구 삼일대로12길 16-6, 4.42," 4,095",루시르,3.16.토,완전 레트로 그잡채! 라즈베리 우유랑 아이스 초코 시켰고요 1.2층으로 나눠있고 가게는 그렇게 크지 않은데 분위기가 진짜 독특해요,2024-04-05 - 00:34:53
1696,naver,34,커피한약방,서울 중구 삼일대로12길 16-6, 4.42," 4,095",언약05,3.22.금,도심 속 조그만한 골목으로 쑥 들어가면 과거로 돌아간듯한 까페라 소개하기 좋아오. 평일이라 적당히 붐볐어요~,2024-04-05 - 00:34:53
1697,naver,34,커피한약방,서울 중구 삼일대로12길 16-6, 4.42," 4,095",고동치,2.28.수,자리부터 꼭 먼저 잡으세요 계단도 가파르니 조심하 시구!! 땅콩이랑 복숭아 타르트 먹었는데 요리조리 싸돌아 다니느라 힘들었는데 당충전 완료 땅콩...,2024-04-05 - 00:34:53
1698,naver,34,커피한약방,서울 중구 삼일대로12길 16-6, 4.42," 4,095",썽블리블리해,3.5.화,'커피한약방' 이름에 끌려서 방문하게 됬어요ㅎㅎ 예 쁜 곳들이 많아서 사진 찍기 바빴네용📸 커피 끝내줬 어요... 한국에 이런 커피가 있다는게 너무 좋네...,2024-04-05 - 00:34:53
1699,naver,34,커피한약방,서울 중구 삼일대로12길 16-6, 4.42," 4,095",미소천사지니,1.25.목,오랜만에 방문했어요. 여기 4번째예요. 가족이랑 아 이랑 혼자 지인이랑 이렇게요^^ 올때마다 분위기가 너무 좋아서 자꾸만 또 가고싶단 생각이 들어...,2024-04-05 - 00:34:53
1700,naver,34,커피한약방,서울 중구 삼일대로12길 16-6, 4.42," 4,095",매일이 여행이길,3.3.일,"커피한약방은 시내나가면 꼭 들러서 커피를 마시는 
커피맛집~ 디저트도 예쁘고 맛있다. 인테리어는 100
년전으로 돌아간듯한 감성~ 자리찾기가 힘든...",2024-04-05 - 00:34:53
1701,naver,34,커피한약방,서울 중구 삼일대로12길 16-6, 4.42," 4,095",눈에띄지않는나그네,3.7.목,원두 선택이 가능하고 드립커피라 깔끔해요~ 그리고 사진 찍을 곳이 많고 시간여행에 온 느낌이에요~ㅎㅎ,2024-04-05 - 00:34:53
1702,naver,34,커피한약방,서울 중구 삼일대로12길 16-6, 4.42," 4,095",리뷰 조작 시르요,3.13.수,"인테리어가 일단 너무 이쁘당 근데 좀 춥고 화장실이 
…열악 와이파이있고 평일은 사람이 별로 없고 콘센
트도 있어서 카공하기도 좋을듯 뀯굳",2024-04-05 - 00:34:53
1703,naver,34,커피한약방,서울 중구 삼일대로12길 16-6, 4.42," 4,095",먹어볼까요,1.27.토,힙지로에 컨셉이 독특해 다녀오기 좋았어요! 외국인 들도 많고 커피도 뭔가 한약 먹는듯 진합니다 맞은편 혜민당에서 디저트 함께 먹을수 있어요~ 사람 ...,2024-04-05 - 00:34:53
1704,naver,34,커피한약방,서울 중구 삼일대로12길 16-6, 4.42," 4,095",오렌지 페코,2.26.월,시간여행 온 듯한 인테리어의 재미. 3층까지 올라가서 겨우 구석에 앉은 자리 전쟁. 꽤나 좁고 가파른 계단 조심. 커피 원두 맛있는 편 :),2024-04-05 - 00:34:53
1705,naver,34,커피한약방,서울 중구 삼일대로12길 16-6, 4.42," 4,095",이킹5,3.18.월,그 옛날 경성에 이런 가비집이 있었을 것 같아요. 분위기가 예스러워서 좋아요.,2024-04-05 - 00:34:53
1706,naver,34,커피한약방,서울 중구 삼일대로12길 16-6, 4.42," 4,095",hms****,2.9.금,"옛스럽게 꾸며놓은 공간이 예뻐요. 음료 들고, 디저트 들고 오르내리는 게 좀 불편한데 공간 구석구석 눈 가는 곳마다 예쁜 게 많아서 좋아요. 아이스 카...",2024-04-05 - 00:34:53
1707,naver,34,커피한약방,서울 중구 삼일대로12길 16-6, 4.42," 4,095",mae****,2.25.일,"디저트가 정말 맛있어요
좁은 골목 안이지만 정말 핫하네요",2024-04-05 - 00:34:53
1708,naver,34,커피한약방,서울 중구 삼일대로12길 16-6, 4.42," 4,095",hos****,1.27.토,"맞은편 혜민당에서 디저트 픽업하구, 커피한약방에서 는 산미 있는 필터커피와 쌍화탕 주문했습니다. 필터 커피 정말 좋았구요, 쌍화탕도 오~ 이거 건강해...",2024-04-05 - 00:34:53
1709,naver,34,커피한약방,서울 중구 삼일대로12길 16-6, 4.42," 4,095",여행자지니,2.3.토,커피한약방♡역사가 깃들어 있는 곳에서 맛난 커피를 마실 수 있어 좋았어요 좋은 사람들과 뜻깊은 시간을 보내기 좋은 곳이에요~을지로에 가면 꼭 한번...,2024-04-05 - 00:34:53
1710,naver,34,커피한약방,서울 중구 삼일대로12길 16-6, 4.42," 4,095",Looknpurple,3.13.수,클래식한 분위기가 재밌어요. 커피도 맛있네요.,2024-04-05 - 00:34:53
1711,naver,34,커피한약방,서울 중구 삼일대로12길 16-6, 4.42," 4,095",초보미식가,23.12.30.토,아이스바닐라라떼 특이하네요 얼음이 쉐이크처럼 나 와요 달지않은 맛이라 저는 좋았어요 ㅋㅋ 필터커피 도 굉장히 부드러운 맛입니다 주문받는 곳 건...,2024-04-05 - 00:34:53
1712,naver,34,커피한약방,서울 중구 삼일대로12길 16-6, 4.42," 4,095",papyrus0214,2.29.목,"커피가 매우 맛있고, 근대 분위기 내부 인테리어가 멋져요.",2024-04-05 - 00:34:53
1713,naver,34,커피한약방,서울 중구 삼일대로12길 16-6, 4.42," 4,095",Horok1225,3.14.목,커피가 다양하고 맛있어요.,2024-04-05 - 00:34:53
1714,naver,34,커피한약방,서울 중구 삼일대로12길 16-6, 4.42," 4,095",태연아빠60,2.29.목,한약방 커피는 쎕니다 ㅋ 김민찬샘 덕분에 큼직한 나 팔 두분이 나오시는 귀한 기회에 게다가 반주가 지민 도로시 베이스가 꽃동민 님 나오시는 공연이라...,2024-04-05 - 00:34:53
1715,naver,34,커피한약방,서울 중구 삼일대로12길 16-6, 4.42," 4,095",KDR,2.23.금,"블랜드 아메리카노, 꼰빠나, 케이크 2개 먹었는데 다 맛있었어요!👍",2024-04-05 - 00:34:53
1716,naver,34,커피한약방,서울 중구 삼일대로12길 16-6, 4.42," 4,095",imsookyung,3.11.월,분위기좋고 커피 맛있어요,2024-04-05 - 00:34:54
1717,naver,34,커피한약방,서울 중구 삼일대로12길 16-6, 4.42," 4,095",둘러보자,2.21.수,대학로 매장도 생겼지만 역시 사진 찍기엔 을지로가 최고ㅋ,2024-04-05 - 00:34:54
1718,naver,34,커피한약방,서울 중구 삼일대로12길 16-6, 4.42," 4,095",Tweetweety,1.7.일,"좁은 골목안에 있어서 데려간 친구들이 다 의심했지 만 가보고 정말 다들 좋다고 한 곳이에요! 일행 전부 커피를 안마셔서 핫초코, 애플시나몬 티 그리...",2024-04-05 - 00:34:54
1719,naver,34,커피한약방,서울 중구 삼일대로12길 16-6, 4.42," 4,095",Dr nerdy,2.21.수,"오래된 한약방을 개조한 카페.
드립 커피치고는 양이 많은 편",2024-04-05 - 00:34:54
1720,naver,34,커피한약방,서울 중구 삼일대로12길 16-6, 4.42," 4,095",eyp****,2.26.월,멋진 곳이에요 다음에 부모님 모시고 다시 오고 싶네요,2024-04-05 - 00:34:54
1721,naver,34,커피한약방,서울 중구 삼일대로12길 16-6, 4.42," 4,095",nnnayy,2.8.목,"찾는데 좀 헤맸어요 분위기 정말 좋고 커피도 정말 맛
있었구 살얼음이라 좋았어요!!! 오트밀크 변경도 돼서
 완벽",2024-04-05 - 00:34:54
1722,naver,34,커피한약방,서울 중구 삼일대로12길 16-6, 4.42," 4,095",jsjsk5,1.4.목,몇년만에 친구가 한국으로 놀러와서 구지구지 찾아서 간 곳 인테리어 개멋있는거 알겠고 커피도 이정도면 나쁘지않죠 근데 그럼 뭐합니까 직원들 너무 ...,2024-04-05 - 00:34:54
1723,naver,34,커피한약방,서울 중구 삼일대로12길 16-6, 4.42," 4,095",khkyen7,23.12.31.일,"특별한 곳에 색다른 인테리어가 멋진 곳이네요. 모처
럼 온 가족 나들이에 드렀는데 부모님은 무료로 음료
를 주셔서 더 욱더 좋았다는 ㅎㅎ",2024-04-05 - 00:34:54
1724,naver,34,커피한약방,서울 중구 삼일대로12길 16-6, 4.42," 4,095",말랑6123,2.17.토,말해 뭐할까요. 분위기로 1차. 커피 맛으로 2차. 디저 트로 3차. 다 하는 곳입니다. 아주 좁은 골목에 있어서 쉽게 지나칠 수 있지만… 간판이 확실하게 자...,2024-04-05 - 00:34:54
1725,naver,34,커피한약방,서울 중구 삼일대로12길 16-6, 4.42," 4,095",채주노트,1.25.목,컨셉 레트로하고 계단 좁고 길고.. 수족관 특이해용! 와인에이드 특이하고 맛있어요👍🏻 늦은 시간임에도 사람이 많다!,2024-04-05 - 00:34:54
1726,naver,34,커피한약방,서울 중구 삼일대로12길 16-6, 4.42," 4,095",Yeolmu,23.12.9.토,엄청 좁은 골목에잇어서 잘 찾으셔야해요!!! 골목사이 로 눈내려서 진짜이뻣고 커피 양은 적지만 드립커피 맛나요!!!! 완전 힙합니둥 ..ㅋㅋ 토요일 점심이...,2024-04-05 - 00:34:54
1727,naver,34,커피한약방,서울 중구 삼일대로12길 16-6, 4.42," 4,095",몽글누리,23.11.1.수,"힙지로의 감성이 완벽하게 묻어있는 곳입니다. 옛 혜 민서터에 자리하고 있어 20년대 경성으로 타임슬립 한 느낌인데, 커피와 디저트는 구색만 맞춘게 ...",2024-04-05 - 00:34:54
1728,naver,34,커피한약방,서울 중구 삼일대로12길 16-6, 4.42," 4,095",로그97,2.4.일,"필터커피랑 라떼 주문했어요.
믿고 마시는 필터커피 여전히 맛있어요:)",2024-04-05 - 00:34:54
1729,naver,34,커피한약방,서울 중구 삼일대로12길 16-6, 4.42," 4,095",s1****,23.11.4.토,근처왔다가 검색으로 방문했는데 옛 허준선생님 의원 터라고 한다. 커피한약방과 혜민서 마주 보고 있는데 하나는 음료 하나는 디저트류 파는데 아무 가...,2024-04-05 - 00:34:54
1730,naver,34,커피한약방,서울 중구 삼일대로12길 16-6, 4.42," 4,095",푸심이,1.12.금,"커피 원두 이름도 너무 귀엽고 진짜 향이 너무 좋아요
그리구 빵이 정말 너무 고급스럽게 맛있어요 카페랑 
혜민당이랑 따로따로인 줄 알았는데 둘다 야무...",2024-04-05 - 00:34:54
1731,naver,34,커피한약방,서울 중구 삼일대로12길 16-6, 4.42," 4,095",달님 칭구,2.13.화,커피가 맛있고 유니크한 분위기가 너무 좋아요! 강추합니다!,2024-04-05 - 00:34:54
1732,naver,34,커피한약방,서울 중구 삼일대로12길 16-6, 4.42," 4,095",맛집컬렉터 만뷰,1.19.금,"분위기 좋아요 🤍 의미 있는 곳이고 필터 커피 매력도 좋네요 일단 분위기도 너무 좋았어요 ㅎㅎ🖤
대만족입니당 👍",2024-04-05 - 00:34:54
1733,naver,34,커피한약방,서울 중구 삼일대로12길 16-6, 4.42," 4,095",옆동네호랑,1.26.금,골목이랑 내부 분위기 독특해서 친구 데리고 또 왔습니다. 역시 갈 때마다 다 좋아해주는 곳이에요!,2024-04-05 - 00:34:54
1734,naver,34,커피한약방,서울 중구 삼일대로12길 16-6, 4.42," 4,095",윤 슬34,23.12.28.목,힙지로 오면 꼭 들러요. 커피 너무 맛있고 빵들 역시 맛있어요. 오래된 멋이 있는 이 공간에 있으면 참 행 복해집니다. 친구들과 좋은 추억을 나누고 기...,2024-04-05 - 00:34:54
1735,naver,34,커피한약방,서울 중구 삼일대로12길 16-6, 4.42," 4,095",지니67504,23.10.12.목,허준선생님의 혜민서를 개조한 카페입니다 커피한약 방에서 커피를 주문하고 바로앞 디저트를 파는 혜민 당 1층에 자리를 잡았습니다 원두 볶는 향이 진...,2024-04-05 - 00:34:54
1736,naver,34,커피한약방,서울 중구 삼일대로12길 16-6, 4.42," 4,095",임홍구88,23.12.13.수,커피 맛있고 분위기도 독특하고 좋았습니다 다만 남 자 사장님의 불친절함은 잊을 수가 없네요 본인 실수 로 착각했음에도 사과는 일절 없었고 다른 손...,2024-04-05 - 00:34:54
1737,naver,34,커피한약방,서울 중구 삼일대로12길 16-6, 4.42," 4,095",scent21,3.24.일,을지로 감성의 카페입니다 삐걱거리는 계단은 갬성으로 해결,2024-04-05 - 00:34:54
1738,naver,34,커피한약방,서울 중구 삼일대로12길 16-6, 4.42," 4,095",하트시그널679,3.9.토,인테리어가 특이해요ㅎㅎ,2024-04-05 - 00:34:54
1739,naver,34,커피한약방,서울 중구 삼일대로12길 16-6, 4.42," 4,095",방과후티타임l,1.17.수,맛 ★★★★ 분위기 ★★★★★ 바닐라라떼가 생긴 것 보다 맛있었고 전체적인 인테리어가 너무 예뻐서 좋았어요!! 어항 있는 3층은 5~6시 쯤에 마감했...,2024-04-05 - 00:34:54
1740,naver,34,커피한약방,서울 중구 삼일대로12길 16-6, 4.42," 4,095",영월촌년,23.11.19.일,"일요일 14시경 검색해서 방문했는데, 여기 분위기도 괜찮고 커피맛 좋네요👍 <필터커피 다크 블랜드로 선택해서 ice로> 주문했는데, 오랜만에 제대로...",2024-04-05 - 00:34:54
1741,naver,34,커피한약방,서울 중구 삼일대로12길 16-6, 4.42," 4,095",썬듀애플,3.16.토,"디카페인도 맛있다니! 진정한 커피맛집ㅋㅋ
분위기좋음. 자리가없을수있어오",2024-04-05 - 00:34:54
1742,naver,34,커피한약방,서울 중구 삼일대로12길 16-6, 4.42," 4,095",미소배고파,23.12.24.일,"커피도 너무 맛있고 나이드신분들 , 외국인들 , 커플 , 
친구 , 가족 나이 상관없이 가기 너무 좋아요 사진도 
너무 예쁘게 나와서 나중에 또 가고싶습니다 ☺️☺️",2024-04-05 - 00:34:54
1743,naver,34,커피한약방,서울 중구 삼일대로12길 16-6, 4.42," 4,095",혁군425,3.19.화,"특이한 컨셉의 카페네요 ㅎㅎ
계단조심하세요, 한방에 갈지도..",2024-04-05 - 00:34:54
1744,naver,34,커피한약방,서울 중구 삼일대로12길 16-6, 4.42," 4,095",가을이야30,2.12.월,핸드드립 진한 커피가 생각하서 왔는데 취향저격이에요 ~😊 좁고 높은 계단타고 올라가는 테이블좌석이 인상적이에요.,2024-04-05 - 00:34:55
1745,naver,34,커피한약방,서울 중구 삼일대로12길 16-6, 4.42," 4,095",세현아,23.12.23.토,좁은 골목으로 들어가야해서 찾기 어려웠지만 새로운 감각을 탐색해볼 수 있었던 시간이었습니다 눈과 입이 즐거웠어요❤️‍🔥,2024-04-05 - 00:34:55
1746,naver,34,커피한약방,서울 중구 삼일대로12길 16-6, 4.42," 4,095",러블리림75,2.19.월,"리뷰는 처음 쓰지만 종종 오는 곳입니당
동료분이 여기 커피를 참 좋아하셔요!
얼음이 곱게 갈은 얼음이라 더 좋습니다",2024-04-05 - 00:34:55
1747,naver,34,커피한약방,서울 중구 삼일대로12길 16-6, 4.42," 4,095",Bongbong00,23.12.9.토,전체적으로 한약방이라는 컨셉에 충실한 목조 건물의 카페입니다. 계단 오르기가 좀 위태위태한 점 제외하 고는 인테리어는 정말 멋져요 필터커피 주문했...,2024-04-05 - 00:34:55
1748,naver,34,커피한약방,서울 중구 삼일대로12길 16-6, 4.42," 4,095",우진재하우갸,2.25.일,특이하고 좋아요,2024-04-05 - 00:34:55
1749,naver,34,커피한약방,서울 중구 삼일대로12길 16-6, 4.42," 4,095",yeahyeahy,2.10.토,공간 자체는 독특하고 음료도 괜찮았습니다. 처음에 는 잔잔한 연주곡이 나와 오랜만에 지인들과 좋은 설 날을 보내고 있었습니다. 근데 갑자기 외국 뮤...,2024-04-05 - 00:34:55
1750,naver,34,커피한약방,서울 중구 삼일대로12길 16-6, 4.42," 4,095",쿠루나,2.21.수,"커피 맛집! 계단이 조금 위험한 느낌이지만
커피는 맛납니다",2024-04-05 - 00:34:55
1751,naver,34,커피한약방,서울 중구 삼일대로12길 16-6, 4.42," 4,095",슈슈2372,2.16.금,"내부 자리가 없어서 혜민당에서 먹었는데 내부 인테
리어가 독특해요 2층은 히터를 너무 세게 틀어서 답
답했어요 커피는 나쁘지 않은데 수정과인가베...",2024-04-05 - 00:34:55
1752,naver,34,커피한약방,서울 중구 삼일대로12길 16-6, 4.42," 4,095",hms****,1.1.월,자개 장식이나 소품 등 카페 구석구석 볼거리가 많아요. 오르내리는 계단이 좁고 경사가 심해서 좀 조심해야 하지만 올라가면 아늑한 느낌이 있어요.,2024-04-05 - 00:34:55
1753,naver,34,커피한약방,서울 중구 삼일대로12길 16-6, 4.42," 4,095",콩콩1,23.10.15.일,분위기가 참 매력적인 공간이에요 사람들이 알고 찾 아오는게 신기할 정도로 좁은 골목 내에 있습니다. 커 피 볶는모습도 종종 볼 수 있는데 한국적인 매...,2024-04-05 - 00:34:55
1754,naver,34,커피한약방,서울 중구 삼일대로12길 16-6, 4.42," 4,095",뚜야0904,2.4.일,분위기 멋져요!ㅋㅋㅋㅋㅋ,2024-04-05 - 00:34:55
1755,naver,34,커피한약방,서울 중구 삼일대로12길 16-6, 4.42," 4,095",물병속별,3.2.토,필터커피가 늘 맛있습니다. 분위기도 좋구요.,2024-04-05 - 00:34:55
1756,naver,34,커피한약방,서울 중구 삼일대로12길 16-6, 4.42," 4,095",루시아15,3.5.화,친구들과~ 커피 맛있고 분위기 좋구요. 좋아하는카페~~,2024-04-05 - 00:34:55
1757,naver,34,커피한약방,서울 중구 삼일대로12길 16-6, 4.42," 4,095",언약05,23.11.25.토,주말에는 사람이 많아서 앉을 곳을 먼저 찾고 주문하는게 좋아요. 원두도 고를 수 있어 좋아요.,2024-04-05 - 00:34:55
1758,naver,34,커피한약방,서울 중구 삼일대로12길 16-6, 4.42," 4,095",느낌굿27,23.10.12.목,"필터커피스페샬로(7500) 주문했어요 향이 좋네요 
평일에가서 조용히 쉬다 힐링하다왔어요",2024-04-05 - 00:34:55
1759,naver,34,커피한약방,서울 중구 삼일대로12길 16-6, 4.42," 4,095",비치비치다비치,23.12.27.수,"디카페인을 시켰는데 디카페인 치고 써서 너무 좋았
어요 좋았어요!! 카페 분위기도 좋고 맛도 좋아서 만
족 스러웠지만 알바생이신지 카운터에 계시는 ...",2024-04-05 - 00:34:55
1760,naver,34,커피한약방,서울 중구 삼일대로12길 16-6, 4.42," 4,095",hat****,3.28.목,커피가 좋습니다 ㅎㅎ,2024-04-05 - 00:34:55
1761,naver,34,커피한약방,서울 중구 삼일대로12길 16-6, 4.42," 4,095",쏘good,23.9.25.월,두번째로 온 곳인데 그동안 뉴진스도 다녀갔네요! 커 피맛이 진한편인데 그래서 더 맛있게 마실 수 있었어 요~ 협소한 계단(무릎관절 조심!) 올라가보면 ...,2024-04-05 - 00:34:55
1762,naver,34,커피한약방,서울 중구 삼일대로12길 16-6, 4.42," 4,095",뚜이란,23.11.25.토,"외국인 친구가 커피 너무 맛있다며 또 오고 싶다고 하
네요 매장 인테리어와 분위기 집기까지 너무 옛스럽
고 멋있습니다",2024-04-05 - 00:34:55
1763,naver,34,커피한약방,서울 중구 삼일대로12길 16-6, 4.42," 4,095",이행자 소화데레사,2.27.화,커피한약방 그저 좋아요 그 옛 정취도 생각하게 합니더,2024-04-05 - 00:34:55
1764,naver,34,커피한약방,서울 중구 삼일대로12길 16-6, 4.42," 4,095",gie****,1.26.금,추천순으로 리뷰 몇개만 보고 가서 되게 좋은데라고 생각했는데;; 직원 두명이 너어어무 불친절해요 다신 안올거 같네요;; ‘허준 선생의 혜민서’ 장소가 ...,2024-04-05 - 00:34:55
1765,naver,34,커피한약방,서울 중구 삼일대로12길 16-6, 4.42," 4,095",min****,3.25.월,인테리어가 멋있어서 계속 안앉아있고싶을정도네요 재방문의사 있음,2024-04-05 - 00:34:55
1766,naver,34,커피한약방,서울 중구 삼일대로12길 16-6, 4.42," 4,095",호듀누나,1.5.금,"카페가 특이하여 방문했는데, 일단 직원들이 전반적 으로 상당히 불친절하네요^^ 혜민당도 같은 가게인지 어쩜 직원들이 하나같이 말투가 틱틱거리는지 ...",2024-04-05 - 00:34:55
1767,naver,34,커피한약방,서울 중구 삼일대로12길 16-6, 4.42," 4,095",768346,2.19.월,커피 양이 좀 적은편 분위기 좋고 음악소리 조금 큼,2024-04-05 - 00:34:55
