,Platform,Number,Store,Address,Review_score,Review_counts,ID,Date,Review_text,Time
0,naver,2,곤트란쉐리에 도화서길,서울 종로구 율곡로 24,, 14,납작Peach,23.3.27.월,창덕궁 꽃구경 갔다가 들른 카페인데 인테리어랑 뷰가 너무 좋네요,2024-04-05 - 00:21:34
1,naver,2,곤트란쉐리에 도화서길,서울 종로구 율곡로 24,, 14,Agio짱,23.4.15.토,오늘처럼 비온후 날씨 좋은날 최고의 야외 테라스자리,2024-04-05 - 00:21:34
2,naver,2,곤트란쉐리에 도화서길,서울 종로구 율곡로 24,, 14,종로맛선생,23.3.20.월,"3월초에 재오픈했다고 하네요.
바깥에서 이야기하면서 먹기 좋아요. : )",2024-04-05 - 00:21:34
3,naver,2,곤트란쉐리에 도화서길,서울 종로구 율곡로 24,, 14,미정3983,22.12.2.금,좋아요~,2024-04-05 - 00:21:34
4,naver,2,곤트란쉐리에 도화서길,서울 종로구 율곡로 24,, 14,올리4371,22.12.10.토,빵 맛나요,2024-04-05 - 00:21:34
5,naver,2,곤트란쉐리에 도화서길,서울 종로구 율곡로 24,, 14,최아현72,22.8.6.토,영수증인증,2024-04-05 - 00:21:34
6,naver,2,곤트란쉐리에 도화서길,서울 종로구 율곡로 24,, 14,최아현72,22.7.15.금,영수증인증,2024-04-05 - 00:21:34
7,naver,6,맛나베이커리,서울 종로구 종로51길 30 맛나베이커리,, 16,초이쁜,23.5.28.일,빵이 화려하진 않지만 갈때마다 빵 여러개 사오게 되네요.,2024-04-05 - 00:22:03
8,naver,6,맛나베이커리,서울 종로구 종로51길 30 맛나베이커리,, 16,ptk00,23.6.17.토,굿,2024-04-05 - 00:22:03
9,naver,6,맛나베이커리,서울 종로구 종로51길 30 맛나베이커리,, 16,구일ㅇ,23.3.22.수,"옛날에 자주먹던 빵들이 많아요
빵이 아주 가격도 좋고 맛있어요 가끔 들릅니다!",2024-04-05 - 00:22:03
10,naver,6,맛나베이커리,서울 종로구 종로51길 30 맛나베이커리,, 16,구일ㅇ,23.3.17.금,"동네빵집인데 가끔 이용합니다.
세련된 빵들은 없지만 기본에 충실한 빵들을 만날 수 있습니다 맛있어요",2024-04-05 - 00:22:03
11,naver,6,맛나베이커리,서울 종로구 종로51길 30 맛나베이커리,, 16,JWKH joyful,23.5.25.목,"가성비 좋아요
시장맛 느껴져요",2024-04-05 - 00:22:03
12,naver,6,맛나베이커리,서울 종로구 종로51길 30 맛나베이커리,, 16,운동매니아13,23.3.14.화,,2024-04-05 - 00:22:03
13,naver,6,맛나베이커리,서울 종로구 종로51길 30 맛나베이커리,, 16,bes****,22.4.17.일,💜🍰,2024-04-05 - 00:22:03
14,naver,6,맛나베이커리,서울 종로구 종로51길 30 맛나베이커리,, 16,bab****,22.4.17.일,❤️,2024-04-05 - 00:22:03
15,naver,7,빵절미,서울 종로구 수표로28길 17-26,, 8,미완성8091,23.7.28.금,친절해요,2024-04-05 - 00:22:10
16,naver,7,빵절미,서울 종로구 수표로28길 17-26,, 8,ssung0430,22.8.17.수,직원이 친절해요,2024-04-05 - 00:22:10
17,naver,7,빵절미,서울 종로구 수표로28길 17-26,, 8,후후2284,19.9.28.토,가게는 작은데 맛은 괜찮아요,2024-04-05 - 00:22:10
18,naver,16,더 스팟 패뷸러스,서울 중구 명동2길 22 1.2층, 4.56," 3,801",망사랑,3.21.목,수제바닐라라떼는 진짜 맛있었어요 커피 맛집 자몽에 이드도 첫입은 밍밍했는데 진짜 수제청이어서 그런지 뒤로 갈수록 좋았어요 딸기타르트 먹고 싶었...,2024-04-05 - 00:23:57
19,naver,16,더 스팟 패뷸러스,서울 중구 명동2길 22 1.2층, 4.56," 3,801",FOR DREAM,3.23.토,방문할때마다 베이커리가 넘 훌륭해서 행복합니다. 주말에 사람 많은건 어쩔수없지만요ㅎㅎ 머랭쿠키도 포장해왔는데 이것도맛있네요ㅎㅎ 디카페인음...,2024-04-05 - 00:23:57
20,naver,16,더 스팟 패뷸러스,서울 중구 명동2길 22 1.2층, 4.56," 3,801",후추맛젤리,3.11.월,음료잔 디자인이 꼭 타로카드 같이 예쁘네요🌙이런 원목느낌의 매장 분위기 진짜 좋아해요 따뜻한느낌나 서 편하고 아늑했어요:) 직원분들도 친절하시...,2024-04-05 - 00:23:57
21,naver,16,더 스팟 패뷸러스,서울 중구 명동2길 22 1.2층, 4.56," 3,801",감성한스푼담아,1.8.월,"1. 주문한 커피 및 디저트 케이크, 버터바 등 다양했는 데 겨울철이라 딸기 먹고 싶어 딸기 들어간 타르트 디 저트 먹었어요!! 딸기도 신선했고 생크림도 달...",2024-04-05 - 00:23:57
22,naver,16,더 스팟 패뷸러스,서울 중구 명동2길 22 1.2층, 4.56," 3,801",유스티나9587,3.4.월,친구가 가보자고 해서 갔는데 거울인테리어를 사용해 서 매장이아주 넓어보입니다. 관광객들과 직장인들이 많이 와서 회전율이 빠릅니다. 의자가 딱딱하...,2024-04-05 - 00:23:57
23,naver,16,더 스팟 패뷸러스,서울 중구 명동2길 22 1.2층, 4.56," 3,801",Jiiyul,2.24.토,명동에 놀러갔다가 카페 검색 후 방문했어요☺️ 예쁜 건물이 인상적이었구 샹들리에도 예뻤습니당 들어가 니 1층 2층 나뉘어졌었구 사람들이 정말 많았...,2024-04-05 - 00:23:57
24,naver,16,더 스팟 패뷸러스,서울 중구 명동2길 22 1.2층, 4.56," 3,801",Monggeul,1.24.수,명동오면 들리는 카페 디저트가 다양하고 맛있어요!! ! 날씨가 많이 추워서 차를 시켰는데 사과딸기 맛있 어요~~~ 👍🏻 여기 디저트는 다 맛있다는 배만 ...,2024-04-05 - 00:23:57
25,naver,16,더 스팟 패뷸러스,서울 중구 명동2길 22 1.2층, 4.56," 3,801",sage085,23.12.17.일,"일요일 오후라서 그런지,,, 외국인들도 많아요~!!! 오 래 기다렸네요~ 직원들~ 센스있고~ 매우 친절하십니 다 ☕️☕️☕️ 맛있는 디저트가 많아요~ 🍩🍪...",2024-04-05 - 00:23:57
26,naver,16,더 스팟 패뷸러스,서울 중구 명동2길 22 1.2층, 4.56," 3,801",페어리4845,2.24.토,중국여행 느낌 낭낭한 더스팟패뷸러스 🇨🇳 중국대사관 건너편에 앉아서 바라보면서 먹다보니 느낌이 꽤 생 소했지만 명동이 은근히 괜찮은 카페 찾기 힘...,2024-04-05 - 00:23:57
27,naver,16,더 스팟 패뷸러스,서울 중구 명동2길 22 1.2층, 4.56," 3,801",KSL1,2.11.일,분위기 좋은 카페입니다. 핫플답게 주말에 사람이 엄청 많습니다. 시그니처 슈페너 고소한 맛이 진합니다.,2024-04-05 - 00:23:57
28,naver,16,더 스팟 패뷸러스,서울 중구 명동2길 22 1.2층, 4.56," 3,801",홍홍홍3547,2.10.토,추운 명절에 명동에 돌아다니다가 들어갔는데 내부 인테리어가 예쁩니다. 1층에서 주문결제하고 2층에 주문표 보여드리면 만들어주는곳이더라구요. ...,2024-04-05 - 00:23:57
29,naver,16,더 스팟 패뷸러스,서울 중구 명동2길 22 1.2층, 4.56," 3,801",sok****,3.25.월,명동 중국대사관 근처. 점심때는 직장인들이 많아 시끄럽지만 조금 지나면 괜찮다. 디저트와 커피가 아주 잘 어울리는 곳,2024-04-05 - 00:23:57
30,naver,17,태극당,서울 중구 동호로24길 7, 4.38," 20,164",thankslee,3.19.화,"모나카중 제일 맛있는거 같아요 너무 달지않고~ 태극 장 본점은 처음 이용하는데 어르신들 정말 많고, 1/2/3 층 취식공간이 꽤 많은데, 1층은 거의 꽉 차 있...",2024-04-05 - 00:24:32
31,naver,17,태극당,서울 중구 동호로24길 7, 4.38," 20,164",희돌이네,3.14.목,지금 소포장 형식도 괜찮지만 예전이 더 그랍긴 하네 요.. 동네 맛있는 빵집보다 더 맛있는지는 모르겠지만 추억으로 가끔씩 방문합니다. 애플파네토네(₩...,2024-04-05 - 00:24:32
32,naver,17,태극당,서울 중구 동호로24길 7, 4.38," 20,164",또뽀삐 만세,3.11.월,동대문 쇼핑하러 나올때 가끔 들러서 아이스크림 모 나카 포장해갑니다. 야채 샐러드빵이 먹고 싶었는데 너무 사이즈가 커서 늘 망설이다가 오늘은 아...,2024-04-05 - 00:24:32
33,naver,17,태극당,서울 중구 동호로24길 7, 4.38," 20,164",기다리지않는 고기 쟁이,3.16.토,"계속 비싸지지만, 어디까지 가격이 오를까 두근두근 하지만,, 언제나 맛있는 태극당 모나카 아이스크림과 빵. 장충동 와서 족발 먹고 태극당 모나카는 국...",2024-04-05 - 00:24:32
34,naver,17,태극당,서울 중구 동호로24길 7, 4.38," 20,164",파인애플8686,2.17.토,친구랑 근처에 식사하러 지나갔는데 빵냄새가 너무 맛있어서 밥을 먹고 다시 왔었어요. 가장 오래된 빵집 이라 그런지 사람도 엄청 많고 빵 종류도 너무 ...,2024-04-05 - 00:24:32
35,naver,17,태극당,서울 중구 동호로24길 7, 4.38," 20,164",김땅콩누나,3.5.화,오랜만에 태극당본점 왔는데 차를 가지고는 처음 오 는거라 주차가 안되는걸 몰랐네요 ㅠ 근처에 어찌저 찌 대고 호다닥 계산하고 나왔습니다. 역시 태...,2024-04-05 - 00:24:32
36,naver,17,태극당,서울 중구 동호로24길 7, 4.38," 20,164",Istanbulu,4.4.목,"모나카는 세트(5개, 16,500원)로 사야 드라이아이스 포장해줘요. 카페도 있고, 2층도 넓어서 디저트카페 로 좋네요. 빵은 그냥 저냥 빵맛 모나카는 개인...",2024-04-05 - 00:24:32
37,naver,17,태극당,서울 중구 동호로24길 7, 4.38," 20,164",맛집인가기용,2.24.토,빵 종류가 너무너무너무 많아서 배부른데도 다 먹고 싶었어용 일요일 오후 3시쯤이었는데 추억의 로루케 익은 다 니갔더라구여ㅠㅠ 딸기잼 있는 롤케이...,2024-04-05 - 00:24:32
38,naver,17,태극당,서울 중구 동호로24길 7, 4.38," 20,164",jmc550,3.31.일,"오늘 태극당 가서 먹고싶은 빵 5개 샀다. 사고나서 장춘단공원 벤치 앉았는데, 모자를 벗어놨다. 신사역 갔다가 모자 놓고 온것이 생각나서 장충단 ...",2024-04-05 - 00:24:32
39,naver,17,태극당,서울 중구 동호로24길 7, 4.38," 20,164",ㅁㄴㅇ2735,1.20.토,클래식한 빵과 클래식하지 않은 가격으로 유명한 서 울에서 가장 오래된 빵집 어렸을때 보던 케익이나 빵 들을 볼수있다 가격 첨보면 왜 이리 비싸 싶은...,2024-04-05 - 00:24:32
40,naver,17,태극당,서울 중구 동호로24길 7, 4.38," 20,164",파워야미,23.12.22.금,우리나라에서 가장 오래된 빵집 태극당 회사근처에 있어 종종 들리는 빵맛집으로 요즘 아이스크림 모나 카 50% 세일하고잇데서 방문해보았다 연말이...,2024-04-05 - 00:24:32
41,naver,17,태극당,서울 중구 동호로24길 7, 4.38," 20,164",엘레나2023,2.21.수,장충체육관에 배구 보러가면서 들렀어요~ 태극당은 비가 와도 눈이 와도 사람이 많네요 ㅋ 외국인 손님도 많고요 ㅎㅎ 아이들이 하나씩 빵 고르고~ 제가 ...,2024-04-05 - 00:24:32
42,naver,17,태극당,서울 중구 동호로24길 7, 4.38," 20,164",나니누네노vV,3.14.목,"케이크 사러갔다가 빵도 왕창 사서 먹고왔어요! 빵이
진짜 다양하고 맛있네요 !! 인절미 슈크림빵 엄청 부
들쫄깃하고 맛나고 딸기빵도 맛나요!!",2024-04-05 - 00:24:32
43,naver,17,태극당,서울 중구 동호로24길 7, 4.38," 20,164",에머튼,23.12.5.화,"1946년 명동서 창업, 1973년 장충동 이전, 그리고 50 년. 서울 제과점의 자부심이자 상징인 이 곳은 들어설 때마다 수십년 전 어린 시절 어느 때로 돌아간 ...",2024-04-05 - 00:24:32
44,naver,17,태극당,서울 중구 동호로24길 7, 4.38," 20,164",싱싱싱v,2.27.화,역시 맛있어요! 중학생 남매도 버터 케익 맛에 반해서 생일이면 이거 사달라고 할 정도에요 빵이 촉촉하고 견과류가 들어있어 고소해요 버터라 한번에 많...,2024-04-05 - 00:24:32
45,naver,17,태극당,서울 중구 동호로24길 7, 4.38," 20,164",멍쓰40,3.28.목,아이생일 유치원에 케이크 보내야하는데 보통의 빵집 케이크는 작아요 태극당엔 큰 버터케이크가 있어서 작년에 사보고 올해 또 사면서 문구도 함께 예...,2024-04-05 - 00:24:32
46,naver,17,태극당,서울 중구 동호로24길 7, 4.38," 20,164",족사마,3.9.토,가족들과 같이 방문했는데 빵도 다양하고 가격도 괜찮아서 좋았어요! 아기 의자도 있어 편했답니다 ㅎㅎ,2024-04-05 - 00:24:32
47,naver,17,태극당,서울 중구 동호로24길 7, 4.38," 20,164",얄라셩50,3.2.토,전통이 느껴지는 건물과 맛 사라다야채빵은 정말 강 추! 다소 비쌀지 모르지만 소가 꽉차고 찰진 그 맛에 감탄합니다. 엄마의 젊은 시절 추억 얘기 들으...,2024-04-05 - 00:24:32
48,naver,17,태극당,서울 중구 동호로24길 7, 4.38," 20,164",pigeena,2.17.토,"레트로 느낌의 빵과 케이크가 인상적이었어요! 내부는 화려하고 예쁘게 리모델링되었어요ㅎㅎ 모나카랑 빵도 맛있었고, 커피 맛도 아주 좋았습니다!",2024-04-05 - 00:24:32
49,naver,17,태극당,서울 중구 동호로24길 7, 4.38," 20,164",피피로포클,2.23.금,"두번째 방문하는 태극당. 오늘은 자리가 많아서 앉아
서 커피까지 마셨다. 태극당 마크 형태의 시나몬 가루
가 올라간 비엔나 커피를 들이키니 피로가 다 ...",2024-04-05 - 00:24:32
50,naver,17,태극당,서울 중구 동호로24길 7, 4.38," 20,164",토리0611,3.3.일,흰몽블랑은 좀..ㅋ 그래도 생크림팥빵은 왜케 맛있는 지!! 워낙 느끼한거 싫어하는데 생크림이 하나도 안느 끼해서 너무 맛있어서 친정보낼것도.포장;;; 통...,2024-04-05 - 00:24:32
51,naver,17,태극당,서울 중구 동호로24길 7, 4.38," 20,164",헤나바나나,2.13.화,늘 모나카만 먹다가 처음으로 커피 주문했는데 여기 커피도 정말 맛있어요 :) 살짝 산미도는 원두에 특히 # 비엔나커피 강추합니다! 주차는 어렵고 테이블...,2024-04-05 - 00:24:32
52,naver,17,태극당,서울 중구 동호로24길 7, 4.38," 20,164",먹는것이남는거,3.16.토,빵이 너무 맛있어 보였는데 식후라 모나카아이스크림 먹었는데 너무 맛있더라구요 다른 빵도 먹어보고 싶어요^^,2024-04-05 - 00:24:32
53,naver,17,태극당,서울 중구 동호로24길 7, 4.38," 20,164",자산관리 CHO,3.31.일,"태극당에 들어왔어요. 역쉬 사람들이 많네요. 빵도 다
양하게 종류도 많고 진열도 잘 되어 있네요. 우리꺼와
형님네 선물로 빵을 많이 사드렸네요. 단팥빵...",2024-04-05 - 00:24:32
54,naver,17,태극당,서울 중구 동호로24길 7, 4.38," 20,164",일류경영,1.14.일,성인 되고 처음으로 빵사러 들린 태극당. 어릴적 이 동네에 살아 부모님과 자주 들리고 자주 먹던 카스테 라 빵이 생각나서 들린곳 나에겐 추억의 장소...,2024-04-05 - 00:24:32
55,naver,17,태극당,서울 중구 동호로24길 7, 4.38," 20,164",게민호,3.30.토,"약수 근처를 지날때면 항시 들르는 곳입니다. 
2층은 처음 올라가 봤는데 널찍하고 좋네요.
이곳은 빵이 항상 맛있습니다.",2024-04-05 - 00:24:33
56,naver,17,태극당,서울 중구 동호로24길 7, 4.38," 20,164",루리플케이,1.31.수,"동대입구역에서 가장 유명한 오래된 빵집 인기만큼이
나 점심땐 언제나 사람이 많음 날씨좋을땐 여기서 모
나카 하나 사들고 나와 장충공원 산책하는 즐...",2024-04-05 - 00:24:33
57,naver,17,태극당,서울 중구 동호로24길 7, 4.38," 20,164",mcs****,3.13.수,"오랜 역사가 증명하듯 빵 맛있어요. 커피도 맛이ㅆ어
요. 근처 일 있을땐 꼭 들러서 빵도 사오고 커피도 마
시고 온답니다.",2024-04-05 - 00:24:33
58,naver,17,태극당,서울 중구 동호로24길 7, 4.38," 20,164",H5673,3.16.토,부모님이 태극당 카스테라를 좋아하셔서 들렀습니다. 가격이 저렴하진 않지만 맛이 좋아요. 특히 어른들이 좋아하셔서 자주 들릅니다.,2024-04-05 - 00:24:33
59,naver,17,태극당,서울 중구 동호로24길 7, 4.38," 20,164",또오요리,2.9.금,레트로한 느낌 가득한 빵집이예요 서울에서 가장 오 래된 빵집답게 품질 관리도 엄청 잘되는 느낌이예요 빵들도 다 기본이상이라 왜 서울에서 오래 버...,2024-04-05 - 00:24:33
60,naver,17,태극당,서울 중구 동호로24길 7, 4.38," 20,164",직장인김오복,3.24.일,"음,,어,,,우선 단팥빵이랑 모나카 먹었고요. 우와아아 아아아아 ! 하는 맛은 아닌거 같습니다,,? 모나카는 음 먹을만은 한데 이걸 또 3300원 주고 먹기가,, (...",2024-04-05 - 00:24:33
61,naver,17,태극당,서울 중구 동호로24길 7, 4.38," 20,164",레이246,2.8.목,"특별한 날에 선물하기가 넘 좋아요 받는분들도 고마
워하시고, 오늘은 생크림케잌도 살겸 왔는데요 명절 
앞이라 좀 분주하네요 ^^♡",2024-04-05 - 00:24:33
62,naver,17,태극당,서울 중구 동호로24길 7, 4.38," 20,164",유리소리TV,1.17.수,매장이 엄청 넓더라구요!! 빵 자체가 담백하고 고소해 서 맛있었어요!! 재료를 아끼지 않고 팍팍 넣어서 그 런지 더 맛있었습니다! 매장도 레트로한 감성...,2024-04-05 - 00:24:33
63,naver,17,태극당,서울 중구 동호로24길 7, 4.38," 20,164",Love koala,2.19.월,"아빠가 옛날부터 빵 사오던곳이라 추억이네요
지금은 제 딸 주려고 빵 사러 왔어요
본점에서만 파는 빵이 있어요",2024-04-05 - 00:24:33
64,naver,17,태극당,서울 중구 동호로24길 7, 4.38," 20,164",강동송곳니 위 찰싹 후라이,23.12.9.토,"우연히 지나가다가 같이있던 동생이 여기 유명하다고 해서,, 한번 들어가서 사봤습니담 모나카 아이스크림 이 1등이고 버터빵이 7등이라고 해서 샀는데,,, ...",2024-04-05 - 00:24:33
65,naver,17,태극당,서울 중구 동호로24길 7, 4.38," 20,164",가을이야30,3.1.금,남산가기 전에 요기하러 잠깐 왔어요 ~ 레트로하고 샹들리에며 인테리어 멋지고 완두빵에 우유한잔 하고 가요 ~ ₩.₩ 👍,2024-04-05 - 00:24:33
66,naver,17,태극당,서울 중구 동호로24길 7, 4.38," 20,164",수링링,2.9.금,태극당은 어려서부터 정말 많이 갔어요! 빵 가격이 저 렴하지는 않지만 엄마도 저도 워낙 이곳 빵을 좋아하 여 자주 갑니다 :) 혹시 키린슈를 아시나요? 저...,2024-04-05 - 00:24:33
67,naver,17,태극당,서울 중구 동호로24길 7, 4.38," 20,164",다요트는내일부터,3.5.화,인테리어 멋있고 자리 넓고 쾌적한데 어르신들 외부 음식 같이 드시는통에 밥 냄새 나는거 어떻게 할 수 없나요?? 늘 바쁘셔서 살펴보실 시간이 없나봐...,2024-04-05 - 00:24:33
68,naver,17,태극당,서울 중구 동호로24길 7, 4.38," 20,164",lem****,3.2.토,"생일케잌으로 생크림케잌을 샀는데, 맛있었어요!",2024-04-05 - 00:24:33
69,naver,17,태극당,서울 중구 동호로24길 7, 4.38," 20,164",cockyaska2,3.2.토,매장이 넓고 좋아요^^ 찹쌀떡 샀는데 안달고 맛있어요^^*,2024-04-05 - 00:24:33
70,naver,17,태극당,서울 중구 동호로24길 7, 4.38," 20,164",동네사랑꾼,3.31.일,"모나카, 카카오롤, 극락 라떼를 먹었습니다~ 호암미술관에 있는 태극당인데, 그럭저럭 평범해서 괜찮았어요~~",2024-04-05 - 00:24:33
71,naver,17,태극당,서울 중구 동호로24길 7, 4.38," 20,164",노랑병아리7384,1.19.금,"태극당에서 찐구랑 차한잔씩 했어요
추억의 달달구리 케잌 먹어보려고 
홀케잌으로 하나 사서 자스민차랑 맛있게 먹었네요",2024-04-05 - 00:24:33
72,naver,17,태극당,서울 중구 동호로24길 7, 4.38," 20,164",냥냥파월,2.25.일,"레트로풍 매장이 넓고 쾌적해요
부모님과 가기도 좋아요~!",2024-04-05 - 00:24:33
73,naver,17,태극당,서울 중구 동호로24길 7, 4.38," 20,164",기분좋은씀씀이,3.17.일,"지인추천으로 가봤어요.
옛스러운 인테리어와 빵.커피
모두 만족스러웠네요",2024-04-05 - 00:24:33
74,naver,17,태극당,서울 중구 동호로24길 7, 4.38," 20,164",먹을거좋아하는아조씨,2.16.금,간식이 먹고싶어 첫방문했습니다 정말 맛있고 좋은 빵들이 많아서 행복해요,2024-04-05 - 00:24:33
75,naver,17,태극당,서울 중구 동호로24길 7, 4.38," 20,164",TS398,2.18.일,"커피랑 빵 너무 맛있고, 2층에도 넓게 자리 있어요",2024-04-05 - 00:24:33
76,naver,17,태극당,서울 중구 동호로24길 7, 4.38," 20,164",Jiuuni,3.2.토,2층까지 있고 넓어서 좋아요! 빵이랑 커피도 맛있습니디,2024-04-05 - 00:24:33
77,naver,17,태극당,서울 중구 동호로24길 7, 4.38," 20,164",너의 하늘을 보아,3.2.토,언제나 좋은 태극당빵집!,2024-04-05 - 00:24:33
78,naver,17,태극당,서울 중구 동호로24길 7, 4.38," 20,164",블루밍에브리데이,1.20.토,말로만 듣던 태극당 드뎌 가보네요. 가격이 좀 쎈편인 것만 빼면 추억돋고 좋네요. 엔틱 케이크 반가웠어요 ㅋ,2024-04-05 - 00:24:33
79,naver,17,태극당,서울 중구 동호로24길 7, 4.38," 20,164",keh****,1.20.토,"동대문 나왔다가
분위기 편한 태극당에 왔다가요.. 
주말이아 손님도 많고 북적북적하네요.",2024-04-05 - 00:24:33
80,naver,17,태극당,서울 중구 동호로24길 7, 4.38," 20,164",빛이여,23.11.17.금,서울에서 가장 오래된 빵집이라니! 처음 가봤는데 인 테리어가 고풍스러워요. 레트로가 유행인 요즘이라 오히려 힙하게 보이네요. 빵들이 좀 비싸지만 ...,2024-04-05 - 00:24:33
81,naver,17,태극당,서울 중구 동호로24길 7, 4.38," 20,164",2HyO,3.12.화,오랜만에 태극당. 옛날감성느낌의 빵들이 가득이라 간만에 다른느낌으로 허기를 채움.. 레트로갬성 가득가득,2024-04-05 - 00:24:33
82,naver,17,태극당,서울 중구 동호로24길 7, 4.38," 20,164",베이직물티슈,2.28.수,부모님모시고 장충동갈일있어서 들렀어요 저녁시간 대는 거의빵이없더라구요 배구경기있어서 더 그랬나 봐요 그래도 좋아하시는 옥수수빵 월병 등등 ...,2024-04-05 - 00:24:33
83,naver,17,태극당,서울 중구 동호로24길 7, 4.38," 20,164",MarkJacob,23.12.10.일,"80년대의 레트로한 베이커리 모습을 그대로 유지하 고 있는 곳. 매장 분위기나 포장지, 빵맛 모두 80년대 그대로를 유지하고 있어서 시니어들에게는 추...",2024-04-05 - 00:24:34
84,naver,17,태극당,서울 중구 동호로24길 7, 4.38," 20,164",mcs****,2.7.수,"빵도맛있지만
커피가맛있어요.케잌도맛있게보이네요.
약간레트로풍이지만ㅎ.",2024-04-05 - 00:24:34
85,naver,17,태극당,서울 중구 동호로24길 7, 4.38," 20,164",dotomi9,2.27.화,"태극당에서는 모나카 아이스크림만 먹어봤어서 이번 엔 빵으로 구입했는데, 유명한 것들로 구입하시는걸 추천..합니다🥲 제가 구입한 것들 모두 특별한 ...",2024-04-05 - 00:24:34
86,naver,17,태극당,서울 중구 동호로24길 7, 4.38," 20,164",황금들녘78,23.12.1.금,"매장이 넓고 인테리어가 독특하네요. 좌석이 많아 빵
과 곁들여 차 마시면서 이야기 나누기 좋습니다. 빵
맛이 궁금해 사먹어 보니 빵도 맛있네요.",2024-04-05 - 00:24:34
87,naver,17,태극당,서울 중구 동호로24길 7, 4.38," 20,164",soo****,3.24.일,혹시나 하는 마음으로 줄버터 재고가 있을까 했으나ㅡ역시 인기쟁이는 ㄷㄷㄷ12시에나온다함ㅜ다른 빵을대신 데리고 옴ㅜ태극당오래오래만나길:),2024-04-05 - 00:24:34
88,naver,17,태극당,서울 중구 동호로24길 7, 4.38," 20,164",fpdus10,23.11.18.토,모나카 아이스크림 기본 우유 니글거리지않고 깔끔한 맛이라 좋았어요 :) 초코맛도 먹었는데 많이 달지않 아 오히려 좋더라구요. 매장도 옛 디자인인데 ...,2024-04-05 - 00:24:34
89,naver,17,태극당,서울 중구 동호로24길 7, 4.38," 20,164",오펜,3.6.수,커피도 맛나고 역사와 전통있는 빵도 사서 집에 가져갈 생각하니 기분이 좋네요♡,2024-04-05 - 00:24:34
90,naver,17,태극당,서울 중구 동호로24길 7, 4.38," 20,164",가rrrr든,2.16.금,빵이 맛있고 인테리어가 고풍스럽고 멋져요!,2024-04-05 - 00:24:34
91,naver,17,태극당,서울 중구 동호로24길 7, 4.38," 20,164",녀자라서햄볶아요,23.12.23.토,줄서는 맛집~!! 추억의 모나카 먹고싶어서 방문했습 니다.^^ 티임머신을 타고서 그 옛날로 돌아간 기분이 ~ 추억의 생일케이크에 살포시 웃음이~ 모나카...,2024-04-05 - 00:24:34
92,naver,17,태극당,서울 중구 동호로24길 7, 4.38," 20,164",RONI in a GOOD PLACE,3.23.토,"늦은시간에 갔더니 빵이 많이 없었어요
그래도 자리가 많아 좋았네요~",2024-04-05 - 00:24:34
93,naver,17,태극당,서울 중구 동호로24길 7, 4.38," 20,164",고등어구이,1.24.수,사라다빵 가격보고 뭐이리 비싼가 싶었는데 들자마자 묵직함이...미쳤습니다ㅋㅋㅋㅋ사실 빠바 사라다빵 처럼 양배추랑 마요네즈 산뜻한 맛을 기대했는...,2024-04-05 - 00:24:34
94,naver,17,태극당,서울 중구 동호로24길 7, 4.38," 20,164",boh****,3.17.일,토나오는 빵집. 사진에 종이 보이시나요? 여기 이정 도로 더럽게 빵 만드는 곳입니다. 커스터드 만드는 크 림 뚜껑을 막고있던 종이라던데 진짜 개 황당...,2024-04-05 - 00:24:34
95,naver,17,태극당,서울 중구 동호로24길 7, 4.38," 20,164",열정용기,2.9.금,평소 집에서 직접 갈아서 내려서 마시는데 여기 아메리카노도 맛이 좋네요~!,2024-04-05 - 00:24:34
