,Platform,Number,Store,Address,Review_score,Review_counts,ID,Date,Review_text,Time
3985,naver,42,파네트,서울 마포구 마포대로11길 17 1층, 4.43," 3,612",까까곤듀11,3.7.목,"우선 빵잘알 집입니다! 빵지순례로 떠오르는 이유를 알겠어요. 어떻게 빵을 만들면 맛있을지 잘 아는
집이라 거를 메뉴가 없습니다! 모든 빵을 다 담아오지 못한게 아쉽습니다... 
그리고 직원분들 중에 어린 여자분이 계신데, 가장 밝으신 분이 센스도 넘치셔서 참 기분이 좋았습니다",2024-04-07 - 22:24:47
3986,naver,42,파네트,서울 마포구 마포대로11길 17 1층, 4.43," 3,612",hel****,23.11.24.금,"검색해서 평이 좋아 와봤습니다. 아침에 바게트 샌드위치 먹고 점심시간에 또 들러서 다른 빵도 사갔습니다. 바게트빵은 점심때 가니 다 매진되었더라고요. 개인적으로 아메리카노와 바게트빵, 뺑 스위스 맛있었어요. 다음에 마포구에 또 들르면 찾아갈 것 같아요! 매장은 가요대신 다른 음악 쓰시면 더 분위기 좋을 것 같네요.",2024-04-07 - 22:24:47
3987,naver,42,파네트,서울 마포구 마포대로11길 17 1층, 4.43," 3,612",168CM,3.26.화,"항상 맛있습니다. 
매번 새로운빵 시도해보는데 역시나 항상 맛있어요🥰😍",2024-04-07 - 22:24:47
3988,naver,42,파네트,서울 마포구 마포대로11길 17 1층, 4.43," 3,612",강모씨22,4.3.수,"아이 간식 종종 사는데, 맛있어요. 스콘은 좀 아쉽",2024-04-07 - 22:24:47
3989,naver,42,파네트,서울 마포구 마포대로11길 17 1층, 4.43," 3,612",글몽64,23.12.8.금,"엄청난 크기와 재료에 비해 가격이 저렴해서 놀라고, 빵과 음료가 굉장히 다양하고 맛있어서 놀란 곳..! 연말이라 크리스마스 주제로 꾸며져 있는 것도 좋았어요. 공덕 맛집 베이커리 카페로 추천이에요!",2024-04-07 - 22:24:47
3990,naver,42,파네트,서울 마포구 마포대로11길 17 1층, 4.43," 3,612",Uinoem,3.11.월,자리도 꽤 있어서 좋네요,2024-04-07 - 22:24:47
3991,naver,42,파네트,서울 마포구 마포대로11길 17 1층, 4.43," 3,612",말릴라4,3.4.월,"디저트 하나 하나 다 맛있어요!
대신 늦게 가면 맛있는 빵이 다 나가서 종류가 몇개 안남아서 오전에 가는 걸 추천드려요!",2024-04-07 - 22:24:47
3992,naver,42,파네트,서울 마포구 마포대로11길 17 1층, 4.43," 3,612",jy****,3.12.화,여전히 사람들로 바글바글 하네요~ 에그타르트 먹고 싶어서 밋봤는데 평범하네요. 에프에 돌려 먹어봐야겠어요~,2024-04-07 - 22:24:47
3993,naver,42,파네트,서울 마포구 마포대로11길 17 1층, 4.43," 3,612",샤뷰샤뷰,23.12.10.일,"공덕에서 제가 최고로 애정하는 빵집이에요~! 모든 메뉴가 재료도 그득그득하고, 샌드위치 같은 식사빵도 너무 맛있어요ㅠㅠㅠㅠㅠ신제품 출시도 자주 돼서 정기적으로 들려줘야하는 곳입니다!!",2024-04-07 - 22:24:47
3994,naver,42,파네트,서울 마포구 마포대로11길 17 1층, 4.43," 3,612",리리리리라라,1.3.수,빵 종류가 다양하고 가격이 저렴한 편이에요. 기본 빵부터 디저트 빵들 다 맛있어요.,2024-04-07 - 22:24:47
3995,naver,42,파네트,서울 마포구 마포대로11길 17 1층, 4.43," 3,612",Z만두,3.10.일,"체인점보다 덜달고, 가족 모임에 완벽한 딸기초코.",2024-04-07 - 22:24:47
3996,naver,42,파네트,서울 마포구 마포대로11길 17 1층, 4.43," 3,612",Escape53,3.10.일,먹느라 사진을 못찍었네요 ㅎㅎ 주변에서 맛집이라고 해서 들렀는데 다양한 빵종류가 있고 빵하나하나 쫀득하고 맛있네요 또방문할거예요,2024-04-07 - 22:24:47
3997,naver,42,파네트,서울 마포구 마포대로11길 17 1층, 4.43," 3,612",ljljijjl1,1.10.수,"여기 빵 정말 맛있어요!
강강추추입니다.
늦게가면 빵이 줄어들어서
얼른얼른 가야해요
소금빵 맛있어요!",2024-04-07 - 22:24:47
3998,naver,42,파네트,서울 마포구 마포대로11길 17 1층, 4.43," 3,612",짤랑이9123,3.2.토,선물하기에도 너무 좋운 빵집,2024-04-07 - 22:24:47
3999,naver,42,파네트,서울 마포구 마포대로11길 17 1층, 4.43," 3,612",먹방요정,2.7.수,이집 빵 넘 잘해여 ㅎㅎ,2024-04-07 - 22:24:47
4000,naver,42,파네트,서울 마포구 마포대로11길 17 1층, 4.43," 3,612",butternut,23.12.27.수,"바치토 제일 맛있어요 추천합니다
스프도 개존맛 커피는 기대 없었는데 의외로 맛있어서 놀랐어요",2024-04-07 - 22:24:47
4001,naver,42,파네트,서울 마포구 마포대로11길 17 1층, 4.43," 3,612",시루랑나랑,3.8.금,파운드케익류 23000원. 받으신 분이 맛있다고 만족하셔서 기분좋은 선물.,2024-04-07 - 22:24:47
4002,naver,42,파네트,서울 마포구 마포대로11길 17 1층, 4.43," 3,612",skk****,3.30.토,빵 🍞 커피 ☕️ 👍,2024-04-07 - 22:24:47
4003,naver,42,파네트,서울 마포구 마포대로11길 17 1층, 4.43," 3,612",soljikim,23.10.16.월,오후 5시쯤 갔다가 솔드아웃이 많아서 아쉬웠던 파네트♡ 단호박 듬뿍 들어간 깜빠뉴와 바삭바삭하고 달달한 그래놀라 그리고 피칸호두파이 모두 맛나요,2024-04-07 - 22:24:47
4004,naver,42,파네트,서울 마포구 마포대로11길 17 1층, 4.43," 3,612",마린느,3.11.월,"전에도 몇번 샀다가 별로라 안 가다 오랜만에 식빵 하나 샀는데 역시 별로얐아요,,, 여기 빵집이랑 저는 안
맞는 듯",2024-04-07 - 22:24:47
4005,naver,42,파네트,서울 마포구 마포대로11길 17 1층, 4.43," 3,612",와다다v,23.12.14.목,"생크림 케익에서 느껴지는 느끼한 단맛이 없어요👍 과하게 달지않고, 망고 본연의 맛이 잘 느껴지는 케익이네요!! 오전 9시 반경에도 줄 서있고...자리도 꽉차있었다고하네요... 역시 너무 먹기 힘든집이예요 😭",2024-04-07 - 22:24:47
4006,naver,42,파네트,서울 마포구 마포대로11길 17 1층, 4.43," 3,612",푸리링주스,23.12.16.토,"빵 종류 다양해서 뭐 살지 고르기 힘들었어요🥹 온김에 왕창 사가고 싶었지만 또 올거라 다짐하며 뺑스위스, 가을밤, 호두 브리오슈 샀는데 다 맛있어요🩷 뺑스위스가 원픽!",2024-04-07 - 22:24:48
4007,naver,42,파네트,서울 마포구 마포대로11길 17 1층, 4.43," 3,612",제3의사랑,3.24.일,빵이 맛있어요.,2024-04-07 - 22:24:48
4008,naver,42,파네트,서울 마포구 마포대로11길 17 1층, 4.43," 3,612",bayoung,3.15.금,갈때마다 불친절. 특히 젤 나이많은분^^,2024-04-07 - 22:24:48
4009,naver,42,파네트,서울 마포구 마포대로11길 17 1층, 4.43," 3,612",시루랑나랑,2.23.금,빵도 맛있지먀 쿠키나 케익 선물하기 좋은 곳!,2024-04-07 - 22:24:48
4010,naver,42,파네트,서울 마포구 마포대로11길 17 1층, 4.43," 3,612",쏘롱쏘춍,23.11.28.화,"종류가 매우 다양해서 골라먹는 재미가 쏠쏠 ! 
휘낭시에 겉바속쫀!! 너무 맛있네요 
자주 방문해야겠어요",2024-04-07 - 22:24:48
4011,naver,42,파네트,서울 마포구 마포대로11길 17 1층, 4.43," 3,612",푸디주디,23.11.14.화,"빵들이 거의 다 맛있어요💕
소금빵도 맛있고 크룽지 여기서 처음 먹어봤는데 중독됐어요!! 
늦게가면 솔드아웃이니까 오전에 다녀오시는거 추천👍🏻",2024-04-07 - 22:24:48
4012,naver,42,파네트,서울 마포구 마포대로11길 17 1층, 4.43," 3,612",11얍얍11,3.24.일,👍🏻👍🏻👍🏻,2024-04-07 - 22:24:48
4013,naver,42,파네트,서울 마포구 마포대로11길 17 1층, 4.43," 3,612",약간 예민한데 다 맛있게 잘먹음,1.8.월,"샌드위치로 맛도 좋은데 빵 자체로도 굉장히 맛잇음 훌륭합니다
근데 일하는 분들 위생관념이 좀 약함 음식만드는 사람은 음식 만들때 마스크 안쓴 상태로 제발 말 좀 안했음면..
그리고 제빵하시는 분들 안에서 조리할때 쓰던 장갑끼고 그대로 외부에 음식박스 나르고 다 하시네요 그럴거면 장갑은 왜끼시는지..본인 손을 보호하는건지..",2024-04-07 - 22:24:48
4014,naver,42,파네트,서울 마포구 마포대로11길 17 1층, 4.43," 3,612",cindysuh00,4.3.수,예쁜빵이 많아요,2024-04-07 - 22:24:48
4015,naver,42,파네트,서울 마포구 마포대로11길 17 1층, 4.43," 3,612",11얍얍11,2.28.수,까눌레 아주 맛있어요 🌚,2024-04-07 - 22:24:48
4016,naver,42,파네트,서울 마포구 마포대로11길 17 1층, 4.43," 3,612",아메리코리안,3.2.토,"티그레 맛있어요!
맛집이라 사람들 계속 옴ㅋㅎ..",2024-04-07 - 22:24:48
4017,naver,42,파네트,서울 마포구 마포대로11길 17 1층, 4.43," 3,612",제3의사랑,3.7.목,빵이 맛있어요,2024-04-07 - 22:24:48
4018,naver,42,파네트,서울 마포구 마포대로11길 17 1층, 4.43," 3,612",싱그러운나무99,23.11.26.일,빵이 담백하고 맛있어요.박스포장해서 선물하기 좋아요,2024-04-07 - 22:24:48
4019,naver,42,파네트,서울 마포구 마포대로11길 17 1층, 4.43," 3,612",skk****,3.1.금,빵 🍞 맛있어요 ^^,2024-04-07 - 22:24:48
4020,naver,42,파네트,서울 마포구 마포대로11길 17 1층, 4.43," 3,612",박하스63,23.12.5.화,빵이 예술이에요. 진짜 빵지순례로 필수코스입니다,2024-04-07 - 22:24:48
4021,naver,42,파네트,서울 마포구 마포대로11길 17 1층, 4.43," 3,612",진덤,1.31.수,점심시간에 자주 들리는 회사 근처 빵 맛집! 요 샌드위치는 첫 도전이었는데 좀 달앜ㅅ어요 ㅠㅠ 담엔 잠봉뵈르 샌드위치 먹어볼래요!,2024-04-07 - 22:24:48
4022,naver,42,파네트,서울 마포구 마포대로11길 17 1층, 4.43," 3,612",ysj****,3.31.일,샌드위치 맛있어요,2024-04-07 - 22:24:48
4023,naver,42,파네트,서울 마포구 마포대로11길 17 1층, 4.43," 3,612",wide86,2.20.화,소금빵 우유크림빵 둘 다 맛있네요 또 가야겠다 ㅜ.ㅜ,2024-04-07 - 22:24:48
4024,naver,42,파네트,서울 마포구 마포대로11길 17 1층, 4.43," 3,612",Z만두,1.22.월,추운겨울 카페인 없는 루이보스티 한잔.,2024-04-07 - 22:24:48
4025,naver,42,파네트,서울 마포구 마포대로11길 17 1층, 4.43," 3,612",달띠맘9,2.13.화,케잌 예약했어요 버터프레첼 맛집,2024-04-07 - 22:24:48
4026,naver,42,파네트,서울 마포구 마포대로11길 17 1층, 4.43," 3,612",plpsks1,23.12.10.일,"빵 종류가 엄청 많고 진짜 맛있어요 분위기도 너무 좋구요 다음날 또 가서 빵 샀습니다
 진짜 찐 맛집 찾아서 너무 행복하네요
너무 행복하네요😊😊😊",2024-04-07 - 22:24:48
4027,naver,42,파네트,서울 마포구 마포대로11길 17 1층, 4.43," 3,612",현현ㅌㅌ,3.4.월,여기서 예전에 치즈단호박깜빠뉴?먹고 반해서 재방문함. 이번에는 통깨깜빠뉴로 했는데 역시나 맛있었다.,2024-04-07 - 22:24:48
4028,naver,42,파네트,서울 마포구 마포대로11길 17 1층, 4.43," 3,612",밍둥어야,3.13.수,"빵이 넘 맛있어서 바로 중독되었오욤
광화문보다 널찍해서 좋네요",2024-04-07 - 22:24:48
4029,naver,42,파네트,서울 마포구 마포대로11길 17 1층, 4.43," 3,612",홀롤롤222,3.21.목,공덕의 유명한빵집을 나도 가보았다.,2024-04-07 - 22:24:49
4030,naver,42,파네트,서울 마포구 마포대로11길 17 1층, 4.43," 3,612",시원3961,2.18.일,쿠키도 빵도 다 맛있어요,2024-04-07 - 22:24:49
4031,naver,42,파네트,서울 마포구 마포대로11길 17 1층, 4.43," 3,612",제3의사랑,2.18.일,빵이 맛있어요.,2024-04-07 - 22:24:49
4032,naver,42,파네트,서울 마포구 마포대로11길 17 1층, 4.43," 3,612",약간 예민한데 다 맛있게 잘먹음,1.15.월,빵크기 왜 이렇게 제각각임..ㅋㅋ,2024-04-07 - 22:24:49
4033,naver,42,파네트,서울 마포구 마포대로11길 17 1층, 4.43," 3,612",hyunowhr,23.12.9.토,치아바타가 아주 쫀득하고 맛있습니다 ~~~~,2024-04-07 - 22:24:49
4034,naver,42,파네트,서울 마포구 마포대로11길 17 1층, 4.43," 3,612",168CM,3.5.화,너무 맛있습니다!!,2024-04-07 - 22:24:49
4035,naver,42,파네트,서울 마포구 마포대로11길 17 1층, 4.43," 3,612",만만이 입니다,3.18.월,"바질향이 좋음.
좋아요~",2024-04-07 - 22:24:49
4036,naver,42,파네트,서울 마포구 마포대로11길 17 1층, 4.43," 3,612",복숭아3128,3.15.금,빵지순례시 빼놓을 수 없는 곳입니다,2024-04-07 - 22:24:49
4037,naver,42,파네트,서울 마포구 마포대로11길 17 1층, 4.43," 3,612",제3의사랑,2.11.일,빵이 맛있어요.,2024-04-07 - 22:24:49
4038,naver,42,파네트,서울 마포구 마포대로11길 17 1층, 4.43," 3,612",dpfls,23.12.9.토,"소금빵, 아몬드볼 먹었는데 무난하고 괜찮았습니다
빵 종류가 다양해서 다른 빵들도 먹어보고 싶네요",2024-04-07 - 22:24:49
4039,naver,42,파네트,서울 마포구 마포대로11길 17 1층, 4.43," 3,612",약간 예민한데 다 맛있게 잘먹음,1.11.목,"빵이 진짜 맛잇음 매일 가는중..갈때마다 다른 빵 먹고 잇는데 맛이 다 괜찮음..
커피는 그닥",2024-04-07 - 22:24:49
4040,naver,42,파네트,서울 마포구 마포대로11길 17 1층, 4.43," 3,612",11얍얍11,1.7.일,"빵 맛있어요..
근데 케이크도 정말 맛있어요..
홀케이크도 한번에 다 먹을 수 있을만큼..🎂🤍❤️",2024-04-07 - 22:24:49
4041,naver,42,파네트,서울 마포구 마포대로11길 17 1층, 4.43," 3,612",klum,3.8.금,,2024-04-07 - 22:24:49
4042,naver,42,파네트,서울 마포구 마포대로11길 17 1층, 4.43," 3,612",파니55,2.3.토,빵이 맛있어요,2024-04-07 - 22:24:49
4043,naver,42,파네트,서울 마포구 마포대로11길 17 1층, 4.43," 3,612",오레오05,2.23.금,잠봉시오가 정말 맛있어요,2024-04-07 - 22:24:49
4044,naver,42,파네트,서울 마포구 마포대로11길 17 1층, 4.43," 3,612",맛집러78,3.8.금,빵도 다양하고 맛있어요,2024-04-07 - 22:24:49
4045,naver,42,파네트,서울 마포구 마포대로11길 17 1층, 4.43," 3,612",dpfls,23.12.16.토,티그레 바삭하고 맛있어요,2024-04-07 - 22:24:49
4046,naver,42,파네트,서울 마포구 마포대로11길 17 1층, 4.43," 3,612",독서천재,23.9.6.수,조금 이른 점심. 브런치 겸 들른 곳. 차분한 분위기에 시원한 에어컨 바람... 여유있는 브런치 시간을 가지니 좋네요. 덕분에 힐링 제대로 한 것 같아요. 자주 들러야겠어요. 굿~!,2024-04-07 - 22:24:49
4047,naver,42,파네트,서울 마포구 마포대로11길 17 1층, 4.43," 3,612",대확행을 위하여,23.11.12.일,크리스마스 분위기 물씬나고 디저트랑 빵 종류도 정말 많아서 뭘 사야하나 고민이 엄청 됐어요 ㅋㅋㅋㅋ 사온빵들 다 너무 맛있고 다음에 또 갈게요😍😍😍,2024-04-07 - 22:24:49
4048,naver,42,파네트,서울 마포구 마포대로11길 17 1층, 4.43," 3,612",illllliiiill35,2.12.월,가격이 싸진 않지만 맛있어요!!,2024-04-07 - 22:24:49
4049,naver,42,파네트,서울 마포구 마포대로11길 17 1층, 4.43," 3,612",skk****,1.26.금,빵 🍞 이 맛있는 곳,2024-04-07 - 22:24:49
4050,naver,42,파네트,서울 마포구 마포대로11길 17 1층, 4.43," 3,612",오레오05,2.28.수,까눌레 맛있어요,2024-04-07 - 22:24:49
4051,naver,42,파네트,서울 마포구 마포대로11길 17 1층, 4.43," 3,612",엥엥이5,2.24.토,빵이 맛있어요,2024-04-07 - 22:24:49
4052,naver,42,파네트,서울 마포구 마포대로11길 17 1층, 4.43," 3,612",차곡차곡,23.12.6.수,빵 진짜 맛있고 속재료가 꽉찬 곳. 보통은 속재료가 들어간 빵은 속재료가 적어서 아쉬운 경우가 많은데 여긴 그 반대임. 빵이 정말 맛있는데 빵이 얇고 ...,2024-04-07 - 22:24:49
4053,naver,42,파네트,서울 마포구 마포대로11길 17 1층, 4.43," 3,612",yae0,2.27.화,,2024-04-07 - 22:24:49
4054,naver,42,파네트,서울 마포구 마포대로11길 17 1층, 4.43," 3,612",dal9ff,23.8.16.수,"식빵이 필요해서 식빵 살 겸 왔는데 빵들이 다양해서 눈 돌아가네요✨️ 이전에 친구랑 한 번 들렀을 때 맛있었던 기억이 나 오랜만에 찾아왔어요! 여전히 사람들로 북적북적하구요ㅎㅎ 우유식빵, 비엘티, 꼬마소시지 샀는데 꼬마소시지 입맛저격이네요ㅠㅠ 직원 분들 친절하시고 빵 맛있고 가게 분위기 좋아요!👍",2024-04-07 - 22:24:49
4055,naver,42,파네트,서울 마포구 마포대로11길 17 1층, 4.43," 3,612",대갈장군5484,1.5.금,"개념없는 사람은 많으니 개념없는 점원 때문에 분노 가 치밀지는 않지만, 그래도 그냥 지나가지 않고 언급 을 해줘야 소비자도 점주도 정보를 얻고, 그 점...",2024-04-07 - 22:24:49
4056,naver,42,파네트,서울 마포구 마포대로11길 17 1층, 4.43," 3,612",오밍03,23.12.3.일,빵도 커피도 맛있어요!,2024-04-07 - 22:24:49
4057,naver,42,파네트,서울 마포구 마포대로11길 17 1층, 4.43," 3,612",c5****,23.12.31.일,빵이 맛있어요,2024-04-07 - 22:24:50
4058,naver,42,파네트,서울 마포구 마포대로11길 17 1층, 4.43," 3,612",수7,23.12.29.금,"통밀 소금빵 너무 맛있네요
다른 빵 종류들도 많고 가격도 합리적 이네요",2024-04-07 - 22:24:50
4059,naver,42,파네트,서울 마포구 마포대로11길 17 1층, 4.43," 3,612",수7,23.12.12.화,몇번 갔던곳인데 갈때마다 빵 퀄리티가 너무 좋아서 오늘은 리뷰도 써봅니다 맛도 역시나 좋습니다,2024-04-07 - 22:24:50
4060,naver,42,파네트,서울 마포구 마포대로11길 17 1층, 4.43," 3,612",Shyne,23.12.15.금,"바질토마토 크림치즈 빵 맛있어요 
패션후르츠 에이드도 잘먹었습니다",2024-04-07 - 22:24:50
4061,naver,42,파네트,서울 마포구 마포대로11길 17 1층, 4.43," 3,612",청풍야,23.12.16.토,"케익사기 쉽지 않아..ㅎㅎ
마지막꺼 겨우 겟~♡",2024-04-07 - 22:24:50
4062,naver,42,파네트,서울 마포구 마포대로11길 17 1층, 4.43," 3,612",hao 3ariana o,4.4.목,굿,2024-04-07 - 22:24:50
4063,naver,42,파네트,서울 마포구 마포대로11길 17 1층, 4.43," 3,612",llinano,23.12.24.일,잠봉뵈르👍🏻 바게트빵도 맛있어요,2024-04-07 - 22:24:50
4064,naver,42,파네트,서울 마포구 마포대로11길 17 1층, 4.43," 3,612",청풍야,23.10.18.수,"저녁 땐 첨 가봤는데 역시나 매진된 빵이 많아요 ㅎㅎ
남겨져 있던 것들 중에 두어개 쓱싹 했습니다.",2024-04-07 - 22:24:50
4065,naver,42,파네트,서울 마포구 마포대로11길 17 1층, 4.43," 3,612",엘애플,23.11.18.토,"저녁에 갔더니 남은 빵이 얼마 없어서 다양하게 먹어보진 못했지만
밤파이 완전 감동! 밤이 가득 들어 있었어요🤎",2024-04-07 - 22:24:50
4066,naver,42,파네트,서울 마포구 마포대로11길 17 1층, 4.43," 3,612",오레오05,2.22.목,샌드위치 다 맛있어요,2024-04-07 - 22:24:50
4067,naver,42,파네트,서울 마포구 마포대로11길 17 1층, 4.43," 3,612",싱싱태양,3.30.토,맛있어요,2024-04-07 - 22:24:50
4068,naver,42,파네트,서울 마포구 마포대로11길 17 1층, 4.43," 3,612",선넘네90,3.2.토,"빵종류 다양하고 사장님 친절하고좋아요
주파는 애매ㅠ",2024-04-07 - 22:24:50
4069,naver,42,파네트,서울 마포구 마포대로11길 17 1층, 4.43," 3,612",llinano,23.12.27.수,오전10시경 소금빵사러갔는데 아직 안나왔는지 없어서 베이글사왔습니다! 크림치즈에 무화과도 듬뿍있었고 베이글도 맛있었어요.,2024-04-07 - 22:24:50
4070,naver,42,파네트,서울 마포구 마포대로11길 17 1층, 4.43," 3,612",맛없을시 비분강개,23.10.16.월,"고민하다가 고구마 깜빠뉴를 먹었는데, 고구마가 실하게 들어있어서 속이 든든한 빵입니다~! 체다치즈도 더 많았으면 훨씬 맛있었을 것 같아요!!!",2024-04-07 - 22:24:50
4071,naver,42,파네트,서울 마포구 마포대로11길 17 1층, 4.43," 3,612",파이썬레드썬,1.5.금,매콤소시지크로와상 🥐,2024-04-07 - 22:24:50
4072,naver,42,파네트,서울 마포구 마포대로11길 17 1층, 4.43," 3,612",IL Mondo,23.10.9.월,플랑 아망드 맛있어요 커피도 맛있지만 저녁엔 복숭 아 아이스티도 괜찮아요 분말가루가 아닌 청을 만들 어서 많이 달지 않고 부드러워요 퀄리티 좋은 ...,2024-04-07 - 22:24:50
4073,naver,42,파네트,서울 마포구 마포대로11길 17 1층, 4.43," 3,612",시루랑나랑,23.10.28.토,토마토바질 바게트빵 굿굿!,2024-04-07 - 22:24:50
4074,naver,42,파네트,서울 마포구 마포대로11길 17 1층, 4.43," 3,612",sua****,4.4.목,조아요,2024-04-07 - 22:24:50
4075,naver,42,파네트,서울 마포구 마포대로11길 17 1층, 4.43," 3,612",돈지 매일 뭐먹니,23.9.9.토,빵도 맛있고 항상 사람이 많아요,2024-04-07 - 22:24:50
4076,naver,42,파네트,서울 마포구 마포대로11길 17 1층, 4.43," 3,612",khi****,3.23.토,굿,2024-04-07 - 22:24:50
4077,naver,42,파네트,서울 마포구 마포대로11길 17 1층, 4.43," 3,612",헬스맨,23.11.25.토,건강한 빵을 파네트에서 샀습니다.,2024-04-07 - 22:24:50
4078,naver,42,파네트,서울 마포구 마포대로11길 17 1층, 4.43," 3,612",까만작은코,23.12.23.토,바치토 빵이 정말맛있어요!!,2024-04-07 - 22:24:50
4079,naver,42,파네트,서울 마포구 마포대로11길 17 1층, 4.43," 3,612",amy0302,23.12.11.월,"빵 포장을 하려는데 빵에 머리카락이 붙어 있었다 그 걸 그대로 포장하려기에 새걸로 달라고 요청을 하니 사과 한마디 없이 ""손님 머리카락이 아닐까요 ?...",2024-04-07 - 22:24:50
4080,naver,42,파네트,서울 마포구 마포대로11길 17 1층, 4.43," 3,612",얌두잇,23.12.7.목,"빵이 다 맛있었어요 ㅎㄹㅎ
디저트 종류 많고 아메리카노도 맛나여
단호박 어쩌고 진짜 맛났던 ㄹㄹ",2024-04-07 - 22:24:50
4081,naver,43,카펫,"서울 마포구 동교로9길 72 1,2층",, 902,alssidmlahapsxm,3.16.토,"번초콜릿이 너무 예쁘고 맛있어보여서 이거 먹으러 망원까지 갔눈데..... ㅠㅠ
대기 한시간이라니요오!!! 사람들 너무 많았어요..
평일에 여유롭게 마셨으면 좋았을텐데,
근데 진짜 달달구리 장난아니었어요.ㅋㅋ
맛있습니다. 당떨어질때 한잔!
그리고 개인적으로 번초콜릿은 차갑게 말고 따뜻하게 마시는게 더 맛있는 것 같아요.",2024-04-07 - 22:28:34
4082,naver,43,카펫,"서울 마포구 동교로9길 72 1,2층",, 902,미소천사지니,2.14.수,발렌타인데이라 달달한 🍫가 들어간 음료가 먹고파 일부러 검색해 찾아 갔어요. 주차는 망원1동주민센터 공영주차장에 했구요. 걸러서 5분이면 도착해요^^ 진짜 망원동은 카페며 맛집이며 소품샵이며 망원시장까지 즐길거리 먹거리가 많아 가도가도 너무너무 좋아요!^^ 동네 산책하는 것도 진심 너무 즐겁고요^^ 오늘은 아이들 데리고 밤마실 다녀왔네요. 마감 1시간 전쯤 가서 남은 디저트 종류별로 다 달라고 했네요^^;; 핫초코와 아이스초코도 맛보고요. 담엔 다른 메뉴들 맛보러 또 가야겠어요🥰😍 인상도 좋고 친절하신 젊은 직원분? 사장님? 너무 감사했어요. 제가 2층에 자리 잡았는데 직접 가져다 주셔서 감동 받았어요🤩😘 제가 좀 많이 주문해 2번이나 오르락내리락^^;; 집에 가는 길도 환히 웃으며 인사해 주셨네요.또갈게요,2024-04-07 - 22:28:34
4083,naver,43,카펫,"서울 마포구 동교로9길 72 1,2층",, 902,Matzipjoa,3.26.화,"1층 만석이라 2층갔는데 2층과 1층의 분위기가 다르더라구요, 인테리어가 톡톡 튀는 컬러플한 느낌이였고, 마시맬로우번 초코(달콤)랑 패션후르츠에이드 둘 다 맛있었어요,",2024-04-07 - 22:28:34
4084,naver,43,카펫,"서울 마포구 동교로9길 72 1,2층",, 902,비타밍밍,1.21.일,"초콜릿음료 맛집! 앙버터 맛집! 분위기맛집!
조용한 분위기와 음악도 좋아서 대화 나누기 편하다.
초콜렛 위에 마시멜로크림 진짜 망원 카펫에서만 먹을 수 있는 맛😍😍 마시멜로 평소에 안먹는데 여기선 안남기고 다먹음. 앙버터도 빵 촉촉하고 양도 둘이 먹기 적당해서 딱 맛있게 먹을 수 있음. 망원카페투어 꼭 방문해보길.",2024-04-07 - 22:28:34
4085,naver,43,카펫,"서울 마포구 동교로9길 72 1,2층",, 902,YEAHGC,1.21.일,저녁 먹고 돌아다니다 분위기 좋아보여서 들어갔는데 아늑하면서 힙한 분위기가 마음에 들었고 무엇보다 커피가 넘 맛있어요! 디카페인이 있어서 마음 놓고 주문했는데 라떼는 적당히 진하고 꼬숩고~ 아인슈페너는 위에 크림이 땅콩맛이 나는게 취저였습니다! 직원분도 친절해서 좋았어요!,2024-04-07 - 22:28:34
4086,naver,43,카펫,"서울 마포구 동교로9길 72 1,2층",, 902,샴비,2.28.수,"ᴍ ᴇ ɴ ᴜ 후르츠산도(4000₩) + 번모카(6500₩) + 번초콜릿(6500₩) /
음료 위에 마시멜로우가 올라가있는데 진짜 달달쫀득하고 맛있어요!
그리고 후르츠산도가 진짜 맛있었습니다!! 빵이 진짜 적당히 쫀득하고 맛있어요.. 크림도 너무 달지 않아서 좋았어요~~~
매장 아늑하고 분위기 좋아요",2024-04-07 - 22:28:34
