,Platform,Number,Store,Address,Review_score,Review_counts,ID,Date,Review_text,Time
2523,naver,27,후와후와,서울 마포구 월드컵로13길 79 1층 후와후와,, 242,hizhazhoz,1.24.수,"피스타치오 소보루빵, 흑임자인절미쫀득빵 사고 싶었는데 평일 14시 경 솔드아웃이여서 1개 남은 피스타치오 쫀득빵 겟했습니다 🍀",2024-04-07 - 21:37:49
2524,naver,27,후와후와,서울 마포구 월드컵로13길 79 1층 후와후와,, 242,문더콜리,1.21.일,"그 유명한 샌드베이글 접한날!!!!!!
웨이팅은 아주 조금 했어요. 
사실, 샌드베이글 고민하다 친구가 사서 나눠먹었는데
크림 맛있어요!!! (크림 싫어하는데도 호!)
과일이 그냥 통으로 들어가욬ㅋㅋㅋㅋ 안자름ㅋㅋㅋ 바나나1/2 파인애플1/2등 ㅋㅋㅋ 그냥 진짜 과일가게 인줄!! 과일 좋아해서 정말 정말 호에요 
단,,,,, ㅋㅋㅋㅋ 빵 피가 ㅋㅋㅋㅋ 안익은 호빵 같아욬ㅋㅋㅋㅋㅋㅋㅋㅋㅋ 크림 싫어하는 빵순인데 과일에 반하고 갑니다!

•로띠번 소금빵 꼭 사세요. 이게 바로 후와후와가는이유 필수메뉴입니다. 에프180도 4분. 진정한 로띠번을 만날수 있어요.",2024-04-07 - 21:37:49
2525,naver,27,후와후와,서울 마포구 월드컵로13길 79 1층 후와후와,, 242,콘 치,23.12.22.금,"망원동 샌드베이글맛집 후와후와
✯¸.•´*¨`*•★★•*`¨*`•.¸✯
주말 늦은 시간 방문해서 품절 제품이 많았지만 피스타치오 밤 샌드를 구입해왔어요 예상보다 더 베이글이 쫀득하고 피스타치오 크림이 고소해요. 야끼소바빵은 야끼소바 양념이 조금 부족해서 아쉬워요.",2024-04-07 - 21:37:49
2526,naver,27,후와후와,서울 마포구 월드컵로13길 79 1층 후와후와,, 242,얄리얄라,23.12.27.수,정말정말 작은 내부라 얼른 사서 나와야해요!!ㅋㅋ역주행 불가능ㅋㅋㅋㅋ귀엽! 소금빵안에 크림이 아주 가득 넣어져있어 입터지게 맛나게 잘먹었어요,2024-04-07 - 21:37:49
2527,naver,27,후와후와,서울 마포구 월드컵로13길 79 1층 후와후와,, 242,lovely girl77,3.12.화,소금빵 종류도 다양하고 맛있어요,2024-04-07 - 21:37:49
2528,naver,27,후와후와,서울 마포구 월드컵로13길 79 1층 후와후와,, 242,누누uu,2.20.화,"구황작물 콩팥 샌드! 이름처럼 구황작물+콩+팥이 와다다 박혀있어서 넘 든든하고 맛잇게 먹엇어용,, 베이글 빵피도 JMT…",2024-04-07 - 21:37:49
2529,naver,27,후와후와,서울 마포구 월드컵로13길 79 1층 후와후와,, 242,gov****,2.29.목,웨이팅이 길었어요 오픈하고나서도 시간이 걸리는 빵도 있어서 매장에서 대기하다가 구매했습니다! 빵은 맛있어요,2024-04-07 - 21:37:49
2530,naver,27,후와후와,서울 마포구 월드컵로13길 79 1층 후와후와,, 242,수우우웅,1.24.수,"이번 서울 여행 최애 빵집입니다ㅠㅠㅠ
베이글은 물론 모든 빵피가 냉장 보관해도 쫀득하고 너무 맛있어요ㅠㅠㅠㅠㅠ

12:30분쯤에 갔는데 15분쯤 기다렸다 들어갔오요",2024-04-07 - 21:37:49
2531,naver,27,후와후와,서울 마포구 월드컵로13길 79 1층 후와후와,, 242,Psalm147,2.4.일,"주말 웨이팅 심함.. 포장만 가능하지만 매장이 작아 두팀씩만 입장 가능!
소금빵 종류 다양하지만 역시 오리지널 소금빵이 진리!!소보로 팥빵은 빵피 얇고 쫀득하지만 당도가 너무 없어서 나랑은 안 맞음ㅠㅜ",2024-04-07 - 21:37:49
2532,naver,27,후와후와,서울 마포구 월드컵로13길 79 1층 후와후와,, 242,맛집주접이,1.12.금,"왠만하면 이런 리뷰 잘 안쓰는데 정말 아쉬웠습니다.. 오픈후에도 오픈 준비가 안되셨는지 샌드를 주문할때마다 샌드가 만들어지는 족족 주방과 카운터를 왔다갔다 하시면서 갖다주시느라 제 앞에 4팀이 30분 정도 소요됐고 중간에 새치기 하시는 분도 있었는데 아무 제지도 없었습니다.
제 앞에 몇분한테는 오래 기다리셨다면서 시식용 빵을 잘라주셨는데 저를 포함한 다른 몇분은 안주시는것도 좀 기분이 그랬구요. 시식용 그 쪼만한거 얼마나 된다고 하실수도 있지만 저도 오래 기다린 고객입니다. 
또 오픈 후 30분 후부터 새로 나오는 빵 종류가 있어서 오픈런 한 사람한테 오히려 불리할거같구요.
저뿐 아니라 그당시 서있던 모든 분들이 이 비효율에 대해 아쉬워하셨는데 이건 비난이 아니라 비판으로 받아들여주셨음 합니다",2024-04-07 - 21:37:49
2533,naver,27,후와후와,서울 마포구 월드컵로13길 79 1층 후와후와,, 242,디록d,3.2.토,사람이 너무 많은데 매장이 좁아요ㅠㅠ 빵은 맛있어요!,2024-04-07 - 21:37:49
2534,naver,27,후와후와,서울 마포구 월드컵로13길 79 1층 후와후와,, 242,십삼월81,2.17.토,"빵은.. 맛있긴한데요, 1시간 반동안 대기해서 구매할 정돈 아닌거같구요. 빵 고르는데 시간은 별로 안걸리 는데 계산하고 포장하는데 오래걸리더라구요. ...",2024-04-07 - 21:37:49
2535,naver,27,후와후와,서울 마포구 월드컵로13길 79 1층 후와후와,, 242,ekdus358022,3.2.토,처음에 오픈했을 당시는 사람이 별로 없었는데 입소문이 났는지 요새 웨이팅 해야만 할 수 있더라구요! 저는 크림빵보단 기본 베이글이 맛있었어오!!,2024-04-07 - 21:37:49
2536,naver,27,후와후와,서울 마포구 월드컵로13길 79 1층 후와후와,, 242,kz****,3.7.목,"난 기다리는 거 좋아한다 추천입니다.
빵 맛있지만 30분이상 기다리면서
먹을만한 빵인지는 ....

친절하세요~",2024-04-07 - 21:37:49
2537,naver,27,후와후와,서울 마포구 월드컵로13길 79 1층 후와후와,, 242,행복은욘복,1.19.금,"매장이 협소해서 쪼금 기다렸다가 들어가야해요
직원분이 친절해서 기분 좋았어요‼️‼️‼️ 소금빵도 종류별로 있는데 제가 방문했을땐 거의 다 나간거 같았어요 그래도 원하던 야끼소바빵을 구매할 수 있어서 기분 좋았습니다 🩷🩷",2024-04-07 - 21:37:49
2538,naver,27,후와후와,서울 마포구 월드컵로13길 79 1층 후와후와,, 242,as****,2.14.수,너므 맛있어요ㅠㅠㅠㅠ 망원동에 빵집 많은데 여기 소금빵이랑 소보쫀득빵 존맛🫶,2024-04-07 - 21:37:49
2539,naver,27,후와후와,서울 마포구 월드컵로13길 79 1층 후와후와,, 242,꿈꾸는 마녀,1.25.목,"피스타치오 밤샌드. 황치즈 쫀득빵. 맘모스 소보루. 군고구마 식빵 구매

빵피도 쫀득하고 크림도 듬뿍 들어 아주 맛있는 빵인데.. 살짝 물리는 맛이라 1/4개만 먹음 딱 좋은 듯",2024-04-07 - 21:37:49
2540,naver,27,후와후와,서울 마포구 월드컵로13길 79 1층 후와후와,, 242,승희쓰,1.25.목,벌써 몇번째 방문인건지😂😂 갈 때마다 너무 너무 맛있는 거 같아요🥹🥹❤️,2024-04-07 - 21:37:49
2541,naver,27,후와후와,서울 마포구 월드컵로13길 79 1층 후와후와,, 242,jul****,3.18.월,"많은 리뷰들이 있는데 저는 맛있게
먹었어요",2024-04-07 - 21:37:49
2542,naver,27,후와후와,서울 마포구 월드컵로13길 79 1층 후와후와,, 242,bla****,2.4.일,"일단 빵은 맛있어서 재방문만 3번 근데 그거랑 별개로 항상 느끼는 불편함. 멀리서 가기 때문에 먹고싶은빵이 있어도 라인업은 매번 바껴서 인스타에 라인업 공지 올린걸 보고 방문할지 말지 정해야되는데 규칙성없이 올라오는 라인업. 문의를해도 답 안해줌. 빵 예약은 평일 주말 시간에따라서 가능하다면서, 답도 안해주면서 예약은 어떠케 하라는건지.. 결국 아침 오픈 50분 전부터 가서 웨이팅했는데 오픈시간 되도 준비는 덜 되어있고 빵도 세팅이 안되어잇음.. 그럼 아침부터 오픈런한 사람들은 결국 손해.. 여러모러 속상하고 관리가 미흡하다고 방문할때마다 느낌...",2024-04-07 - 21:37:49
2543,naver,27,후와후와,서울 마포구 월드컵로13길 79 1층 후와후와,, 242,x0x82,2.9.금,"진짜 맛있는데요...? 소금빵은 안 샀는데 야끼소바 소금빵 먹으니까 소금빵 안 사온 거 후회함 ㅜ
공휴일에 11시 40분쯤 가서 12시 50분쯤 입장했어요
웨이팅 너무 빡세지만 그만큼 맛나요",2024-04-07 - 21:37:49
2544,naver,27,후와후와,서울 마포구 월드컵로13길 79 1층 후와후와,, 242,je8****,2.16.금,"딸기피스타치오.밤피스타치오 맛있게 먹었는데,체리
는 아쉬웠어요 체리크림.피스타치오크림만 들은게아
니라 크림치즈도 들어가있어서 이맛도저맛도 ...",2024-04-07 - 21:37:49
2545,naver,27,후와후와,서울 마포구 월드컵로13길 79 1층 후와후와,, 242,리지안,2.24.토,너무너무 추운 날 1시간 가까이 웨이팅 하고 들어갔어요. 빵 가격이 엄청 비싸요. 그래도 빵이 쫄깃하고 재료가 신선해서 좋아요.,2024-04-07 - 21:37:49
2546,naver,27,후와후와,서울 마포구 월드컵로13길 79 1층 후와후와,, 242,내경맘20,4.6.토,기다리는거 힘들었지만 특별한 메뉴들이 있어 감수요~,2024-04-07 - 21:37:50
2547,naver,27,후와후와,서울 마포구 월드컵로13길 79 1층 후와후와,, 242,료잇,2.21.수,"🌟🌟순우유크림소금빵 🌟🌟무화과베이글 🌟🌟
🌟고구마카스테라소금빵 🌟오징어먹물치즈빵",2024-04-07 - 21:37:50
2548,naver,27,후와후와,서울 마포구 월드컵로13길 79 1층 후와후와,, 242,zxc0987,2.28.수,생각보다 더 맛있었어요👍🏻 사장님도 친절하셔요💗,2024-04-07 - 21:37:50
2549,naver,27,후와후와,서울 마포구 월드컵로13길 79 1층 후와후와,, 242,아이리스094,3.18.월,빵안이 꽉차있고 맛있어여,2024-04-07 - 21:37:50
2550,naver,27,후와후와,서울 마포구 월드컵로13길 79 1층 후와후와,, 242,Dd48,1.31.수,좀비싸지만 피스타치오딸기샌드 추천!!!! 빵피 쫜득하 고 딸기도 많이 들어있어서 맛있게 먹었어요 재구매 각💗 황른이로써 황치즈소금빵은 비건 두부크...,2024-04-07 - 21:37:50
2551,naver,27,후와후와,서울 마포구 월드컵로13길 79 1층 후와후와,, 242,ehu****,2.8.목,대기가 옴총 길어요! 한번쯤 가볼만합니당,2024-04-07 - 21:37:50
2552,naver,27,후와후와,서울 마포구 월드컵로13길 79 1층 후와후와,, 242,고급안빵97,3.1.금,매장은 작지만 구성도 다양하고 빵이 정말 맛있어요,2024-04-07 - 21:37:50
2553,naver,27,후와후와,서울 마포구 월드컵로13길 79 1층 후와후와,, 242,Hi jay,2.17.토,"매장 작고 회전률이 너무 낮아서 대기시간 길어요. 쪽
득빵 구매했는데 생각보다 빵 가격이 비싼편이고 당
도가 높아요. 한번 먹어본걸로 만족!!",2024-04-07 - 21:37:50
2554,naver,27,후와후와,서울 마포구 월드컵로13길 79 1층 후와후와,, 242,lovely girl77,3.15.금,맛있어요 추천합니다 굳,2024-04-07 - 21:37:50
2555,naver,27,후와후와,서울 마포구 월드컵로13길 79 1층 후와후와,, 242,dbr****,2.18.일,소금빵맛집 !! 😋,2024-04-07 - 21:37:50
2556,naver,27,후와후와,서울 마포구 월드컵로13길 79 1층 후와후와,, 242,수수한녹차,23.12.29.금,"소금빵베이글이 맛있었어요
소금빵은.. 성수동 르셀을 못 이기지만ㅠ 특이한 소금빵들이 많아서 맛있긴 했어요",2024-04-07 - 21:37:50
2557,naver,27,후와후와,서울 마포구 월드컵로13길 79 1층 후와후와,, 242,천유나,23.12.28.목,사진이 없어서 아쉬운데 가게 인테리어도 너무 예쁘고. 살면서 먹어본 소금빵 중에 제일 맛있었어요! 하루 동안 실온 보관하고 에어 프라이기에 살짝 돌려서 먹어봤는데 딱딱하지도 않고 막 구운 것처럼 버터 풍미도 진하고 너무 맛있었습니다. 기본 소금 빵 하나만 사 온 게 너무 아쉬울정도로요.ㅎㅎ 다음에 망원동 들리면 항상 포장해 올 것 같아요.,2024-04-07 - 21:37:50
2558,naver,27,후와후와,서울 마포구 월드컵로13길 79 1층 후와후와,, 242,폰86,2.7.수,소보로 맛잇어용,2024-04-07 - 21:37:50
2559,naver,27,후와후와,서울 마포구 월드컵로13길 79 1층 후와후와,, 242,mul****,3.26.화,피스타치오밤~ 크림이 엄청 가득이라 맛있게 먹다 조금 느끼해지지만 색다른 맛이었어용!,2024-04-07 - 21:37:50
2560,naver,27,후와후와,서울 마포구 월드컵로13길 79 1층 후와후와,, 242,이우연20,2.1.목,"작년 오픈했을때부터 자주갔는데 작년말부터 대기가 생기더니 이제 먹고싶어도 쉽게 먹을수가 없어서 아쉬워요
집근처인데 팝업땜에 영업안해서 몇년만에 강남가서 사먹었어요ㅎㅎ",2024-04-07 - 21:37:50
2561,naver,27,후와후와,서울 마포구 월드컵로13길 79 1층 후와후와,, 242,징으닝,23.11.25.토,소금빵 좋아하는데 맛있어요! 추천해용,2024-04-07 - 21:37:50
2562,naver,27,후와후와,서울 마포구 월드컵로13길 79 1층 후와후와,, 242,김찐빵순이,23.12.15.금,"피스타치오 쫀득빵 먹었는데 빵피 완전 쫀득하고 피스타치오 원물맛이 잘 나요
근데 다른집 크림치즈 쫀득빵보다 크림치즈력이 강해서 약간 체다치즈 먹는듯한 느낌이였어요
황치즈 같은거 좋아하시는분들은 좋아하실것 같아요!",2024-04-07 - 21:37:50
2563,naver,27,후와후와,서울 마포구 월드컵로13길 79 1층 후와후와,, 242,ocean1109,23.11.12.일,"직원분들도 친절하시구 빵도 너무 맛있어요!!!
자주 와서 사갈거에요...전메뉴 뿌시기 도전....",2024-04-07 - 21:37:50
2564,naver,27,후와후와,서울 마포구 월드컵로13길 79 1층 후와후와,, 242,ka****,2.3.토,"빵과 커피 맛있고
분위기도 좋네요",2024-04-07 - 21:37:50
2565,naver,27,후와후와,서울 마포구 월드컵로13길 79 1층 후와후와,, 242,아리283,2.2.금,항상 줄이라 운좋게 먹었는데 맛있어요.소금빵 베이글 종류 무지 많음.,2024-04-07 - 21:37:50
2566,naver,27,후와후와,서울 마포구 월드컵로13길 79 1층 후와후와,, 242,아리283,2.22.목,소금빵 맛있어요,2024-04-07 - 21:37:50
2567,naver,27,후와후와,서울 마포구 월드컵로13길 79 1층 후와후와,, 242,연보라27,2.22.목,쫀득빵 소금빵 존맛,2024-04-07 - 21:37:50
2568,naver,27,후와후와,서울 마포구 월드컵로13길 79 1층 후와후와,, 242,김항구,2.27.화,순우유소금빵 1순위 추천드립니다 직원분들도 친절하셔유,2024-04-07 - 21:37:50
2569,naver,27,후와후와,서울 마포구 월드컵로13길 79 1층 후와후와,, 242,동그래미잉,1.28.일,빵 종류가 많고 달달하니 맛있어요! 매주 가서 메뉴 도장깨기 중입니다.!,2024-04-07 - 21:37:50
2570,naver,28,합정 지튼,서울 마포구 양화로11길 42 1층,, 773,계리계리,3.6.수,"아아메 딱 무난하게 맛있고
(끝도 없이 들어가는 맛 아시죠 ㅋ)
황티즈 갸또랑 에그타르트도 맛있었어요✨

생각치도못한 에그타르트가 너무 맛있어서
지금 마이플레이스쓰면서
다시 먹고싶어졌음;;ㅋㅋㅋㅋㅋ

너무 좁지도 넓지도 않고
다닥다닥붙지도 않아서 좋음
게다가 화장실도 내부에 있습니다ㄷ ㄷ짱

편하게 방문하기 좋은 카페로
추천드려요👏🏻",2024-04-07 - 21:41:20
2571,naver,28,합정 지튼,서울 마포구 양화로11길 42 1층,, 773,Cho0,2.24.토,"분위기 커피랑 디저트 맛 모두 좋은 카페였어요.
디카페인 드립커피가 있어서 저녁에 커피 타임 갖기에도 좋았네요. 치즈케이크랑 초코쿠키 모두 특색있는 맛이라 멀리서 온 친구 데리고 갔는데 흡족했어요",2024-04-07 - 21:41:20
2572,naver,28,합정 지튼,서울 마포구 양화로11길 42 1층,, 773,쭈기넙,2.3.토,에그타르트 겉바속촉촉 지대로네요ㅎㅎ 계란비린내도 안나구 JMT이에요🩵 에그타르트랑 인절미갸또 먹어봤는데 인절미갸또는 콩고물 고순맛 낭낭해서 커피랑 완전 잘 어울려요!! 위에 올라간 인절미 크림이 많이 달지 않아서 더 좋은 거 같아요! 브루드 커피 콜롬비아 라카바나 주문했는데 산미 맛 느껴지는 엄청 깔끔한 맛이네요. 인절미 갸또랑 에그타르트랑 꿀조합👍👍,2024-04-07 - 21:41:20
2573,naver,28,합정 지튼,서울 마포구 양화로11길 42 1층,, 773,도옹다,1.19.금,"황치즈 케이크 너무 먹어보고 싶어서 왔어요.
폭신한 식감에 황치즈 맛이 아주 찐~하네요😋
산미가 적고 다크한 과테말라 브루잉이랑 함께 먹으니 딱 좋아요.
밀크티도 베르가못 향이 잘 느껴져서 맛있었어요!",2024-04-07 - 21:41:20
2574,naver,28,합정 지튼,서울 마포구 양화로11길 42 1층,, 773,레몬파운드70,2.25.일,디저트랑 음료 너무 맛있었습니다! 특히 초코케이크가 맛있었고 갸또 스타일의 꾸덕한 케이크를 즐길 수 있어서 좋았습니다. 합정역 케이크 드시고 싶으신 분들 방문해 보세용,2024-04-07 - 21:41:20
2575,naver,28,합정 지튼,서울 마포구 양화로11길 42 1층,, 773,하낫츠,2.15.목,에그타르트 맛집이라고 해서 포장하러 들렸어요. 에그 타르트 추천추천!! 일단 에그타르트는 다른 가게들보다 크기가 더 커요. 큰데 맛도 있어서 너무 좋았어요ㅎㅎ 에그 타르트 말고도 다른 디저트들도 너무 맛있어 보여서 나중에 다른것도 먹으러 가보고싶어요:),2024-04-07 - 21:41:20
2576,naver,28,합정 지튼,서울 마포구 양화로11길 42 1층,, 773,sar****,3.20.수,"황치즈케이크 추천추천 입니다.
크림도 너무 달지않게 꾸덕해서 맛있고 시트도 촉촉해서 정말 맛있게 먹었어요 :)
다음엔 초코케이크 먹으러 가려구요!",2024-04-07 - 21:41:20
2577,naver,28,합정 지튼,서울 마포구 양화로11길 42 1층,, 773,Erin Park0415,1.31.수,황치즈갸토 완전 맛있고 인테리어도 깔끔해요 :) 커피도 맛있어서 또 들를 것 같아요!,2024-04-07 - 21:41:20
2578,naver,28,합정 지튼,서울 마포구 양화로11길 42 1층,, 773,해삐쮸20,23.11.24.금,"합정에 주차되는 카페 넘 좋아요>< 요기 분위기도 좋고, 디저트 종류도 다양해서 좋네요! 황치즈케이크 완전 맛있어요🥹💟 뽀또맛좋아하시는분들 완전 취저일듯요!! 초코스모어쿠키도 달달하고 쫀득한 스모어가 맛있어요~! 에그타르트안에 필링 정말 부드럽고 바닐라향가득해요! 밀크티랑 갓파더 마셨는데 갓파더 짱맛도리..크림이랑 커피랑 조화가 정말 좋았어요~ 합정카페로 추천할게요!!✨디저트맛집!",2024-04-07 - 21:41:20
2579,naver,28,합정 지튼,서울 마포구 양화로11길 42 1층,, 773,현디옹,2.4.일,편하게 집중해서 볼일을 끝낼 수 있었던 집중하기 좋은 카페였어요~! 디저트도 맛있고 커피도 맛있어요!🧡🩷,2024-04-07 - 21:41:20
2580,naver,28,합정 지튼,서울 마포구 양화로11길 42 1층,, 773,초채,1.9.화,"주변에 맛집이 정말 많은데, 다녀오고 카페는 꼭 지튼으로 오는 것 같아요 ㅎㅎ 조용하기도 하고 음료도 맛있어서 방문합니다~",2024-04-07 - 21:41:20
2581,naver,28,합정 지튼,서울 마포구 양화로11길 42 1층,, 773,K지은,23.10.28.토,"낮에 햇살 들어올 때 창가 자리 앉으면 좋아요!
디저트도 맛있고 커피도 맛있는데, 저 자리 앉아서 먹으면 10배 더 맛있어지는 매직ㅋㅋㅋㅋ
인절미 케이크 너무 달지 않아 좋았고, 에그 타르트는 겉바속촉 제대로라 하나 더 먹을뻔 한 건 안 비밀ㅋㅋ
데이트로 가기 딱 좋은 카페 입니당 ><",2024-04-07 - 21:41:20
2582,naver,28,합정 지튼,서울 마포구 양화로11길 42 1층,, 773,Joso12,2.28.수,"주차가능해서 방문했는데
분위기 좋아요 ^^",2024-04-07 - 21:41:20
2583,naver,28,합정 지튼,서울 마포구 양화로11길 42 1층,, 773,사진찍는또영,23.12.1.금,합정역 카페를 찾아보던 도중에 분위기 좋은 카페가 있어서 친구랑 같이 방문했습니다!! 디저트도 직접 만드셔서 더 맛있더라고요 커피도 맛있어요😊😊,2024-04-07 - 21:41:20
2584,naver,28,합정 지튼,서울 마포구 양화로11길 42 1층,, 773,낭숭이,23.12.3.일,"황치즈 꾸덕하고 많이 안달아서 맛있게 먹었어요~다른것들도 다 맛있어보이더라구요!!
커피도 좋았고 사람 정말 많았어요",2024-04-07 - 21:41:20
2585,naver,28,합정 지튼,서울 마포구 양화로11길 42 1층,, 773,맛집교수,2.3.토,분위기도 좋고 디저트도 맛있고 음료도 맛있어용 🩷,2024-04-07 - 21:41:20
2586,naver,28,합정 지튼,서울 마포구 양화로11길 42 1층,, 773,뿅뿅3,23.11.8.수,"분위기 너무 좋고 
디저트 진짜진짜 맛있어요 !! 
분위기가 좋으니 데이트
코스로 너무너무 좋습니다 ❤️
특히 케이크 너무 맛나용! :)",2024-04-07 - 21:41:20
2587,naver,28,합정 지튼,서울 마포구 양화로11길 42 1층,, 773,레드존36,1.28.일,"인테리어가 이쁘고 
디저트가 맛있습니다",2024-04-07 - 21:41:20
2588,naver,28,합정 지튼,서울 마포구 양화로11길 42 1층,, 773,빵빠리빵,1.29.월,커피가 맛있었어요. 화장실이 작아서 아쉬웠습니다,2024-04-07 - 21:41:20
2589,naver,28,합정 지튼,서울 마포구 양화로11길 42 1층,, 773,MSPark52,3.25.월,맛있어요.,2024-04-07 - 21:41:20
2590,naver,28,합정 지튼,서울 마포구 양화로11길 42 1층,, 773,갱이2232,23.9.1.금,까눌레 넘 눔 쫀쫀하구 황치즈케이크 황치즈 그잡체!!!!! 플랫화이트 비율도 너무 좋구 밀크티는 달달한 밀크티였어요 ☕️❤️ 내부 분위기도 넘 좋구 조용해서 다음엔 저녁에 아메리카노에 스콘 먹으러 가보고싶어요! 잘먹었습니당~,2024-04-07 - 21:41:20
2591,naver,28,합정 지튼,서울 마포구 양화로11길 42 1층,, 773,다니1,23.8.19.토,"황치즈랑 에그타르트 너무 맛있었어요!
수제바닐라랑 모히또샤워도 딱 제 스타일이었구요>.<
내부도 깔끔하고 벽면이 특이해서 사진찍기도 좋은곳이었어요~ 주말에 방문했는데 손님이 많아서 웨이팅이 좀 있더라구요
합정디저트맛집으로 유명한것같습니다 ㅎㅎ
황치즈랑 에그타르트 꼭 드셔보세요 👍🏻👍🏻",2024-04-07 - 21:41:20
2592,naver,28,합정 지튼,서울 마포구 양화로11길 42 1층,, 773,먹짱일인자,1.18.목,"디저트 메뉴 익히 유명한 건 알았는데 ㅎㄷㄷㄷㄷㄷ 
까눌레 진짜 존맛탱입니다 완전 추천이에요!!!!!!!!!!! ㅜ
ㅜ사장님도 너무 친절하시고 좋아요",2024-04-07 - 21:41:21
2593,naver,28,합정 지튼,서울 마포구 양화로11길 42 1층,, 773,NINA74,23.10.4.수,몇년째 합정역 근처 디저트 맛집 자리를 지키는 있는곳. 합정 들릴때마다 생각나는 곳이에요. 원두 로스팅이 딱 제 입맛에 맞습니다. 향미 풍부해요. 디저트는 말해뭐합니까 ㅎㅎㅎ 에그타르트 맛있어요👍,2024-04-07 - 21:41:21
2594,naver,28,합정 지튼,서울 마포구 양화로11길 42 1층,, 773,미친치와와,23.12.26.화,커피 디저트 다 너무 맛있어요. 공간이 엄청 넓진 않지만 대화하기도 좋아요 !,2024-04-07 - 21:41:21
2595,naver,28,합정 지튼,서울 마포구 양화로11길 42 1층,, 773,라라블라41,3.23.토,,2024-04-07 - 21:41:21
2596,naver,28,합정 지튼,서울 마포구 양화로11길 42 1층,, 773,line3373,23.12.18.월,"합정 까눌레 맛집이에요
커피랑 밀크티도 맛있어요👍",2024-04-07 - 21:41:21
2597,naver,28,합정 지튼,서울 마포구 양화로11길 42 1층,, 773,리뷰잘남긴당,23.8.25.금,사장님께서 너무 친절하시고 밀크티랑 황치즈케익이 진짜 JMT이네요..자몽 음료도 넘 맛있고 초코케익도 꾸덕하니 맛도리에요!! 강추합니당🤎,2024-04-07 - 21:41:21
2598,naver,28,합정 지튼,서울 마포구 양화로11길 42 1층,, 773,hj2286,23.7.9.일,"합정동의 지튼 카페에 가시면 갸또는 무조건 드셔야해요 !!!! 전에는 흑임자도 팔았던거같은데 지금은 흑임자는없고 인절미와 마틸다, 황치즈가 있더라구요 ! 마틸다는 찐 다크초코갸또인데 과하게 달지않아서 정말 맛있었고 중간에 살짝 체리같은 상큼한게 씹히는게 킥이었어요 ! 달지않은 다크초코갸또 좋아하시는뷴은 여기서 마틸다 케이크 추천드려요 ! 여기 핸드드립도 잘하더라구요. 저는 브라질로 주문했는데 진짜 포도같은 상큼한 과일향이 나서 신기했어요. 분위기도 좋고 카페도 넓어서 추천드립니다 !",2024-04-07 - 21:41:21
2599,naver,28,합정 지튼,서울 마포구 양화로11길 42 1층,, 773,재은1219,2.29.목,황치즈 🧡,2024-04-07 - 21:41:21
