,Platform,Number,Store,Address,Review_score,Review_counts,ID,Date,Review_text,Time
1131,naver,13,공미학 마포홍대점,서울 마포구 양화로 162 카카오프렌즈 3층, 4.59," 1,793",깔깔모니52,2.23.금,"카카오 프렌즈 샵 내부에 있는? 연결되어 있는? 카페라 외국인 손님을 타겟으로 한 것 같지만 의외로 한국인들이 많았음

평일 점심 기준으로 붐비지 않아 시끄럽지 않은 매장 분위기여서 만족스러웠음

(아마도) 예상 고객층을 위한 소나무나 돌 길, 나무 상/의자 등을 이용한 한국적 인테리어가 인상적이었음
사진 찍을 곳을 마련해줘서 사진 찍기도 좋을 듯

홍대라는 위치를 감안했을 때도, 요즘 카페 물가를 생각했을 때도 가격이 비싸지 않았음(어쩌면 요즘 카페 음료 가격이 지나치게 비싼 것일 수도)

개인적으로는 카카오프렌즈샵이랑 이어져있어서 카페에 온 것보다는 프렌즈샵에 온 느낌이라 조금 아쉬웠음",2024-04-07 - 20:52:55
1132,naver,13,공미학 마포홍대점,서울 마포구 양화로 162 카카오프렌즈 3층, 4.59," 1,793",nah****,2.22.목,분위기 좋고 디저트 맛있어요❤️ 떡 올려진 시그니처 음료는 생긴것도 귀엽고 고소하니 맛있네용🥰매장 규모도 넓고 은근 조용해서 대화 나누기에도 좋아용,2024-04-07 - 20:52:55
1133,naver,13,공미학 마포홍대점,서울 마포구 양화로 162 카카오프렌즈 3층, 4.59," 1,793",비밀9767,2.18.일,춘식이가 먹는 맛난 고구마에용 ㅎㅎ 어떤맛인지 너무 궁금하졍! 한번 오셔서 춘식이가 좋아하는 고구마 먹어봐용,2024-04-07 - 20:52:55
1134,naver,13,공미학 마포홍대점,서울 마포구 양화로 162 카카오프렌즈 3층, 4.59," 1,793",우아한 장금씨,23.11.8.수,"한국적 공간미에 흠뻑 취하는 카페 공미학이에요❤️

마시고 싶은 음료가 많아 고민하다가 추천받아 고른 시그니처 음료 마포의 미학(7.8)은 마가루, 참깨가루가 블렌딩된 친환경 쑥라떼로 많이 달지 않고 건강한 맛이라 만족스러웠고, 공미학의 공간미와도 잘 어울렸어요^^
기발하고 재밌어서 웃음 나온 돼지바(3.9)는 또 먹고 싶을 정도로 맛있는 건 아니지만 재미삼아 먹기에도 충분히 좋았어요^^

홍대 카카오프렌즈 3층에 있어서 그런지, 카카오프렌즈와는 다른 반전미까지 있어 더욱 감동적인 것 같아요 ㅎㅎ
넓은 공간 속 곳곳의 다양한 아름다움에 감탄사 연발했고요, 여기저기 사진찍으며 완전 행복했답니다~ ㅠㅠ

공간이 주는 아름다움을 좋아하시는 분들 꼭 한번 가보시길 추천드려요^^",2024-04-07 - 20:52:55
1135,naver,13,공미학 마포홍대점,서울 마포구 양화로 162 카카오프렌즈 3층, 4.59," 1,793",아나바다 쓩쓩,23.11.30.목,"칭구들과 털래기수제비를 먹고 차를마시자고 몇군데둘러보다가 볼게 많을것같아 들어간곳
공미학?왜 공미학이지,하면서 들어간곳. 
카카오 프렌즈 인형들과 선물꾸러미들 우리아이들이 좋아할만한 카카오...
 사람이 너무많아 구경도 못하고
 3층베이커리카페로 무조건 올라가야했어요
넓은카페..단체석도 있고
속이시원하게 좋으네요 
인테리어도좋고 분위기도 
좋습니다",2024-04-07 - 20:52:55
1136,naver,13,공미학 마포홍대점,서울 마포구 양화로 162 카카오프렌즈 3층, 4.59," 1,793",밍밍밍7097,1.28.일,"홍대인데 조용해서 좋았던 공미학
디저트 라인업이 엄청 다양해서 선택장애 와요..
옥수수 푸딩케이크 존맛
마포의미학도 넘 고소하고 떡은 쫄깃해서 넘 조아요
아메리카노 양도 많습니다 굿굿",2024-04-07 - 20:52:55
1137,naver,13,공미학 마포홍대점,서울 마포구 양화로 162 카카오프렌즈 3층, 4.59," 1,793",으컁컁슨두부,23.12.3.일,매장이 아주 넓고 카카오프렌즈샵 느낌이랑 완전 다르게 차분한 분위기! 카카오랑 콜라보라 다른 공미학에는 없던 콜라보 디저트가 있다! 디저트가 달달해서 2명이서 최대 2개 추천 좀 물림ㅋㅋㅋ 인테리어도 예쁘고 전반적으로 만족!,2024-04-07 - 20:52:55
1138,naver,13,공미학 마포홍대점,서울 마포구 양화로 162 카카오프렌즈 3층, 4.59," 1,793",cioledl,2.22.목,인테리어가 멋있고 음료도 맛있어요~,2024-04-07 - 20:52:55
1139,naver,13,공미학 마포홍대점,서울 마포구 양화로 162 카카오프렌즈 3층, 4.59," 1,793",미쯔루,1.12.금,"가보고 싶었던 카페인데 오전에 가니 여유있고 좋네요
동양미 넘치는 멋진 공간에 디저트도 인상적이네요
홍대입구역이랑 가까워서 접근성도 좋고요",2024-04-07 - 20:52:55
1140,naver,13,공미학 마포홍대점,서울 마포구 양화로 162 카카오프렌즈 3층, 4.59," 1,793",순덕821,1.2.화,"인터리어가 예쁘고 쾌적해요. 다양한 디저트가
있는데 예쁘고 맛도 좋아요. 따뜻하게 준비해주셔서 아이스아메리카노하고 맛있게 즐길 수 있었어요.",2024-04-07 - 20:52:55
1141,naver,13,공미학 마포홍대점,서울 마포구 양화로 162 카카오프렌즈 3층, 4.59," 1,793",비니비니비누,2.14.수,"카카오프렌즈 플래그십스토어에 갔다가 위층에 카페가있다고 해서 방문했습니당!
홍대입구역과 가까워서 좋고요 빵이 너무 맛있어요.
그러고 매장 인테리어가 예뻐요.
직원분들도 친절하시고 매장이 청결해요.
블루베리 크림치즈 치아바타 와 춘식이 고구마빵 은 강추입니다.",2024-04-07 - 20:52:55
1142,naver,13,공미학 마포홍대점,서울 마포구 양화로 162 카카오프렌즈 3층, 4.59," 1,793",뀨웅웅,2.27.화,"평일 저녁 남자직원 두분 일하실 때 방문했는데, 너무 불친절하세요. 올 때 갈 때 인사는 기대할 수도 없고 주문하려고 불러도 대답 없으시고 몇번은 불러야했어요. 그리고 주문할 때 한마디 없이 진동벨만 툭 건네시더라고요. 음료 나올 때도 그냥 음료만 툭 주셨어요. 그리고 인원수만큼 음료 주문하고 조금 지나 추가로 빵 주문 하려고 하니 이거 하나요? 하시더니 포크는 필요하겠죠? 라고 물어보시는거에요. 다신 재방문 안하고 싶어졌습니다. 너무 비싸고 맛없고 오래걸리고(아메리카노 하나조차도) 공간도 불편하고 불친절하고 재정비 하셔야 할 것 같아요. 실망했습니다.",2024-04-07 - 20:52:55
1143,naver,13,공미학 마포홍대점,서울 마포구 양화로 162 카카오프렌즈 3층, 4.59," 1,793",토끼가 화나면 무섭다,3.1.금,블루베리 푸딩? 케이크 너무 맛있었어요ㅠㅠㅠ 블루베리로 꽉차게 그릇에 있어서 먹으면서 행복 했어요!😍,2024-04-07 - 20:52:55
1144,naver,13,공미학 마포홍대점,서울 마포구 양화로 162 카카오프렌즈 3층, 4.59," 1,793",안또,1.13.토,"홍대입구카페 공미학 마포홍대점
분위기도 좋고 다양한 베이커리 특별한음료가 있어서 참~ 좋아요",2024-04-07 - 20:52:55
1145,naver,13,공미학 마포홍대점,서울 마포구 양화로 162 카카오프렌즈 3층, 4.59," 1,793",팡이0,1.6.토,"고구마빵과 할라피뇨 치아바타가 맛있어요 !!
좌석이 많이 비어있었는데도 디저트 관계없이 아이포함 1인1음료를 반드시 주문해야 홀이용을 할수있어서 포장해왔어요 집에와서 맛있게 먹었습니다 !",2024-04-07 - 20:52:55
1146,naver,13,공미학 마포홍대점,서울 마포구 양화로 162 카카오프렌즈 3층, 4.59," 1,793",침침81,1.28.일,오랜만에 나들이했는데 공미학 특유의 분위기가 역시 좋았어요:) 특히 마포의 미학 추천 추천!! 위에 꿀떡도 올라가서 든든하게 한잔 먹었어요😇,2024-04-07 - 20:52:55
1147,naver,13,공미학 마포홍대점,서울 마포구 양화로 162 카카오프렌즈 3층, 4.59," 1,793",diorissimo,3.10.일,"분위기 좋은 곳!
공미학만의 시그니처 메뉴는 그냥 구래요...ㅎㅋ",2024-04-07 - 20:52:55
1148,naver,13,공미학 마포홍대점,서울 마포구 양화로 162 카카오프렌즈 3층, 4.59," 1,793",susie s,23.10.29.일,카카오프렌즈 카페답게 디저트들이 귀엽고 예쁜데 맛 은... 빵 부분이 너무 퍽퍽했어요ㅠ 마포의 미학은 쑥 라떼인데 엄청 진하고 고소해요. 위에 토핑으...,2024-04-07 - 20:52:55
1149,naver,13,공미학 마포홍대점,서울 마포구 양화로 162 카카오프렌즈 3층, 4.59," 1,793",녹차라떼1,1.25.목,카페 분위기도 너무 좋고 디저트 맛집이고 너무 즐거운 시간을 보냈습니다 ㅎㅎ,2024-04-07 - 20:52:55
1150,naver,13,공미학 마포홍대점,서울 마포구 양화로 162 카카오프렌즈 3층, 4.59," 1,793",미스곽,2.28.수,초코케익 너무 맛있어요~~,2024-04-07 - 20:52:55
1151,naver,13,공미학 마포홍대점,서울 마포구 양화로 162 카카오프렌즈 3층, 4.59," 1,793",유닝87,1.17.수,디카페인커피도 있고 딸기라떼도 맛있어요,2024-04-07 - 20:52:55
1152,naver,13,공미학 마포홍대점,서울 마포구 양화로 162 카카오프렌즈 3층, 4.59," 1,793",멜론729,2.11.일,가게 분위기도 좋고 맛도 좋아요,2024-04-07 - 20:52:55
1153,naver,13,공미학 마포홍대점,서울 마포구 양화로 162 카카오프렌즈 3층, 4.59," 1,793",파니55,1.2.화,"맛은 조금 아쉬웠지만 분위기 편하고 좋아요.
당충전 제대로 했어요",2024-04-07 - 20:52:55
1154,naver,13,공미학 마포홍대점,서울 마포구 양화로 162 카카오프렌즈 3층, 4.59," 1,793",와랄라라,1.18.목,늦게까지 하는 곳 찾다가 막 들어왔는데 커피 넘 맛있어요. 디저트도 괜찮아요,2024-04-07 - 20:52:55
1155,naver,13,공미학 마포홍대점,서울 마포구 양화로 162 카카오프렌즈 3층, 4.59," 1,793",dltmdqls,1.10.수,"공간도 꽤 넓고 시끌시끌하지 않아서 좋았어요. 
분위기 좋고 음료 맛있어요.",2024-04-07 - 20:52:55
1156,naver,13,공미학 마포홍대점,서울 마포구 양화로 162 카카오프렌즈 3층, 4.59," 1,793",Makeyousmile,3.21.목,"고구마빵 쫀독하니 맛나요,,🤤
귀여운 춘식이는 덤!",2024-04-07 - 20:52:55
1157,naver,13,공미학 마포홍대점,서울 마포구 양화로 162 카카오프렌즈 3층, 4.59," 1,793",pebble3915,23.10.22.일,카카오프렌즈샵에 있는 디저트카페입니다. 먹음직스럽고 모양도 이쁜 디저트가 많습니다. 인테리어도 동양스런 멋을 살린 특이한 컨셉입니다.,2024-04-07 - 20:52:55
1158,naver,13,공미학 마포홍대점,서울 마포구 양화로 162 카카오프렌즈 3층, 4.59," 1,793",shsjjsk,3.14.목,"카카오프렌즈 왔다가 카페까지 들려요~
인테리어는 멋지고 커피는 맛있는데 빵 상태가 별로네요 생긴게 제각각 개성 있어요 ^^;~~",2024-04-07 - 20:52:55
1159,naver,13,공미학 마포홍대점,서울 마포구 양화로 162 카카오프렌즈 3층, 4.59," 1,793",로또1등당첨되자,23.12.1.금,"부추 크림치즈 프레첼 기름진맛(?)이여서 아쉬워요ㅠ 부추는 겉에만 붙어잇고 안에는 없어영..
초코큐브 페스츄리 맛있어요",2024-04-07 - 20:52:56
1160,naver,13,공미학 마포홍대점,서울 마포구 양화로 162 카카오프렌즈 3층, 4.59," 1,793",milky11,1.7.일,생각보다 베이커리 종류가 많고 넓은편인데 맛은 가격대비 평범하고 좌석이 그렇게 편한편은 아니네요,2024-04-07 - 20:52:56
1161,naver,13,공미학 마포홍대점,서울 마포구 양화로 162 카카오프렌즈 3층, 4.59," 1,793",lio****,23.11.20.월,"모히또, 자몽에이드 맛있어요ㅎ
디저트들도 맛있고.. 가격이 쪼금 사악하지만..
가끔 한번 가볼만한 곳^^",2024-04-07 - 20:52:56
1162,naver,13,공미학 마포홍대점,서울 마포구 양화로 162 카카오프렌즈 3층, 4.59," 1,793",김로밀,23.12.7.목,디저트 맛집인건 유명한 공미학 인테리어도 고즈넉하고 멋졌음~~!,2024-04-07 - 20:52:56
1163,naver,13,공미학 마포홍대점,서울 마포구 양화로 162 카카오프렌즈 3층, 4.59," 1,793",du****,2.12.월,춘식이 고구마빵이 예상치 못하게 맛나네용 ㅋ⫬ㅋ⫬ㅋ⫬ㅋ⫬ㅋ,2024-04-07 - 20:52:56
1164,naver,13,공미학 마포홍대점,서울 마포구 양화로 162 카카오프렌즈 3층, 4.59," 1,793",아아7550,3.1.금,미학시리즈들 다 맛있어요,2024-04-07 - 20:52:56
1165,naver,13,공미학 마포홍대점,서울 마포구 양화로 162 카카오프렌즈 3층, 4.59," 1,793",냠75,2.4.일,"인테리어 예뻐서 사진 찍기 좋아요!
음료랑 디저트 종류가 다양하고 맛있어요!
안경 쓰신 여자 직원분 정말 친절해요!
맛있고 기분 좋은 카페 또 오고 싶어요!",2024-04-07 - 20:52:56
1166,naver,13,공미학 마포홍대점,서울 마포구 양화로 162 카카오프렌즈 3층, 4.59," 1,793",까칠한 제비,23.10.18.수,"조용하고 깔끔하고 베이커리도 좋으네요.
아이들과 어른이 같이와도 좋은곳입니다",2024-04-07 - 20:52:56
1167,naver,13,공미학 마포홍대점,서울 마포구 양화로 162 카카오프렌즈 3층, 4.59," 1,793",cwz****,23.12.25.월,크리스마스 날에 사람 많음거 이해하지만 음식의 quality ㅁ많이 떨어져서 진짜 화가 나요 ~ 빵 3개 시켰는데 고구마 빵이 데워주지도 않았고 완전 맛없었어요 . 다른 빵들도 딱딱하고 완전 맛없어요 ~친구랑 같이 먹는데 바빠서 칼 없다고 칼도 안 주고 ~진심으로 추천 하지않습니다.,2024-04-07 - 20:52:56
1168,naver,13,공미학 마포홍대점,서울 마포구 양화로 162 카카오프렌즈 3층, 4.59," 1,793",AliceEJ,1.9.화,"너무 이색적이고 조용하고 디저트가 맛있어요! 
라벤더 꽃차는 진짜 라벤더가 들어있어요!!! 향이너무 좋아요",2024-04-07 - 20:52:56
1169,naver,13,공미학 마포홍대점,서울 마포구 양화로 162 카카오프렌즈 3층, 4.59," 1,793",굴국72,2.4.일,검은뿔테 안경쓰시고 검은마스크낀 여자 알바분 너무 친절하셨어요 감사합니다!!,2024-04-07 - 20:52:56
1170,naver,13,공미학 마포홍대점,서울 마포구 양화로 162 카카오프렌즈 3층, 4.59," 1,793",dhfls2,3.1.금,공미학.. ㅇㅁㅇ... ㅇ3ㅇ..,2024-04-07 - 20:52:56
1171,naver,13,공미학 마포홍대점,서울 마포구 양화로 162 카카오프렌즈 3층, 4.59," 1,793",2000mdlion,2.24.토,음료는 그냥 그런데 인테리어랑 빵이 너무 맛있어요 ㅠㅠ,2024-04-07 - 20:52:56
1172,naver,13,공미학 마포홍대점,서울 마포구 양화로 162 카카오프렌즈 3층, 4.59," 1,793",mickey7,23.11.10.금,매장이 엄청 넓고 역 바로앞에있어서 접근성이 좋아요! 메뉴도 독특하고 맛있네요!,2024-04-07 - 20:52:56
1173,naver,13,공미학 마포홍대점,서울 마포구 양화로 162 카카오프렌즈 3층, 4.59," 1,793",Firework14,23.9.24.일,카카오 프렌즈샵 3층!!! 디저트 음료 맛있고 카페 분위기 좋네요! 재방문 의사 있음!!!!,2024-04-07 - 20:52:56
1174,naver,13,공미학 마포홍대점,서울 마포구 양화로 162 카카오프렌즈 3층, 4.59," 1,793",장군바위55,3.3.일,사진찍기 좋아요,2024-04-07 - 20:52:56
1175,naver,13,공미학 마포홍대점,서울 마포구 양화로 162 카카오프렌즈 3층, 4.59," 1,793",행복맘05,23.8.5.토,"카카오프렌즈 홍대 플래그십 스토어 3층에 있어요
2층 카카오프렌즈 인생네컷 찍고 1인1음료 주문하면 구겔호프 4종 중 하나 무료 제공이라 좋더라고요
아이와가기 좋아요",2024-04-07 - 20:52:56
1176,naver,13,공미학 마포홍대점,서울 마포구 양화로 162 카카오프렌즈 3층, 4.59," 1,793",9호S형,23.9.8.금,"인테리어가 한국적이면서 멋있어요 :) 
음료랑 아이스크림도 맛있었고 
비교적 조용한 편이라 차분하게 쉬다 가기 좋음 :)",2024-04-07 - 20:52:56
1177,naver,13,공미학 마포홍대점,서울 마포구 양화로 162 카카오프렌즈 3층, 4.59," 1,793",예은86,1.27.토,맛꿀마,2024-04-07 - 20:52:56
1178,naver,13,공미학 마포홍대점,서울 마포구 양화로 162 카카오프렌즈 3층, 4.59," 1,793",jjy7608,23.7.6.목,"오랫만에 홍대 나들이 했어요
날은 더우니 이런데 들어와 종일 있다가고싶네요
생각보다 빵들이 많지는 않고 페스츄리 종류들이 좀 있네요

이름으로는 정체를 알수 없는 친구의 미학은 아이스크림이네요",2024-04-07 - 20:52:56
1179,naver,13,공미학 마포홍대점,서울 마포구 양화로 162 카카오프렌즈 3층, 4.59," 1,793",밤하늘32,1.14.일,예쁘고 맛있는 빵이 많아요,2024-04-07 - 20:52:56
1180,naver,13,공미학 마포홍대점,서울 마포구 양화로 162 카카오프렌즈 3층, 4.59," 1,793",식215,23.11.21.화,공간고 좋고 음료도 맛있어요,2024-04-07 - 20:52:56
1181,naver,13,공미학 마포홍대점,서울 마포구 양화로 162 카카오프렌즈 3층, 4.59," 1,793",jsu****,23.8.13.일,"춘식이 캐릭터를 좋아해서 카카오프렌즈 갔다가 카페도 있어서 맛있게 보이는 거들 골라서 먹어보고 맛있다고 다음에 또 오자고하네요
캐릭터 빵이 이뻐요~",2024-04-07 - 20:52:56
1182,naver,13,공미학 마포홍대점,서울 마포구 양화로 162 카카오프렌즈 3층, 4.59," 1,793",이쁘니원,23.8.19.토,빵 종류도 많고 너무 예뻐서 한참을 서성거렸네요~~~ㅎㅎ 역시나 맛도 있습니다!!^^,2024-04-07 - 20:52:56
1183,naver,13,공미학 마포홍대점,서울 마포구 양화로 162 카카오프렌즈 3층, 4.59," 1,793",Ella01,2.4.일,굿,2024-04-07 - 20:52:56
1184,naver,13,공미학 마포홍대점,서울 마포구 양화로 162 카카오프렌즈 3층, 4.59," 1,793",굥이로운세상,23.7.23.일,"카카오 구경하고 다리 아파서 올라왔는데 너무 마음에 들어요

빵들이 다 예뻐서 보는 즐거움이👍👍👍

커피 담긴 잔도",2024-04-07 - 20:52:56
1185,naver,13,공미학 마포홍대점,서울 마포구 양화로 162 카카오프렌즈 3층, 4.59," 1,793",청룡동잇프피,23.12.3.일,,2024-04-07 - 20:52:56
1186,naver,13,공미학 마포홍대점,서울 마포구 양화로 162 카카오프렌즈 3층, 4.59," 1,793",inf****,23.9.9.토,"바캉수박주스 ₩6,800
 : 시럽 없이 수박만 있는 찐수박주스. 
 단, 수박의 당도에 따라 주스의 맛이 변화가 있어요
연유버터프레첼 ₩5,500
 : 따뜻하게 데워주면 좋겠어요",2024-04-07 - 20:52:57
1187,naver,13,공미학 마포홍대점,서울 마포구 양화로 162 카카오프렌즈 3층, 4.59," 1,793",놀고먹는살찌니,23.7.29.토,"홍대 카카오프렌즈샵에 들렀다가 윗층에 카페가 있길래 호기심에 방문했는데요!
인테리어도 멋지고, 공미학의 의미도 멋지더라구요😊
더운날씨에 선라이즈에이드도 상콤하니 맛있었어요🧡",2024-04-07 - 20:52:57
1188,naver,13,공미학 마포홍대점,서울 마포구 양화로 162 카카오프렌즈 3층, 4.59," 1,793",mogupiyo,23.8.3.목,"자몽에이드 맛있고
직원님이 멋지고 좋았어요 ㅋㅋ
사진 찍어줘서 감사합니다~~부끄부끄",2024-04-07 - 20:52:57
1189,naver,13,공미학 마포홍대점,서울 마포구 양화로 162 카카오프렌즈 3층, 4.59," 1,793",동팔군,23.8.26.토,"분주한 밖의거리와는 다르게 조용하게 특별한 베이커리와 쉴수 있는곳입니다~~~
망고케이크 달콤하고 커피와 잘어울립니다.
카카오 캐릭터 베이커리 때문에 아이들도 좋아하네여..^^",2024-04-07 - 20:52:57
1190,naver,13,공미학 마포홍대점,서울 마포구 양화로 162 카카오프렌즈 3층, 4.59," 1,793",피버양,23.9.9.토,"좌석이 불편하고 가격이 비싸지만
버터프레첼이랑 자몽에이드는 진짜 맛있습니다",2024-04-07 - 20:52:57
1191,naver,13,공미학 마포홍대점,서울 마포구 양화로 162 카카오프렌즈 3층, 4.59," 1,793",02****,23.11.26.일,,2024-04-07 - 20:52:57
1192,naver,13,공미학 마포홍대점,서울 마포구 양화로 162 카카오프렌즈 3층, 4.59," 1,793",kan****,1.18.목,,2024-04-07 - 20:52:57
1193,naver,13,공미학 마포홍대점,서울 마포구 양화로 162 카카오프렌즈 3층, 4.59," 1,793",adoravelys2,23.4.29.토,"예쁜사진도 건지고
카카오프렌즈 구경하기도 딱좋았어요🤗🌹 
핫플레이스답게 사람이 엄청나네요!
귀여운 ᙏ̤̫͚ 모양 달고나 라떼 강추🖤 
역 바로 코앞이라 찾아가기도 편함 
귀여운 카카오 아가들 구경도하고🤍
달달 디저트랑 음료도 맛보고🤍
좋은시간 보내구 왔어영🤍",2024-04-07 - 20:52:57
1194,naver,13,공미학 마포홍대점,서울 마포구 양화로 162 카카오프렌즈 3층, 4.59," 1,793",지니지니 didiglgl15,23.4.19.수,"넓은 내부와 다양한 좌석으로 연인과의 데이트 장소나 회의나 단체 모임하기에도 좋을 듯해요.
귀여운 소품들 구경할거리도 많아서 좋고, 음료부터 베이커리까지 종류도 다양한데 비주얼도 예뿌고 맛도 좋아요💗 포토존도 있어서 사진 남기기에도 좋답니당 >.<",2024-04-07 - 20:52:57
1195,naver,13,공미학 마포홍대점,서울 마포구 양화로 162 카카오프렌즈 3층, 4.59," 1,793",쏭에리,23.7.31.월,맛있어요~ 사진찍으면 잘 나와서 좋아요!,2024-04-07 - 20:52:57
1196,naver,13,공미학 마포홍대점,서울 마포구 양화로 162 카카오프렌즈 3층, 4.59," 1,793",lovely00000,2.4.일,굿굿,2024-04-07 - 20:52:57
1197,naver,13,공미학 마포홍대점,서울 마포구 양화로 162 카카오프렌즈 3층, 4.59," 1,793",Aiden R,23.10.2.월,한국과 너무나도 다른 음악소리가 너무나도 시끄러웠습니다. 공간은 한국적으로 꾸며놓고 음악은 너무 따로 노네요.,2024-04-07 - 20:52:57
1198,naver,13,공미학 마포홍대점,서울 마포구 양화로 162 카카오프렌즈 3층, 4.59," 1,793",에마도나,23.5.15.월,카카오프렌즈 구경하다가 3층에 올라가보니 분위기가 멋진 카페 가있더라구요ㅎㅎ 맛있는디저트랑 다양한 커피들이 많아서 신기했는데요! 봄이랑 딱어울리는 스프링 리미티드 세트가 있는데요 비주얼 정말이뻐요😄 아이스 마포의미학 /말차초코 구겔호프 나오더라구요! 음료한개는 친구의미학 주문했는데요ㅎㅎ녹차가루 잘 섞어서 아이크림에 위에 뿌려서 먹는 신박한 아이스크림 맛있어요!!ㅎㅎ 더운날씨에 맛있는거먹으면서 푹쉬어서 좋았던거같아요ㅎㅎ이쁘고 멋있는 포토존도 많으니 여기오시면 꼭 사진 남기고 가세요😚,2024-04-07 - 20:52:57
1199,naver,13,공미학 마포홍대점,서울 마포구 양화로 162 카카오프렌즈 3층, 4.59," 1,793",Bongbong00,23.6.24.토,"베이커리류와 음료 모두 다양해서 고르는 재미가 있네요. 돌과 나무, 물의 자연스러운 배경 가운데 달 오브제가 공미학만의 인테리어 철학(!)을 보여주는 것 같아요 재미있는 공간이에요",2024-04-07 - 20:52:57
1200,naver,13,공미학 마포홍대점,서울 마포구 양화로 162 카카오프렌즈 3층, 4.59," 1,793",차뇽21,23.4.25.화,"새로 나온 봄 에디션디저트는 말차, 녹차 베이스를 좋아하시는 분들에겐 정말 취향저격입니다. 엄청 달거나 쓰지 않아서 맛있고, 고풍스러운 한국의 느낌을 카페로 재현한 것 같아서 힐링하고 가는 기분이 들었습니다.",2024-04-07 - 20:52:57
1201,naver,13,공미학 마포홍대점,서울 마포구 양화로 162 카카오프렌즈 3층, 4.59," 1,793",CNS63,23.8.14.월,디저트가 너~~~~무 맛있었당! 2층 네컷사진 찍은거 보여주면 디저트 1개 무료!! 2층 사진은 5천원.,2024-04-07 - 20:52:57
1202,naver,13,공미학 마포홍대점,서울 마포구 양화로 162 카카오프렌즈 3층, 4.59," 1,793",ElVA,23.8.12.토,시그니쳐 메뉴 맛있고 이야기하기 좋아요. 오래 있어도 눈치 안보여서 좋아요.,2024-04-07 - 20:52:57
1203,naver,13,공미학 마포홍대점,서울 마포구 양화로 162 카카오프렌즈 3층, 4.59," 1,793",party밀짱,23.3.26.일,"2023년 토끼해를 맞이해서, 너무너무맛있는 음료를 마시러왔어요! 시그니처 메뉴가 하나같이 달지않고 맛있고, 카카오프렌즈 위에 있어서 쇼핑도하고 카페도가고 너무좋았습니다🤍🤍🤍🤍 공미학 강추해유",2024-04-07 - 20:52:57
1204,naver,13,공미학 마포홍대점,서울 마포구 양화로 162 카카오프렌즈 3층, 4.59," 1,793",uta****,23.6.23.금,음료 맛있음 특히 음료수 위에 올려져 있는 쿠키가 최고존엄. 인테리어 예쁘고 노래선곡 좋으며 매장 깔끔함,2024-04-07 - 20:52:57
